Synergy!ID,HistoryID,性別,年代,居住市町村,業種,その他業種,観光は悪い影響を上回る良い影響があると思う,やんばるエリアは観光地であるべき（積極的に観光客を受け入れるべき）だと思う,やんばるエリアは今後も更なる観光振興を進めるべきと思う,やんばるエリアの観光振興を支援していきたいと思う,企業・事業者数等の増加により地域経済が活性化している,地域の景観が良くなっている,地域の文化の保全・継承につながっている,地域の生活環境の改善・向上につながっている,地域に活気が生まれ転出者が減っている（転入者が増えている）,地域の買い物環境やレクリエーション環境が改善している,地域の交通環境（道路・駐車場整備等）が改善している,地域の商店街が活性化している,地域に訪れる観光客を歓迎している,地域住民と観光客の間で交流が生まれている,観光・観光客のおかげで、企業等への就業機会の向上につながっていると感じる,観光振興により自然・景観環境を守っていきたいと思う,観光・観光客のおかげで自分たちは独特の文化をもっていると感じる,観光・観光客のおかげであなたの住む地域の特徴を継承していきたいと思う,観光・観光客のおかげであなたの住む地域に誇りを持てる,観光・観光客のおかげであなたの住む地域のおすすめの場所をほかの人に教えたいと思う,観光振興により同じ地域に住む住民同士の関係性が強化されると思う,観光・観光客のおかげで買い物する場やレジャー環境が充実していると思う,あなたの日常生活での移動（通勤・通学）環境が改善したと思う,観光振興により旅行者との良い出会いが生まれると思う,観光客のおかげで他者への偏見が減り、他者への理解が深まると思う,定期的に知りたい情報_ALL,定期的に知りたい情報_来訪者の消費額,定期的に知りたい情報_来訪者の消費単価,定期的に知りたい情報_延べ宿泊者数,定期的に知りたい情報_来訪者満足度,定期的に知りたい情報_リピーター率,定期的に知りたい情報_住民満足度,定期的に知りたい情報_地域への経済波及効果,定期的に知りたい情報_活動実績,定期的に知りたい情報_その他,定期的に知りたい情報_その他_text,定期的に知りたい情報_特になし,やんばるエリアが持つ魅力_ALL,やんばるエリアが持つ魅力_豊かな自然景観,やんばるエリアが持つ魅力_地元の食文化,やんばるエリアが持つ魅力_琉球の歴史・文化,やんばるエリアが持つ魅力_のんびりとした時間の流れ,やんばるエリアが持つ魅力_地域住民の人柄,やんばるエリアが持つ魅力_その他,やんばるエリアが持つ魅力_その他_text,やんばるエリアにおいておすすめしたい体験等_ALL,やんばるエリアにおいておすすめしたい体験等_自然の景観・体験,やんばるエリアにおいておすすめしたい体験等_地元の料理,やんばるエリアにおいておすすめしたい体験等_地域産品・お土産,やんばるエリアにおいておすすめしたい体験等_伝統・文化,やんばるエリアにおいておすすめしたい体験等_お祭り・イベント,やんばるエリアにおいておすすめしたい体験等_地域住民との交流,やんばるエリアにおいておすすめしたい体験等_その他,やんばるエリアにおいておすすめしたい体験等_その他_text,やんばるエリアでの暮らしの幸福度,5年後のやんばるエリアでの暮らしの幸福度,やんばるエリアの「持続可能な観光地」としての満足度,居住地域の誇りにしていること,観光客に伝えたい魅力,やんばるの観光について、ご意見,回答日時
2659,57,女性,40代,本部町,その他,観光業,やや思う,どちらでもない,どちらでもない,どちらでもない,やや思う,やや思う,あまり思わない,どちらでもない,やや思う,やや思う,やや思う,あまり思わない,やや思う,あまり思わない,どちらでもない,とても思う,どちらでもない,どちらでもない,どちらでもない,やや思う,やや思う,あまり思わない,あまり思わない,あまり思わない,あまり思わない,住民満足度,0,0,0,0,0,1,0,0,0,,0,"豊かな自然景観,のんびりとした時間の流れ,地域住民の人柄",1,0,0,1,1,0,,"地元の料理,地域産品・お土産,お祭り・イベント",0,1,1,0,1,0,0,,7,8,どちらでもない,,,"観光客が増えるのは良いことだと思いますが、自然環境への影響が心配です。
山原の自然を守りながら、観光客の誘致にもつながればと思います。
観光客が増えると、特に、外国からの観光客によって外来種が持ち込まれ、生態系が変わる可能性がある。いなくなる恐れがある。それだけはどうしても避けたいと強く思います。",2025-12-12 10:01:33
2666,58,女性,40代,名護市,学術研究、専門、技術サービス業,,あまり思わない,あまり思わない,あまり思わない,やや思う,あまり思わない,まったく思わない,あまり思わない,どちらでもない,あまり思わない,どちらでもない,どちらでもない,あまり思わない,やや思う,あまり思わない,あまり思わない,やや思う,あまり思わない,あまり思わない,あまり思わない,あまり思わない,あまり思わない,あまり思わない,あまり思わない,どちらでもない,やや思う,"来訪者の消費額,来訪者の消費単価,延べ宿泊者数,リピーター率,地域への経済波及効果",1,1,1,0,1,0,1,0,0,,0,"豊かな自然景観,地元の食文化,琉球の歴史・文化",1,1,1,0,0,0,,"自然の景観・体験,地元の料理,地域産品・お土産,伝統・文化,お祭り・イベント",1,1,1,1,1,0,0,,8,6,大変不満,公立学校に通う小中学校生が地域の方たちと連携した授業プログラムを受講できること。,安っぽい観光PRではなく、世界自然遺産に登録されたやんばる地域の生態系、環境、文化的景観についての説明、保全のためにどのように取り組んでいるのか具体的に伝えてほしい。,"沿岸域の環境を汚染しないために、下水道を早急に整えること。また、海岸を占有するホテル・リゾートの建設、私有地化は反対する。
辺野古の米軍基地の建設が今後も続き、現在のように台湾有事の危険性が高まると、観光振興は難しいと思う。基地建設に伴い、景観はとても悪くなっている。大型工事車両が地域を走行するのが常態となっており、道路・環境状態、景観に関してかなりマイナス印象を与える。",2025-12-12 11:31:12
2668,59,男性,50代,名護市,生活関連サービス業,,とても思う,やや思う,やや思う,やや思う,やや思う,どちらでもない,やや思う,やや思う,やや思う,あまり思わない,あまり思わない,どちらでもない,やや思う,あまり思わない,やや思う,とても思う,どちらでもない,やや思う,とても思う,とても思う,どちらでもない,あまり思わない,どちらでもない,やや思う,やや思う,"来訪者の消費額,来訪者の消費単価,来訪者満足度,リピーター率,住民満足度,地域への経済波及効果",1,1,0,1,1,1,1,0,0,,0,"豊かな自然景観,のんびりとした時間の流れ",1,0,0,1,0,0,,自然の景観・体験,1,0,0,0,0,0,0,,5,4,どちらでもない,,,,2025-12-12 12:16:25
2672,60,男性,40代,大宜味村,お仕事をされていない,,あまり思わない,あまり思わない,あまり思わない,どちらでもない,どちらでもない,あまり思わない,どちらでもない,どちらでもない,あまり思わない,どちらでもない,まったく思わない,まったく思わない,あまり思わない,やや思う,あまり思わない,まったく思わない,やや思う,あまり思わない,まったく思わない,あまり思わない,あまり思わない,あまり思わない,あまり思わない,あまり思わない,まったく思わない,特になし,0,0,0,0,0,0,0,0,0,,1,"豊かな自然景観,地元の食文化,琉球の歴史・文化,のんびりとした時間の流れ,地域住民の人柄",1,1,1,1,1,0,,"自然の景観・体験,地域住民との交流",1,0,0,0,0,1,0,,9,9,どちらでもない,,,,2025-12-12 13:38:11
2688,61,女性,60代,名護市,学術研究、専門、技術サービス業,,とても思う,やや思う,やや思う,とても思う,どちらでもない,どちらでもない,どちらでもない,どちらでもない,どちらでもない,あまり思わない,どちらでもない,あまり思わない,やや思う,あまり思わない,どちらでもない,とても思う,とても思う,とても思う,やや思う,とても思う,あまり思わない,あまり思わない,あまり思わない,どちらでもない,やや思う,"来訪者の消費額,来訪者の消費単価,延べ宿泊者数,来訪者満足度,リピーター率,住民満足度,地域への経済波及効果",1,1,1,1,1,1,1,0,0,,0,"豊かな自然景観,地元の食文化,琉球の歴史・文化,のんびりとした時間の流れ,地域住民の人柄",1,1,1,1,1,0,,"自然の景観・体験,地元の料理,伝統・文化,お祭り・イベント,地域住民との交流",1,1,0,1,1,1,0,,8,8,満足,移住者の為、まだ居住している期間は短いが、美ら海水族館をはじめ自然の美しさは誇りに思っている。やんばるの国頭村などはまだ行ったことが無いので行ってみたい。名護市は家賃が高い割には都会とも言い切れず、中途半端な印象。,亜熱帯地方独自の植物の面白さ。海だけではなくマングローブ林のカヌー体験や果物が豊富なので、バナナやパパイヤ、マンゴーなど味わってほしい。,"バナナやパパイヤ、マンゴーなどフルーツ狩りを体験したい。
名護市にカルディ、ニトリ、映画館には参入してほしい。
新幹線をなら那覇→名護間１５分から２０分で行けるのでは？",2025-12-12 17:27:42
2689,62,女性,60代,今帰仁村,医療、福祉,,どちらでもない,どちらでもない,どちらでもない,やや思う,どちらでもない,あまり思わない,やや思う,あまり思わない,やや思う,まったく思わない,あまり思わない,まったく思わない,やや思う,やや思う,どちらでもない,とても思う,どちらでもない,とても思う,あまり思わない,どちらでもない,どちらでもない,どちらでもない,どちらでもない,やや思う,やや思う,"延べ宿泊者数,来訪者満足度,リピーター率,住民満足度",0,0,1,1,1,1,0,0,0,,0,"豊かな自然景観,琉球の歴史・文化,のんびりとした時間の流れ",1,0,1,1,0,0,,自然の景観・体験,1,0,0,0,0,0,0,,8,9,どちらでもない,"・今帰仁城
・海洋博公園・沖縄美ら海水族館
・緋寒桜
・古宇利島・伊是名・伊平屋島の伝説
・伊江島タッチュウ（沖縄戦歴史）
・辺戸岬までの村民が大切にしている文化
・今帰仁野菜",上記同様,"海洋博公園前または水族館前にバスターミナル
名護市内⇄本部町モノレール
北部に飛行場",2025-12-12 17:41:01