Synergy!ID,HistoryID,性別,年代,居住市町村,業種,その他業種,観光は悪い影響を上回る良い影響があると思う,やんばるエリアは観光地であるべき（積極的に観光客を受け入れるべき）だと思う,やんばるエリアは今後も更なる観光振興を進めるべきと思う,やんばるエリアの観光振興を支援していきたいと思う,企業・事業者数等の増加により地域経済が活性化している,地域の景観が良くなっている,地域の文化の保全・継承につながっている,地域の生活環境の改善・向上につながっている,地域に活気が生まれ転出者が減っている（転入者が増えている）,地域の買い物環境やレクリエーション環境が改善している,地域の交通環境（道路・駐車場整備等）が改善している,地域の商店街が活性化している,地域に訪れる観光客を歓迎している,地域住民と観光客の間で交流が生まれている,観光・観光客のおかげで、企業等への就業機会の向上につながっていると感じる,観光振興により自然・景観環境を守っていきたいと思う,観光・観光客のおかげで自分たちは独特の文化をもっていると感じる,観光・観光客のおかげであなたの住む地域の特徴を継承していきたいと思う,観光・観光客のおかげであなたの住む地域に誇りを持てる,観光・観光客のおかげであなたの住む地域のおすすめの場所をほかの人に教えたいと思う,観光振興により同じ地域に住む住民同士の関係性が強化されると思う,観光・観光客のおかげで買い物する場やレジャー環境が充実していると思う,あなたの日常生活での移動（通勤・通学）環境が改善したと思う,観光振興により旅行者との良い出会いが生まれると思う,観光客のおかげで他者への偏見が減り、他者への理解が深まると思う,定期的に知りたい情報_ALL,定期的に知りたい情報_来訪者の消費額,定期的に知りたい情報_来訪者の消費単価,定期的に知りたい情報_延べ宿泊者数,定期的に知りたい情報_来訪者満足度,定期的に知りたい情報_リピーター率,定期的に知りたい情報_住民満足度,定期的に知りたい情報_地域への経済波及効果,定期的に知りたい情報_活動実績,定期的に知りたい情報_その他,定期的に知りたい情報_その他_text,定期的に知りたい情報_特になし,やんばるエリアが持つ魅力_ALL,やんばるエリアが持つ魅力_豊かな自然景観,やんばるエリアが持つ魅力_地元の食文化,やんばるエリアが持つ魅力_琉球の歴史・文化,やんばるエリアが持つ魅力_のんびりとした時間の流れ,やんばるエリアが持つ魅力_地域住民の人柄,やんばるエリアが持つ魅力_その他,やんばるエリアが持つ魅力_その他_text,やんばるエリアにおいておすすめしたい体験等_ALL,やんばるエリアにおいておすすめしたい体験等_自然の景観・体験,やんばるエリアにおいておすすめしたい体験等_地元の料理,やんばるエリアにおいておすすめしたい体験等_地域産品・お土産,やんばるエリアにおいておすすめしたい体験等_伝統・文化,やんばるエリアにおいておすすめしたい体験等_お祭り・イベント,やんばるエリアにおいておすすめしたい体験等_地域住民との交流,やんばるエリアにおいておすすめしたい体験等_その他,やんばるエリアにおいておすすめしたい体験等_その他_text,やんばるエリアでの暮らしの幸福度,5年後のやんばるエリアでの暮らしの幸福度,やんばるエリアの「持続可能な観光地」としての満足度,居住地域の誇りにしていること,観光客に伝えたい魅力,やんばるの観光について、ご意見,回答日時
4393,253,女性,60代,東村,宿泊業,,とても思う,とても思う,とても思う,とても思う,やや思う,あまり思わない,あまり思わない,あまり思わない,まったく思わない,まったく思わない,あまり思わない,まったく思わない,とても思う,やや思う,まったく思わない,とても思う,やや思う,やや思う,やや思う,とても思う,どちらでもない,まったく思わない,あまり思わない,とても思う,どちらでもない,"延べ宿泊者数,リピーター率",0,0,1,0,1,0,0,0,0,,0,"豊かな自然景観,地域住民の人柄",1,0,0,0,1,0,,"自然の景観・体験,地元の料理,お祭り・イベント",1,1,0,0,1,0,0,,3,4,どちらでもない,地域の自然やイベント交流,ヤンバルの自然とか食文化人とかの交流を伝えたい,道の駅をもっと活性化して地元の食材をもっと出店して欲しです,2026-01-13 18:52:29
4395,254,女性,70代,東村,その他,,とても思う,とても思う,とても思う,とても思う,やや思う,やや思う,やや思う,やや思う,やや思う,あまり思わない,あまり思わない,まったく思わない,やや思う,どちらでもない,あまり思わない,とても思う,あまり思わない,とても思う,どちらでもない,やや思う,あまり思わない,あまり思わない,あまり思わない,やや思う,やや思う,"来訪者の消費額,延べ宿泊者数,来訪者満足度,リピーター率,住民満足度,地域への経済波及効果,活動実績",1,0,1,1,1,1,1,1,0,,0,"豊かな自然景観,琉球の歴史・文化,のんびりとした時間の流れ,地域住民の人柄",1,0,1,1,1,0,,"自然の景観・体験,地元の料理,地域産品・お土産,伝統・文化,お祭り・イベント,地域住民との交流",1,1,1,1,1,1,0,,8,8,どちらでもない,,,,2026-01-13 19:28:23
4396,255,男性,60代,東村,農林漁業,,やや思う,やや思う,やや思う,やや思う,あまり思わない,あまり思わない,どちらでもない,あまり思わない,あまり思わない,まったく思わない,まったく思わない,まったく思わない,どちらでもない,どちらでもない,まったく思わない,やや思う,やや思う,どちらでもない,どちらでもない,やや思う,あまり思わない,まったく思わない,あまり思わない,どちらでもない,どちらでもない,"延べ宿泊者数,来訪者満足度,リピーター率,住民満足度,地域への経済波及効果",0,0,1,1,1,1,1,0,0,,0,"豊かな自然景観,のんびりとした時間の流れ",1,0,0,1,0,0,,自然の景観・体験,1,0,0,0,0,0,0,,4,4,不満,"■パインの村　
■沖縄県の水がめ",自然(海・山・川),"■空港からのアクセス改善
■道路環境改善(雑草・雑木・道路標識など)
■北部地区で宿泊して各地を巡れる環境作り
　※通過型観光からの脱却策
",2026-01-13 19:47:16
4398,256,男性,70代,東村,宿泊業,,どちらでもない,どちらでもない,どちらでもない,やや思う,まったく思わない,あまり思わない,あまり思わない,あまり思わない,あまり思わない,まったく思わない,まったく思わない,まったく思わない,どちらでもない,あまり思わない,やや思う,とても思う,どちらでもない,やや思う,やや思う,やや思う,あまり思わない,どちらでもない,どちらでもない,あまり思わない,あまり思わない,"住民満足度,地域への経済波及効果,活動実績",0,0,0,0,0,1,1,1,0,,0,"豊かな自然景観,のんびりとした時間の流れ",1,0,0,1,0,0,,自然の景観・体験,1,0,0,0,0,0,0,,6,3,不満,ヒルギ公園！,自然、時間のゆとり、,東村から国頭村にかけて日曜日になるとオートバイがうるさい😭‼️サーキットと間違えているかの如し！,2026-01-13 20:57:12
4399,257,男性,40代,東村,その他,アウトドアアクティビティ提供業,やや思う,やや思う,やや思う,やや思う,あまり思わない,どちらでもない,あまり思わない,やや思う,あまり思わない,あまり思わない,あまり思わない,あまり思わない,やや思う,あまり思わない,あまり思わない,とても思う,やや思う,やや思う,とても思う,とても思う,やや思う,あまり思わない,あまり思わない,どちらでもない,やや思う,"来訪者満足度,リピーター率,住民満足度,地域への経済波及効果",0,0,0,1,1,1,1,0,0,,0,"豊かな自然景観,地元の食文化,琉球の歴史・文化,のんびりとした時間の流れ,地域住民の人柄",1,1,1,1,1,0,,"自然の景観・体験,地元の料理,地域産品・お土産,伝統・文化,お祭り・イベント,地域住民との交流",1,1,1,1,1,1,0,,9,9,不満,やんばる世界自然遺産の自然環境、各村の各字に今も残る豊年祭などの各種の行事や踊り,"観光客としてではなく、旅人として、リゾート地とは違うのんびりと流れる時間の中で、自然の風と香りを感じ、地域住民との交流を楽しんでいただきたい。
","旅行者に対する接客や安全管理など、質の高い観光人材の育成により、沖縄県内はもとより、国内の他地域との差別化をさらに推進し、持続可能な観光を進めていただきたい。
また、旅行者に対しては、やんばる地域の自然や歴史、文化への敬意を持った責任ある来訪者として訪れてもらうための施策も、より一層拡充してほしい。",2026-01-13 21:03:51
4401,258,女性,60代,東村,医療、福祉,,やや思う,とても思う,やや思う,やや思う,どちらでもない,どちらでもない,どちらでもない,どちらでもない,とても思う,あまり思わない,どちらでもない,あまり思わない,やや思う,どちらでもない,どちらでもない,やや思う,やや思う,やや思う,やや思う,やや思う,どちらでもない,あまり思わない,あまり思わない,どちらでもない,どちらでもない,"住民満足度,地域への経済波及効果",0,0,0,0,0,1,1,0,0,,0,"豊かな自然景観,地域住民の人柄",1,0,0,0,1,0,,"自然の景観・体験,地域産品・お土産,お祭り・イベント",1,0,1,0,1,0,0,,5,5,どちらでもない,"四季折々における、文化&行事の継続、継承｡
(地域行事等含めて)",,・道路周囲の環境整備｡大木にて電柱、電線超えな場所が多々あり風が強い日には、枯れ木も落ち車運転時に不安なる時が有る。,2026-01-13 23:43:19