8988,8216,5泊,"5,000円以上 10,000円未満","リゾートホテルを楽しむ,地元の美味しいものを食べる,花見などの自然鑑賞,名所、旧跡の観光,アウトドア:ビーチ・海水浴,まちあるき・集落散策",0,1,1,1,1,0,0,0,0,0,0,0,1,0,0,0,1,0,0,0,0,0,0,,パートナー(恋人・夫婦など),,"Google map,インターネット・アプリ",0,0,0,0,0,0,0,0,1,1,0,0,0,0,0,0,0,0,0,0,,レンタカー,0,1,0,0,0,0,0,0,,"自家用車,路線バス,徒歩",1,0,0,0,1,1,0,0,,大変満足,好きな所に行けるから,4泊,名護市①：名護市街・カヌチャリゾート周辺エリア,名護市②：ブセナリゾート周辺エリア,名護市②：ブセナリゾート周辺エリア,名護市②：ブセナリゾート周辺エリア,,,,"10,000円以上 20,000円未満","5,000円未満","20,000円以上 30,000円未満","5,000円未満",2-3回目,1-3年前,必ず来たい,半年-1年後,大変満足,,9,人に知られない様な海が有るところ,ある,レンタカー移動以外が不便なこと,うふやんばる(国頭村・大宜味村・東村),辺戸岬,,島やんばる(伊江村・伊是名村・伊平屋村),伊江ビーチ,,使わない,大変満足,"普段見られない工場の作業が見られたこと。
出来立ての美味しいビールの試飲があったこと",Tシャツの種類を多くして下さい,9,工程が楽しい,女性,1957,東京都,400-600万円未満,名護市街エリア,名護市,2026-07-08 15:32:33
8989,8217,4泊,"30,000円以上 40,000円未満","花見などの自然鑑賞,アウトドア:ビーチ・海水浴,アウトドア:マリンスポーツ",0,0,0,1,0,0,0,0,0,0,0,0,1,1,0,0,0,0,0,0,0,0,0,,友人,,"Instagram,友人・知人",0,0,0,0,0,0,0,0,0,0,0,0,1,0,0,1,0,0,0,0,,レンタカー,0,1,0,0,0,0,0,0,,レンタカー,0,1,0,0,0,0,0,0,,満足,"借りる、返却がスムーズだった。
レンタカー、駐車場料金が比較的安い。
レンタカーが綺麗だった。
レンタカーがBluetooth繋げられないものであった。繋げられて、ドライブ中音楽をもっと楽しめてたら大変満足になりました！",3泊,恩納村：万座毛・青の洞窟・ハレクラニ周辺エリア,伊平屋村：伊平屋島エリア,伊平屋村：伊平屋島エリア,,,,,"50,000円以上 100,000円未満",使わない,"10,000円以上 20,000円未満","5,000円以上 10,000円未満",11回目以上,半年以内,必ず来たい,半年-1年後,大変満足,宿泊施設も、マリンスポーツの方もみなさん優しく楽しい時間を過ごせた。マリンスポーツは安かった。,9,自然が美しかった。特に海と星空。,ある,改善できるかわかりませんが、事故を起こして渋滞になっている道があった。一本道が多い印象があるため、違う道で目的に向かうためには大回りをする必要があった。もっと早目に渋滞がある場所を分かるツールがあれば便利だと思った。,門口(じょうぐち)やんばる(金武町・宜野座村・恩納村),その他,宿泊のみ,なかやんばる(名護市・本部町・今帰仁村),その他,渡久地港でダイビング,"5,000円以上 10,000円未満",大変満足,朝食が美味しかった。対応が丁寧で、臨機応変に対応してくれた。部屋が綺麗。,特になし。,8,宿泊で困ったことが特になかった。,女性,1997,東京都,600-800万円未満,伊平屋村エリア,伊平屋村,2026-07-08 15:53:25
8990,8218,日帰り,"5,000円未満","地元の美味しいものを食べる,名所、旧跡の観光,テーマパーク:沖縄美ら海水族館,アウトドア:キャンプ,ドライブ・ツーリング",0,0,1,0,1,1,0,0,0,0,0,0,0,0,0,1,0,0,0,1,0,0,0,,友人,,"Instagram,観光協会・空港・道の駅等の案内所",0,0,0,0,0,0,0,0,0,0,0,0,1,0,0,0,1,0,0,0,,自家用車,1,0,0,0,0,0,0,0,,自家用車,1,0,0,0,0,0,0,0,,,,やんばるエリアには宿泊しない,,,,,,,,"5,000円未満","5,000円未満","5,000円未満","5,000円未満",11回目以上,半年以内,必ず来たい,半年以内,やや満足,似たようなお店が多い,9,自然を感じる,ある,お腹すいても、食べる場所が少ない,なかやんばる(名護市・本部町・今帰仁村),その他,,中部,その他,恩納村道の駅,"5,000円未満",やや満足,"クーラーがきいてて
広々として快適。",おしゃれだけど値段が少したかめ,7,おしゃれな県産品,女性,1974,沖縄県,300-400万円未満,嵐山エリア,名護市,2026-07-08 16:03:04
8991,8219,日帰り,使わない,ドライブ・ツーリング,0,0,0,0,0,0,0,0,0,0,0,0,0,0,0,0,0,0,0,1,0,0,0,,友人,,友人・知人,0,0,0,0,0,0,0,0,0,0,0,0,0,0,0,1,0,0,0,0,,自家用車,1,0,0,0,0,0,0,0,,"自家用車,徒歩",1,0,0,0,0,1,0,0,,,,やんばるエリアには宿泊しない,,,,,,,,使わない,"5,000円未満","5,000円以上 10,000円未満","5,000円未満",11回目以上,半年以内,必ず来たい,半年以内,満足,,8,,ない,,なかやんばる(名護市・本部町・今帰仁村),その他,許田駅,中部,美浜アメリカンビレッジ,,"5,000円未満",満足,,,9,,男性,1989,沖縄県,400-600万円未満,万座毛エリア,恩納村,2026-07-08 16:18:39
8992,8220,日帰り,"5,000円未満",その他,0,0,0,0,0,0,0,0,0,0,0,0,0,0,0,0,0,0,0,0,0,0,1,ドライブ,パートナー(恋人・夫婦など),,"観光展・物産展,新聞・雑誌・ガイドブック,TV・ラジオ番組やCM,観光パンフレット・ポスター,インターネット・アプリ,YouTube,Twitter",1,1,1,1,0,0,0,0,0,1,1,1,0,0,0,0,0,0,0,0,,自家用車,1,0,0,0,0,0,0,0,,"自家用車,旅行会社ツアーバス,徒歩",1,0,0,1,0,1,0,0,,やや不満,,やんばるエリアには宿泊しない,,,,,,,,"5,000円未満","5,000円未満","5,000円以上 10,000円未満","5,000円未満",2-3回目,5年以上前,必ず来たい,1-3年後,満足,,8,,ない,,南部,平和祈念公園,,南部,首里城公園,,"5,000円未満",やや満足,,,7,,男性,1978,沖縄県,600-800万円未満,辺戸岬観光案内所エリア,国頭村,2026-07-08 16:27:56
8993,8221,3泊,"20,000円以上 30,000円未満","地元の美味しいものを食べる,名所、旧跡の観光",0,0,1,0,1,0,0,0,0,0,0,0,0,0,0,0,0,0,0,0,0,0,0,,友人,,"インターネット・アプリ,YouTube",0,0,0,0,0,0,0,0,0,1,1,0,0,0,0,0,0,0,0,0,,レンタカー,0,1,0,0,0,0,0,0,,レンタカー,0,1,0,0,0,0,0,0,,普通,レンタカーで、自分の好きなところにいける,やんばるエリアには宿泊しない,,,,,,,,"5,000円以上 10,000円未満","5,000円未満","5,000円未満","5,000円未満",初めて,,やや来たい,1-3年後,普通,まだエリアをよく知らない,6,"家族
景色がいい。",ない,,中部,美浜アメリカンビレッジ,,中部,美浜アメリカンビレッジ,,使わない,やや満足,景色に満足,,7,家族,女性,1980,沖縄県,300-400万円未満,辺戸岬観光案内所エリア,国頭村,2026-07-08 16:31:36
8994,8222,5泊,"5,000円以上 10,000円未満","宿でのんびり過ごす,地元の美味しいものを食べる,アウトドア:ビーチ・海水浴",1,0,1,0,0,0,0,0,0,0,0,0,1,0,0,0,0,0,0,0,0,0,0,,パートナー(恋人・夫婦など),,"観光展・物産展,観光パンフレット・ポスター,観光協会のHP,インターネット・アプリ",1,0,0,1,1,0,0,0,0,1,0,0,0,0,0,0,0,0,0,0,,レンタカー,0,1,0,0,0,0,0,0,,"レンタカー,路線バス",0,1,0,0,1,0,0,0,,大変不満,"路線バスの路線番号と行先が分かりにくい。
決済手段がバス会社で統一されていないので不便。",4泊,名護市①：名護市街・カヌチャリゾート周辺エリア,名護市①：名護市街・カヌチャリゾート周辺エリア,名護市①：名護市街・カヌチャリゾート周辺エリア,名護市①：名護市街・カヌチャリゾート周辺エリア,,,,"30,000円以上 40,000円未満","5,000円以上 10,000円未満","20,000円以上 30,000円未満","5,000円以上 10,000円未満",2-3回目,1-3年前,必ず来たい,1-3年後,満足,自然と美味しいものが堪能できる,10,オリオンハッピーパーク、東村うっぱまびーちと大宜味シークワーサーパーク,ない,,なかやんばる(名護市・本部町・今帰仁村),古宇利島(オーシャンタワー/ハートロック),,なかやんばる(名護市・本部町・今帰仁村),その他,エメラルドビーチ,"5,000円未満",満足,もう少しビールが安価だと嬉しい,,8,ビールができる過程,男性,1962,東京都,100-200万円未満,名護市街エリア,名護市,2026-07-08 18:10:48
8995,8223,3泊,"30,000円以上 40,000円未満","地元の美味しいものを食べる,花見などの自然鑑賞,アウトドア:ビーチ・海水浴",0,0,1,1,0,0,0,0,0,0,0,0,1,0,0,0,0,0,0,0,0,0,0,,未就学児を含む家族,,"観光展・物産展,YouTube",1,0,0,0,0,0,0,0,0,0,1,0,0,0,0,0,0,0,0,0,,レンタカー,0,1,0,0,0,0,0,0,,レンタカー,0,1,0,0,0,0,0,0,,大変満足,行動範囲が広くなる,3泊,国頭村：辺戸岬・オクマリゾート周辺エリア,国頭村：辺戸岬・オクマリゾート周辺エリア,国頭村：辺戸岬・オクマリゾート周辺エリア,,,,,"100,000円以上 200,000円未満","100,000円以上 200,000円未満","20,000円以上 30,000円未満","20,000円以上 30,000円未満",4-5回目,半年-1年前,必ず来たい,半年以内,大変満足,自然が大好き,10,絶滅危惧種の生き物に出会える,ない,,うふやんばる(国頭村・大宜味村・東村),辺戸岬,,うふやんばる(国頭村・大宜味村・東村),辺戸岬,,"5,000円以上 10,000円未満",大変満足,地魚を最大限使った美味しい料理,素敵な場所で、人生で1度は生活してみたい場所,10,地魚をお腹いっぱい楽しめる,女性,1997,東京都,600-800万円未満,道の駅ゆいゆい国頭エリア,国頭村,2026-07-08 19:13:32
8996,8224,4泊,"20,000円以上 30,000円未満","宿でのんびり過ごす,リゾートホテルを楽しむ,地元の美味しいものを食べる,名所、旧跡の観光,買い物、アウトレット,お祭りやイベントへの参加・見物,地域の行事,アウトドア:ビーチ・海水浴,ドライブ・ツーリング",1,1,1,0,1,0,0,0,1,1,1,0,1,0,0,0,0,0,0,1,0,0,0,,パートナー(恋人・夫婦など),,"Google map,インターネット・アプリ",0,0,0,0,0,0,0,0,1,1,0,0,0,0,0,0,0,0,0,0,,レンタカー,0,1,0,0,0,0,0,0,,レンタカー,0,1,0,0,0,0,0,0,,大変満足,自分のタイミングで自由に動ける,3泊,名護市①：名護市街・カヌチャリゾート周辺エリア,名護市①：名護市街・カヌチャリゾート周辺エリア,名護市①：名護市街・カヌチャリゾート周辺エリア,,,,,"20,000円以上 30,000円未満","10,000円以上 20,000円未満","10,000円以上 20,000円未満","20,000円以上 30,000円未満",6-10回目,半年-1年前,必ず来たい,半年以内,大変満足,ホテル、店舗スタッフの人柄に癒される,10,豊かな自然と美味しい翁料理,ない,,門口(じょうぐち)やんばる(金武町・宜野座村・恩納村),その他,カヌチャリゾート内のプールとビーチ,うふやんばる(国頭村・大宜味村・東村),その他,道の駅おおぎみやんばるの森,"5,000円未満",満足,風鈴まつりのコーラスとエイサーが良かった,道の駅は既に閉店時間を過ぎていたので、施設内は不明です。,8,那覇とは違ったやんばるの良さ,男性,1970,千葉県,400-600万円未満,今帰仁の駅そーれエリア,今帰仁村,2026-07-08 20:47:38
8997,8225,7泊以上,"20,000円以上 30,000円未満","地元の美味しいものを食べる,アウトドア:ビーチ・海水浴",0,0,1,0,0,0,0,0,0,0,0,0,1,0,0,0,0,0,0,0,0,0,0,,パートナー(恋人・夫婦など),,"インターネット・アプリ,Instagram",0,0,0,0,0,0,0,0,0,1,0,0,1,0,0,0,0,0,0,0,,レンタカー,0,1,0,0,0,0,0,0,,レンタカー,0,1,0,0,0,0,0,0,,大変満足,,やんばるエリアには宿泊しない,,,,,,,,使わない,"5,000円以上 10,000円未満","5,000円以上 10,000円未満","5,000円以上 10,000円未満",6-10回目,半年-1年前,必ず来たい,半年-1年後,大変満足,,10,,ない,,特になし,特に無し,,なかやんばる(名護市・本部町・今帰仁村),その他,エメラルドビーチ,"5,000円未満",満足,,,7,,男性,1968,沖縄県,400-600万円未満,道の駅許田・ブセナリゾートエリア,名護市,2026-07-08 23:46:43