Synergy!ID,HistoryID,宿泊数(県内),交通費,訪問目的(やんばるエリア)_ALL,訪問目的(やんばるエリア)_宿でのんびり過ごす,訪問目的(やんばるエリア)_リゾートホテルを楽しむ,訪問目的(やんばるエリア)_地元の美味しいものを食べる,訪問目的(やんばるエリア)_花見などの自然鑑賞,訪問目的(やんばるエリア)_名所、旧跡の観光,訪問目的(やんばるエリア)_テーマパーク:沖縄美ら海水族館,訪問目的(やんばるエリア)_テーマパーク:JUNGLIA,訪問目的(やんばるエリア)_テーマパーク:その他,訪問目的(やんばるエリア)_買い物、アウトレット,訪問目的(やんばるエリア)_お祭りやイベントへの参加・見物,訪問目的(やんばるエリア)_地域の行事,訪問目的(やんばるエリア)_スポーツ観戦や芸能鑑賞(コンサート等),訪問目的(やんばるエリア)_アウトドア:ビーチ・海水浴,訪問目的(やんばるエリア)_アウトドア:マリンスポーツ,訪問目的(やんばるエリア)_アウトドア:登山・トレッキング,訪問目的(やんばるエリア)_アウトドア:キャンプ,訪問目的(やんばるエリア)_まちあるき・集落散策,訪問目的(やんばるエリア)_各種体験(手作り、果物狩りなど),訪問目的(やんばるエリア)_その他スポーツ(ゴルフ、テニスなど),訪問目的(やんばるエリア)_ドライブ・ツーリング,訪問目的(やんばるエリア)_友人・親戚を尋ねる,訪問目的(やんばるエリア)_出張など仕事関係,訪問目的(やんばるエリア)_その他,訪問目的(やんばるエリア)_その他_text,同行者(やんばるエリア),同行者(やんばるエリア)_その他_text,情報収集(やんばるエリア)_ALL,情報収集(やんばるエリア)_観光展・物産展,情報収集(やんばるエリア)_新聞・雑誌・ガイドブック,情報収集(やんばるエリア)_TV・ラジオ番組やCM,情報収集(やんばるエリア)_観光パンフレット・ポスター,情報収集(やんばるエリア)_観光協会のHP,情報収集(やんばるエリア)_美ら海水族館等の観光関連事業者HP,情報収集(やんばるエリア)_宿泊事業者のHP,情報収集(やんばるエリア)_Chat GPT等の生成AI,情報収集(やんばるエリア)_Google map,情報収集(やんばるエリア)_インターネット・アプリ,情報収集(やんばるエリア)_YouTube,情報収集(やんばるエリア)_Twitter,情報収集(やんばるエリア)_Instagram,情報収集(やんばるエリア)_Facebook,情報収集(やんばるエリア)_ブログ,情報収集(やんばるエリア)_友人・知人,情報収集(やんばるエリア)_観光協会・空港・道の駅等の案内所,情報収集(やんばるエリア)_タクシードライバーや地元の人,情報収集(やんばるエリア)_宿泊施設,情報収集(やんばるエリア)_その他,情報収集(やんばるエリア)_その他_text,やんばるエリアまでの交通手段_ALL,やんばるエリアまでの交通手段_自家用車,やんばるエリアまでの交通手段_レンタカー,やんばるエリアまでの交通手段_ヘリコプター,やんばるエリアまでの交通手段_旅行会社ツアーバス,やんばるエリアまでの交通手段_フェリー,やんばるエリアまでの交通手段_路線バス、高速バス、シャトルバス,やんばるエリアまでの交通手段_タクシー,やんばるエリアまでの交通手段_その他,やんばるエリアまでの交通手段_その他_text,やんばるエリア内での交通手段_ALL,やんばるエリア内での交通手段_自家用車,やんばるエリア内での交通手段_レンタカー,やんばるエリア内での交通手段_タクシー,やんばるエリア内での交通手段_旅行会社ツアーバス,やんばるエリア内での交通手段_路線バス,やんばるエリア内での交通手段_徒歩,やんばるエリア内での交通手段_レンタサイクル,やんばるエリア内での交通手段_その他,やんばるエリア内での交通手段_その他_text,やんばるエリア内での交通手段の満足度,やんばるエリア内での交通手段の満足度の理由,宿泊数(やんばるエリア),宿泊地1泊目(やんばるエリア),宿泊地2泊目(やんばるエリア),宿泊地3泊目(やんばるエリア),宿泊地4泊目(やんばるエリア),宿泊地5泊目(やんばるエリア),宿泊地6泊目(やんばるエリア),宿泊地7泊目(やんばるエリア),宿泊費(やんばるエリア),観光費(やんばるエリア),飲食費(やんばるエリア),土産費(やんばるエリア),訪問回数(やんばるエリア),前回訪問時期(やんばるエリア),今後の来訪意向(やんばるエリア),今後の来訪時期(やんばるエリア),体験・サービス満足度(やんばるエリア),体験・サービス満足度の理由(やんばるエリア),推奨度(やんばるエリア),推奨項目(やんばるエリア),改善点(やんばるエリア),改善点の内容(やんばるエリア),回答前に訪問したエリア(調査地),回答前に訪問した主な施設(調査地),回答前に訪問した主な施設・その他(調査地),回答後に訪問予定のエリア(調査地),回答後に訪問予定の主な施設(調査地),回答後に訪問予定の主な施設・その他(調査地),現地消費額(調査地),体験・サービス満足度(調査地),体験・サービス満足度の理由(調査地),施設に求めるもの(調査地),施設推奨度(調査地),施設推奨項目(調査地),性別,生年,都道府県,世帯年収,訪問地のエリア名,訪問地の市町村,回答日時
8760,7991,3泊,"20,000円以上 30,000円未満",テーマパーク:JUNGLIA,0,0,0,0,0,0,1,0,0,0,0,0,0,0,0,0,0,0,0,0,0,0,0,,パートナー(恋人・夫婦など),,Google map,0,0,0,0,0,0,0,0,1,0,0,0,0,0,0,0,0,0,0,0,,レンタカー,0,1,0,0,0,0,0,0,,レンタカー,0,1,0,0,0,0,0,0,,満足,,1泊,本部町：美ら海水族館・瀬底島周辺エリア,,,,,,,"10,000円以上 20,000円未満","10,000円以上 20,000円未満","5,000円未満","5,000円以上 10,000円未満",11回目以上,半年以内,必ず来たい,半年-1年後,満足,,8,,ある,,南部,国際通り,,特になし,特に無し,,使わない,満足,,,8,,女性,1976,鹿児島県,答えられない,本部港周辺エリア,本部町,2026-06-30 08:37:01
8761,7992,2泊,"5,000円以上 10,000円未満","地元の美味しいものを食べる,まちあるき・集落散策",0,0,1,0,0,0,0,0,0,0,0,0,0,0,0,0,1,0,0,0,0,0,0,,自分ひとり,,"YouTube,Instagram",0,0,0,0,0,0,0,0,0,0,1,0,1,0,0,0,0,0,0,0,,レンタカー,0,1,0,0,0,0,0,0,,レンタカー,0,1,0,0,0,0,0,0,,満足,,やんばるエリアには宿泊しない,,,,,,,,"10,000円以上 20,000円未満","5,000円未満","10,000円以上 20,000円未満","10,000円以上 20,000円未満",6-10回目,1-3年前,必ず来たい,半年-1年後,大変満足,以前より道路環境がどんどん良くなっている。自然豊か。,9,沖縄そのものを感じられる。,ない,,中部,北谷サンセットビーチ,,南部,国際通り,,"20,000円以上 30,000円未満",満足,,,7,,女性,1974,兵庫県,400-600万円未満,名護市街エリア,名護市,2026-06-30 09:45:57
8762,7993,2泊,"20,000円以上 30,000円未満","地元の美味しいものを食べる,テーマパーク:沖縄美ら海水族館,テーマパーク:JUNGLIA",0,0,1,0,0,1,1,0,0,0,0,0,0,0,0,0,0,0,0,0,0,0,0,,中学生以上を含む家族(小学生以下は含まない),,"Chat GPT等の生成AI,その他",0,0,0,0,0,0,0,1,0,0,0,0,0,0,0,0,0,0,0,1,旅行本,レンタカー,0,1,0,0,0,0,0,0,,レンタカー,0,1,0,0,0,0,0,0,,満足,道や駐車場か狭いところが多くて、運転が大変,1泊,名護市①：名護市街・カヌチャリゾート周辺エリア,,,,,,,"10,000円以上 20,000円未満","10,000円以上 20,000円未満","5,000円以上 10,000円未満","5,000円以上 10,000円未満",2-3回目,5年以上前,来たい,3-5年後,満足,あまり混雑もなく回りたいところは行けたので,7,色々楽しめる,ある,ジャングリアの働いている方達が大変そうだったので、もっと待遇を良くしてあげて欲しい,なかやんばる(名護市・本部町・今帰仁村),JUNGLIA,,中部,その他,道の駅,"5,000円以上 10,000円未満",満足,いろんな意味でスリルいっぱい,"ふれあい広場を充実させる
ピラルクの水槽を綺麗にして欲しい",8,まじかな生き物と触れ合えて面白い,女性,1964,愛知県,600-800万円未満,嵐山エリア,名護市,2026-06-30 10:43:55
8763,7994,7泊以上,"100,000円以上","宿でのんびり過ごす,地元の美味しいものを食べる,テーマパーク:沖縄美ら海水族館,お祭りやイベントへの参加・見物,アウトドア:ビーチ・海水浴,アウトドア:マリンスポーツ,ドライブ・ツーリング,友人・親戚を尋ねる",1,0,1,0,0,1,0,0,0,1,0,0,1,1,0,0,0,0,0,1,1,0,0,,未就学児を含む家族,,"Google map,インターネット・アプリ,友人・知人",0,0,0,0,0,0,0,0,1,1,0,0,0,0,0,1,0,0,0,0,,レンタカー,0,1,0,0,0,0,0,0,,レンタカー,0,1,0,0,0,0,0,0,,大変満足,赤ちゃん連れの旅行で徒歩はきついので、レンタカーを借りれて便利に過ごせている,7泊以上,本部町：美ら海水族館・瀬底島周辺エリア,本部町：美ら海水族館・瀬底島周辺エリア,本部町：美ら海水族館・瀬底島周辺エリア,本部町：美ら海水族館・瀬底島周辺エリア,本部町：美ら海水族館・瀬底島周辺エリア,本部町：美ら海水族館・瀬底島周辺エリア,本部町：美ら海水族館・瀬底島周辺エリア,"100,000円以上 200,000円未満","10,000円以上 20,000円未満","40,000円以上 50,000円未満","5,000円以上 10,000円未満",4-5回目,3-5年前,必ず来たい,半年-1年後,大変満足,家族でのんびり過ごせて、日常もアクティビティも楽しめる,9,"ゲストハウス
赤ちゃん連れでもカップルでも、美味しい食事や人とのコミュニケーションを楽しめる",ない,,なかやんばる(名護市・本部町・今帰仁村),ナゴパイナップルパーク,,特になし,特に無し,,"10,000円以上 20,000円未満",大変満足,朝イチに来てすいており、マンタの餌やりが見れた,,8,"ジンベエザメ
間近で海に潜らずに見れるのはレアだから",女性,1989,東京都,1200-1500万円未満,海洋博公園・観光拠点エリア,本部町,2026-06-30 11:24:56
8764,7995,日帰り,"5,000円以上 10,000円未満","名所、旧跡の観光,ドライブ・ツーリング",0,0,0,0,1,0,0,0,0,0,0,0,0,0,0,0,0,0,0,1,0,0,0,,パートナー(恋人・夫婦など),,"観光展・物産展,観光パンフレット・ポスター",1,0,0,1,0,0,0,0,0,0,0,0,0,0,0,0,0,0,0,0,,自家用車,1,0,0,0,0,0,0,0,,自家用車,1,0,0,0,0,0,0,0,,,,やんばるエリアには宿泊しない,,,,,,,,"5,000円未満","5,000円未満","5,000円未満","5,000円未満",6-10回目,半年-1年前,必ず来たい,半年以内,満足,,8,,ある,お土産、飲食店,うふやんばる(国頭村・大宜味村・東村),やんばる野生生物保護センター,,南部,国際通り,,"5,000円未満",満足,,,8,,男性,1994,沖縄県,600-800万円未満,道の駅おおぎみエリア,大宜味村,2026-06-30 12:11:45
8765,7996,2泊,"10,000円以上 20,000円未満","地元の美味しいものを食べる,花見などの自然鑑賞,名所、旧跡の観光,まちあるき・集落散策,ドライブ・ツーリング",0,0,1,1,1,0,0,0,0,0,0,0,0,0,0,0,1,0,0,1,0,0,0,,友人,,"インターネット・アプリ,YouTube",0,0,0,0,0,0,0,0,0,1,1,0,0,0,0,0,0,0,0,0,,"レンタカー,フェリー",0,1,0,0,1,0,0,0,,レンタカー,0,1,0,0,0,0,0,0,,大変満足,"レンタカーが有ると、色んな所へ移動出来るので色んな場所で観光が出来るので大変レンタカーは良いと思います。
今回は、レンタカーでフェリーに乗りそのまま伊江島へ訪れました。",2泊,本部町：美ら海水族館・瀬底島周辺エリア,本部町：美ら海水族館・瀬底島周辺エリア,,,,,,"40,000円以上 50,000円未満","10,000円以上 20,000円未満","10,000円以上 20,000円未満","20,000円以上 30,000円未満",初めて,,来たい,半年-1年後,満足,,8,"のんびりしたい人にはおすすめ！
人もいっぱいじゃないのでのんびり時が過ぎて素敵です
",ない,,島やんばる(伊江村・伊是名村・伊平屋村),伊江島タッチュー,,島やんばる(伊江村・伊是名村・伊平屋村),伊是名城跡,,"5,000円未満",やや満足,"思ったより、ハイビスカスが咲いてない。
時期はずれなのかな？
",カート欲しい。二人乗りの。,5,,女性,1970,奈良県,100-200万円未満,伊江村エリア,伊江村,2026-06-30 13:48:46
8766,7997,2泊,"10,000円以上 20,000円未満","リゾートホテルを楽しむ,名所、旧跡の観光,まちあるき・集落散策",0,1,0,0,1,0,0,0,0,0,0,0,0,0,0,0,1,0,0,0,0,0,0,,友人,,"Chat GPT等の生成AI,Google map,YouTube",0,0,0,0,0,0,0,1,1,0,1,0,0,0,0,0,0,0,0,0,,レンタカー,0,1,0,0,0,0,0,0,,レンタカー,0,1,0,0,0,0,0,0,,満足,逆にレンタカー無しで観光が、難しいと思います,2泊,本部町：美ら海水族館・瀬底島周辺エリア,本部町：美ら海水族館・瀬底島周辺エリア,,,,,,"30,000円以上 40,000円未満","10,000円以上 20,000円未満","20,000円以上 30,000円未満","20,000円以上 30,000円未満",11回目以上,半年以内,来たい,半年-1年後,満足,未知との出会い,8,"自然の豊富さ
ノンビリ",ない,,なかやんばる(名護市・本部町・今帰仁村),その他,フクギ並木,南部,国際通り,,使わない,満足,ハイビスカスの種類の多さを知れた土産も,チャンとした土産物屋さんが有っても良いかも,6,ハイビスカスに興味が有れば勧めます,男性,1956,奈良県,答えられない,伊江村エリア,伊江村,2026-06-30 13:49:08
8767,7998,1泊,使わない,"地元の美味しいものを食べる,花見などの自然鑑賞,名所、旧跡の観光,買い物、アウトレット",0,0,1,1,1,0,0,0,1,0,0,0,0,0,0,0,0,0,0,0,0,0,0,,中学生以上を含む家族(小学生以下は含まない),,"観光展・物産展,Chat GPT等の生成AI,Google map,インターネット・アプリ,YouTube,Instagram",1,0,0,0,0,0,0,1,1,1,1,0,1,0,0,0,0,0,0,0,,レンタカー,0,1,0,0,0,0,0,0,,レンタカー,0,1,0,0,0,0,0,0,,大変満足,暑くて外を歩くのはしんどい,1泊,宜野座村：道の駅ぎのざ・松田鍾乳洞周辺エリア,,,,,,,"10,000円以上 20,000円未満","10,000円以上 20,000円未満","10,000円以上 20,000円未満","30,000円以上 40,000円未満",2-3回目,1-3年前,来たい,1-3年後,満足,人が良かった,7,暑さはしんどいが、アイスがうまい,ない,,南部,国際通り,,南部,その他,瀬長島,"10,000円以上 20,000円未満",満足,,,7,いい場所だった,男性,2004,埼玉県,600-800万円未満,万座毛エリア,恩納村,2026-06-30 13:55:30
8768,7999,2泊,"10,000円以上 20,000円未満","地元の美味しいものを食べる,テーマパーク:沖縄美ら海水族館",0,0,1,0,0,1,0,0,0,0,0,0,0,0,0,0,0,0,0,0,0,0,0,,パートナー(恋人・夫婦など),,"インターネット・アプリ,Instagram",0,0,0,0,0,0,0,0,0,1,0,0,1,0,0,0,0,0,0,0,,レンタカー,0,1,0,0,0,0,0,0,,レンタカー,0,1,0,0,0,0,0,0,,満足,,やんばるエリアには宿泊しない,,,,,,,,"5,000円以上 10,000円未満","5,000円未満","5,000円未満","5,000円未満",初めて,,必ず来たい,1-3年後,大変満足,,8,,ない,,うふやんばる(国頭村・大宜味村・東村),塩屋湾,,,,,"10,000円以上 20,000円未満",やや満足,,,7,,男性,2001,東京都,400-600万円未満,おんなの駅エリア,恩納村,2026-06-30 14:40:27
8769,8000,7泊以上,"20,000円以上 30,000円未満",アウトドア:マリンスポーツ,0,0,0,0,0,0,0,0,0,0,0,0,0,1,0,0,0,0,0,0,0,0,0,,自分ひとり,,友人・知人,0,0,0,0,0,0,0,0,0,0,0,0,0,0,0,1,0,0,0,0,,レンタカー,0,1,0,0,0,0,0,0,,レンタカー,0,1,0,0,0,0,0,0,,大変満足,お得にレンタカーを借りられた,7泊以上,国頭村：辺戸岬・オクマリゾート周辺エリア,国頭村：辺戸岬・オクマリゾート周辺エリア,国頭村：辺戸岬・オクマリゾート周辺エリア,国頭村：辺戸岬・オクマリゾート周辺エリア,国頭村：辺戸岬・オクマリゾート周辺エリア,国頭村：辺戸岬・オクマリゾート周辺エリア,国頭村：辺戸岬・オクマリゾート周辺エリア,"100,000円以上 200,000円未満","10,000円以上 20,000円未満","10,000円以上 20,000円未満","20,000円以上 30,000円未満",初めて,,必ず来たい,半年以内,大変満足,人々があたたかい,10,自然が豊かなところ,ある,看板を分かりやすくしてほしい,南部,平和祈念公園,,特になし,特に無し,,"5,000円未満",大変満足,思った以上に近くでクーちゃんをみられた,"もっとお土産の種類を増やしてほしいです
",10,展示やお話がとても分かりやすく勉強になったから,女性,1982,三重県,200-300万円未満,ヤンバルクイナ生態展示学習施設クイナの森エリア,国頭村,2026-06-30 15:33:36
8770,8001,2泊,"50,000円以上 100,000円未満",リゾートホテルを楽しむ,0,1,0,0,0,0,0,0,0,0,0,0,0,0,0,0,0,0,0,0,0,0,0,,友人,,観光展・物産展,1,0,0,0,0,0,0,0,0,0,0,0,0,0,0,0,0,0,0,0,,レンタカー,0,1,0,0,0,0,0,0,,レンタカー,0,1,0,0,0,0,0,0,,大変満足,自然がたくさんあり、とても満足しました。景色も良く、リフレッシュできて充実した時間を過ごせました。,やんばるエリアには宿泊しない,,,,,,,,"20,000円以上 30,000円未満","5,000円以上 10,000円未満","10,000円以上 20,000円未満","10,000円以上 20,000円未満",2-3回目,半年-1年前,必ず来たい,半年以内,大変満足,自然がたくさんあり、とても満足しました。,10,やんばるクイナに会えた。,ない,,なかやんばる(名護市・本部町・今帰仁村),沖縄美ら海水族館,,中部,残波岬,,"20,000円以上 30,000円未満",大変満足,,,10,,男性,1995,沖縄県,800-1000万円未満,おんなの駅エリア,恩納村,2026-06-30 16:20:50
8771,8002,2泊,"10,000円以上 20,000円未満","リゾートホテルを楽しむ,地元の美味しいものを食べる,アウトドア:ビーチ・海水浴,ドライブ・ツーリング",0,1,1,0,0,0,0,0,0,0,0,0,1,0,0,0,0,0,0,1,0,0,0,,パートナー(恋人・夫婦など),,"Google map,インターネット・アプリ,YouTube,Twitter,宿泊施設",0,0,0,0,0,0,0,0,1,1,1,1,0,0,0,0,0,0,1,0,,レンタカー,0,1,0,0,0,0,0,0,,レンタカー,0,1,0,0,0,0,0,0,,満足,交通手段が少ないので車でないと色々と見て回れない。,2泊,本部町：美ら海水族館・瀬底島周辺エリア,本部町：美ら海水族館・瀬底島周辺エリア,,,,,,"30,000円以上 40,000円未満","10,000円以上 20,000円未満","10,000円以上 20,000円未満","10,000円以上 20,000円未満",11回目以上,1-3年前,来たい,半年-1年後,満足,飲食店が充実していた。,8,リゾート地と飲食施設が充実,ある,夜楽しめるところが少ない,なかやんばる(名護市・本部町・今帰仁村),古宇利島(オーシャンタワー/ハートロック),,中部,美浜アメリカンビレッジ,,"5,000円以上 10,000円未満",満足,"食べ物が良かった。

",もっとフルーツが充実してるともっと良い。また、イベントがあると良い,8,かき氷と食事,男性,1965,神奈川県,600-800万円未満,おんなの駅エリア,恩納村,2026-06-30 16:58:33
8772,8003,1泊,使わない,ドライブ・ツーリング,0,0,0,0,0,0,0,0,0,0,0,0,0,0,0,0,0,0,0,1,0,0,0,,パートナー(恋人・夫婦など),,インターネット・アプリ,0,0,0,0,0,0,0,0,0,1,0,0,0,0,0,0,0,0,0,0,,自家用車,1,0,0,0,0,0,0,0,,自家用車,1,0,0,0,0,0,0,0,,,,1泊,恩納村：万座毛・青の洞窟・ハレクラニ周辺エリア,,,,,,,"10,000円以上 20,000円未満","5,000円以上 10,000円未満","10,000円以上 20,000円未満","5,000円未満",11回目以上,半年以内,来たい,半年-1年後,満足,,8,,ない,,南部,その他,,特になし,特に無し,,"5,000円未満",満足,,,10,,男性,1999,沖縄県,400-600万円未満,名嘉真エリア,恩納村,2026-06-30 17:53:52
8773,8004,2泊,"10,000円以上 20,000円未満","宿でのんびり過ごす,リゾートホテルを楽しむ,地元の美味しいものを食べる,買い物、アウトレット,アウトドア:登山・トレッキング",1,1,1,0,0,0,0,0,1,0,0,0,0,0,1,0,0,0,0,0,0,0,0,,パートナー(恋人・夫婦など),,"Google map,YouTube,Instagram,宿泊施設",0,0,0,0,0,0,0,0,1,0,1,0,1,0,0,0,0,0,1,0,,レンタカー,0,1,0,0,0,0,0,0,,レンタカー,0,1,0,0,0,0,0,0,,やや満足,高速道路が少なく、那覇から名護まで向かう距離が少し短くなったら嬉しいと感じた。,2泊,本部町：美ら海水族館・瀬底島周辺エリア,本部町：美ら海水族館・瀬底島周辺エリア,,,,,,"50,000円以上 100,000円未満","5,000円未満","20,000円以上 30,000円未満","10,000円以上 20,000円未満",11回目以上,5年以上前,必ず来たい,1-3年後,大変満足,アスムイ　ハイクスを訪れ、とても感動しました。また訪れたいです。また、名護の森のガラス館は十年前にやったゲームがまだ残っていて、懐かしさと嬉しさでいっぱいでした。家族と来ていた沖縄旅行が結婚し、夫と思い出の地を一緒に巡ることができ、また新しい思い出が出来ました。,10,やんばるエリアの各所見所があるから。名護・恩納村・国頭でまた違う雰囲気を味わうことができるから。,ない,,うふやんばる(国頭村・大宜味村・東村),アスムイハイクス,,なかやんばる(名護市・本部町・今帰仁村),その他,森のガラス館,"5,000円以上 10,000円未満",大変満足,買いたかったちんすこうやちょうみりょなど一通り揃っていたから。,,10,,女性,1998,神奈川県,1000-1200万円未満,道の駅ゆいゆい国頭エリア,国頭村,2026-06-30 18:10:10
8774,8005,4泊,"40,000円以上 50,000円未満","リゾートホテルを楽しむ,地元の美味しいものを食べる,テーマパーク:沖縄美ら海水族館,アウトドア:ビーチ・海水浴,アウトドア:マリンスポーツ",0,1,1,0,0,1,0,0,0,0,0,0,1,1,0,0,0,0,0,0,0,0,0,,未就学児を含む家族,,"新聞・雑誌・ガイドブック,美ら海水族館等の観光関連事業者HP,Chat GPT等の生成AI,Instagram",0,1,0,0,0,1,0,1,0,0,0,0,1,0,0,0,0,0,0,0,,レンタカー,0,1,0,0,0,0,0,0,,レンタカー,0,1,0,0,0,0,0,0,,満足,待ち時間なく楽だった,4泊,本部町：美ら海水族館・瀬底島周辺エリア,本部町：美ら海水族館・瀬底島周辺エリア,恩納村：万座毛・青の洞窟・ハレクラニ周辺エリア,恩納村：万座毛・青の洞窟・ハレクラニ周辺エリア,,,,"30,000円以上 40,000円未満","5,000円以上 10,000円未満","20,000円以上 30,000円未満","20,000円以上 30,000円未満",2-3回目,1-3年前,必ず来たい,5年以上,大変満足,,9,,ない,,特になし,特に無し,,門口(じょうぐち)やんばる(金武町・宜野座村・恩納村),恩納村海岸(青の洞窟),,"5,000円以上 10,000円未満",大変満足,,,6,,女性,1992,宮城県,800-1000万円未満,海洋博公園・観光拠点エリア,本部町,2026-06-30 23:08:45
8775,8006,2泊,"10,000円以上 20,000円未満","地元の美味しいものを食べる,名所、旧跡の観光,アウトドア:マリンスポーツ",0,0,1,0,1,0,0,0,0,0,0,0,0,1,0,0,0,0,0,0,0,0,0,,友人,,"宿泊事業者のHP,Google map,Instagram",0,0,0,0,0,0,1,0,1,0,0,0,1,0,0,0,0,0,0,0,,レンタカー,0,1,0,0,0,0,0,0,,レンタカー,0,1,0,0,0,0,0,0,,満足,暑くなれば涼しい車内で休憩できる,2泊,本部町：美ら海水族館・瀬底島周辺エリア,本部町：美ら海水族館・瀬底島周辺エリア,,,,,,"20,000円以上 30,000円未満","10,000円以上 20,000円未満","5,000円以上 10,000円未満","30,000円以上 40,000円未満",2-3回目,1-3年前,来たい,3-5年後,大変満足,瀬底島「ちーりー」でのシュノーケルが楽しかった,8,"海が美しい
アクティビティがよい",ない,,中部,北谷サンセットビーチ,,なかやんばる(名護市・本部町・今帰仁村),沖縄美ら海水族館,,"5,000円以上 10,000円未満",普通,スタッフの対応は良かったが、お掃除が…,,5,"お部屋が広い
ハナサキマルシェがある
プール
子供連れてくるにはよいと思う",女性,1963,大阪府,800-1000万円未満,海洋博公園・観光拠点エリア,本部町,2026-06-30 23:32:24