7884,7173,3泊,"30,000円以上 40,000円未満","地元の美味しいものを食べる,花見などの自然鑑賞,買い物、アウトレット,アウトドア:マリンスポーツ,ドライブ・ツーリング",0,0,1,1,0,0,0,0,1,0,0,0,0,1,0,0,0,0,0,1,0,0,0,,パートナー(恋人・夫婦など),,"新聞・雑誌・ガイドブック,インターネット・アプリ",0,1,0,0,0,0,0,0,0,1,0,0,0,0,0,0,0,0,0,0,,レンタカー,0,1,0,0,0,0,0,0,,レンタカー,0,1,0,0,0,0,0,0,,大変満足,,やんばるエリアには宿泊しない,,,,,,,,使わない,"5,000円以上 10,000円未満","5,000円未満","5,000円未満",6-10回目,半年以内,必ず来たい,半年-1年後,大変満足,,10,自然豊かで、のんびりできる,ない,,なかやんばる(名護市・本部町・今帰仁村),古宇利島(オーシャンタワー/ハートロック),,なかやんばる(名護市・本部町・今帰仁村),その他,,"5,000円未満",大変満足,,,10,,男性,1955,愛知県,1000-1200万円未満,道の駅おおぎみエリア,大宜味村,2026-05-18 13:59:18
7885,7174,4泊,"10,000円以上 20,000円未満","地元の美味しいものを食べる,花見などの自然鑑賞,名所、旧跡の観光,友人・親戚を尋ねる",0,0,1,1,1,0,0,0,0,0,0,0,0,0,0,0,0,0,0,0,1,0,0,,親,,"Google map,友人・知人",0,0,0,0,0,0,0,0,1,0,0,0,0,0,0,1,0,0,0,0,,"レンタカー,フェリー,タクシー",0,1,0,0,1,0,1,0,,レンタカー,0,1,0,0,0,0,0,0,,満足,"他地域と比べ、レンタカーの料金が安く長期間借りることができた。
道もわかりやすい。
米軍基地開発している周辺の道路状況の悪さが気になってしまった。",2泊,伊江村：伊江島エリア,名護市①：名護市街・カヌチャリゾート周辺エリア,,,,,,"20,000円以上 30,000円未満","5,000円以上 10,000円未満","5,000円以上 10,000円未満","5,000円以上 10,000円未満",6-10回目,半年以内,必ず来たい,半年以内,大変満足,"不満は全くない
強いていえばやんばる急行が時間通りに進まない点
ただ、それを踏まえてレンタカーを借りたので満足

ホテルなど宿泊施設、飲食施設に関しては文句ないので
また利用したいです。",10,"伊江村を中心に観光した。
基本的には自然の美しさがよいと感じた。
ユリ祭りの時期を外してしまったので、その時期に来村し、人工的な自然の美しさ、天然の自然の美しさを感じてほしい",ある,"やんばる急行

上記の通り",なかやんばる(名護市・本部町・今帰仁村),その他,飲食店、ブセナ海中公園にも行きました。,島やんばる(伊江村・伊是名村・伊平屋村),伊江島タッチュー,,"5,000円未満",やや満足,"待ち時間が生まれた際の時間潰しの方法が無いです
売店も開いてたり開いてなかったりするのでただベンチで待つだけになります。",売店だけは充実してほしいです。,6,"海に近いので
景色眺めて欲しいです",男性,1995,愛知県,200-300万円未満,本部港周辺エリア,本部町,2026-05-18 14:29:54
7886,7175,2泊,"5,000円以上 10,000円未満","リゾートホテルを楽しむ,地元の美味しいものを食べる,テーマパーク:沖縄美ら海水族館,テーマパーク:その他",0,1,1,0,0,1,0,1,0,0,0,0,0,0,0,0,0,0,0,0,0,0,0,,未就学児を含む家族,,"新聞・雑誌・ガイドブック,美ら海水族館等の観光関連事業者HP,宿泊事業者のHP",0,1,0,0,0,1,1,0,0,0,0,0,0,0,0,0,0,0,0,0,,レンタカー,0,1,0,0,0,0,0,0,,レンタカー,0,1,0,0,0,0,0,0,,大変満足,貸し出し、返却手続きもスムーズで助かりました！,2泊,名護市②：ブセナリゾート周辺エリア,名護市②：ブセナリゾート周辺エリア,,,,,,"5,000円以上 10,000円未満","5,000円以上 10,000円未満","5,000円以上 10,000円未満","5,000円未満",2-3回目,5年以上前,必ず来たい,1-3年後,大変満足,美ら海水族館がとても楽しかったようで、子どもが帰ってきてからもチンアナゴと「おっきいおさかな（ジンベエザメ）」のぬいぐるみと一緒に寝ています^ ^,10,ホテルもとてものんびりでき、子連れにはぴったりだと感じたため。,ない,,なかやんばる(名護市・本部町・今帰仁村),ナゴパイナップルパーク,,なかやんばる(名護市・本部町・今帰仁村),古宇利島(オーシャンタワー/ハートロック),,"5,000円未満",大変満足,美ら海水族館がとてもよかった！,イルカへの餌やりが、もう少し人数が多ければ嬉しいでさ（直前で締め切りになってしまいました）,10,公園内が広いので、子どもがたくさん走り回れて楽しそうでした。,女性,1989,埼玉県,800-1000万円未満,海洋博公園・観光拠点エリア,本部町,2026-05-18 15:10:41
7887,7176,2泊,"10,000円以上 20,000円未満",リゾートホテルを楽しむ,0,1,0,0,0,0,0,0,0,0,0,0,0,0,0,0,0,0,0,0,0,0,0,,パートナー(恋人・夫婦など),,インターネット・アプリ,0,0,0,0,0,0,0,0,0,1,0,0,0,0,0,0,0,0,0,0,,レンタカー,0,1,0,0,0,0,0,0,,レンタカー,0,1,0,0,0,0,0,0,,満足,,1泊,本部町：美ら海水族館・瀬底島周辺エリア,,,,,,,"20,000円以上 30,000円未満","10,000円以上 20,000円未満","10,000円以上 20,000円未満","10,000円以上 20,000円未満",4-5回目,1-3年前,来たい,1-3年後,満足,,8,,ない,,なかやんばる(名護市・本部町・今帰仁村),沖縄美ら海水族館,,南部,国際通り,,"5,000円未満",満足,,,8,,男性,1961,兵庫県,答えられない,伊芸・屋嘉エリア,金武町,2026-05-18 15:15:45
7888,7177,2泊,"10,000円以上 20,000円未満","テーマパーク:沖縄美ら海水族館,その他",0,0,0,0,0,1,0,0,0,0,0,0,0,0,0,0,0,0,0,0,0,0,1,美ら島植物園で熱帯植物観賞,パートナー(恋人・夫婦など),,新聞・雑誌・ガイドブック,0,1,0,0,0,0,0,0,0,0,0,0,0,0,0,0,0,0,0,0,,レンタカー,0,1,0,0,0,0,0,0,,徒歩,0,0,0,0,0,1,0,0,,,,1泊,本部町：美ら海水族館・瀬底島周辺エリア,,,,,,,"30,000円以上 40,000円未満","5,000円以上 10,000円未満","5,000円以上 10,000円未満","5,000円以上 10,000円未満",2-3回目,5年以上前,必ず来たい,1-3年後,満足,,5,,ない,,特になし,特に無し,,特になし,特に無し,,"5,000円未満",普通,,,5,,女性,1961,兵庫県,答えられない,伊芸・屋嘉エリア,金武町,2026-05-18 15:22:00
7889,7178,2泊,"5,000円未満","宿でのんびり過ごす,地元の美味しいものを食べる,花見などの自然鑑賞,アウトドア:ビーチ・海水浴,アウトドア:キャンプ,まちあるき・集落散策",1,0,1,1,0,0,0,0,0,0,0,0,1,0,0,1,1,0,0,0,0,0,0,,未就学児を含む家族,,その他,0,0,0,0,0,0,0,0,0,0,0,0,0,0,0,0,0,0,0,1,季節の自然,自家用車,1,0,0,0,0,0,0,0,,自家用車,1,0,0,0,0,0,0,0,,,,2泊,大宜味村：道の駅おおぎみ・ター滝周辺エリア,大宜味村：道の駅おおぎみ・ター滝周辺エリア,,,,,,"5,000円以上 10,000円未満","5,000円未満","5,000円未満","5,000円未満",11回目以上,半年以内,必ず来たい,半年以内,大変満足,"やんばるの自然が大好きだから
やんばるに行きたいところ過ごしたい時間しかないくらい",7,美しい自然,ない,美味しいパン屋さんとかあればな,うふやんばる(国頭村・大宜味村・東村),塩屋湾,,うふやんばる(国頭村・大宜味村・東村),福地川海浜公園,,"5,000円未満",大変満足,ゆいゆいに来れるだけで大満足嬉しいです,"国頭ドーナツ、新鮮な野菜、美味しい黒糖
ゆっくり時間",7,子供達も遊ばせやすいし、北部に来て立ち寄れる道の駅は楽しいです,女性,1983,沖縄県,200-300万円未満,道の駅ゆいゆい国頭エリア,国頭村,2026-05-18 16:15:34
7890,7179,2泊,"10,000円以上 20,000円未満","リゾートホテルを楽しむ,地元の美味しいものを食べる,テーマパーク:沖縄美ら海水族館,アウトドア:キャンプ,各種体験(手作り、果物狩りなど)",0,1,1,0,0,1,0,0,0,0,0,0,0,0,0,1,0,1,0,0,0,0,0,,未就学児を含む家族,,"インターネット・アプリ,Instagram",0,0,0,0,0,0,0,0,0,1,0,0,1,0,0,0,0,0,0,0,,自家用車,1,0,0,0,0,0,0,0,,"自家用車,レンタサイクル",1,0,0,0,0,0,1,0,,大変満足,,2泊,恩納村：万座毛・青の洞窟・ハレクラニ周辺エリア,恩納村：万座毛・青の洞窟・ハレクラニ周辺エリア,,,,,,"20,000円以上 30,000円未満","30,000円以上 40,000円未満","20,000円以上 30,000円未満","10,000円以上 20,000円未満",11回目以上,1-3年前,必ず来たい,半年以内,大変満足,,10,,ない,,中部,残波岬,,南部,おきなわワールド,,"5,000円以上 10,000円未満",大変満足,,,10,,男性,1973,沖縄県,400-600万円未満,海洋博公園・観光拠点エリア,本部町,2026-05-18 17:35:04
7891,7180,1泊,"5,000円以上 10,000円未満","花見などの自然鑑賞,アウトドア:ビーチ・海水浴,アウトドア:登山・トレッキング,アウトドア:キャンプ,その他",0,0,0,1,0,0,0,0,0,0,0,0,1,0,1,1,0,0,0,0,0,0,1,やんばるの生き物や自然観察,小学生を含む家族(未就学児は含まない),,"Google map,友人・知人",0,0,0,0,0,0,0,0,1,0,0,0,0,0,0,1,0,0,0,0,,自家用車,1,0,0,0,0,0,0,0,,自家用車,1,0,0,0,0,0,0,0,,,,1泊,国頭村：辺戸岬・オクマリゾート周辺エリア,,,,,,,"5,000円以上 10,000円未満",使わない,"5,000円以上 10,000円未満","5,000円未満",11回目以上,半年以内,必ず来たい,半年以内,やや満足,"宿泊施設も活用しているが、やっぱりやんばるに行くなら自然を楽しみたいのでフリーの焚き火可のキャンプエリア（トイレあり、コインシャワーあり）があると嬉しい。
国頭辺りだと、バーベキューのお肉を買う場所がなくて困ったのでコンビニにもバーベキュー肉を置いて欲しい。",10,自然観察。沖縄に住んでいるけど、見たことない生き物や知らない自然があると最近知ったから、その素晴らしさは知って感動した。自然の大切さを感じ、考えて欲しいと思ったから。,ある,"キレイなトイレとコインシャワーが欲しい。マダニが気になるのでシャワーがあると嬉しい。
やはり、側溝に落ちて這い上がれない生き物を見ることがよくあるので、それの改善は必須だと思う。
ゴミが落ちてることは気になる。やんばるグリーンキャンプなど、やんばるを大切にするイベントがあったら参加したい。",門口(じょうぐち)やんばる(金武町・宜野座村・恩納村),道の駅ぎのざ,,南部,首里城公園,,"5,000円以上 10,000円未満",普通,昼間は店がやってない。子どもと来て、子どもは、アメリカンなイメージのビリヤードをしてみたかったのだけど店は夕方からでお酒を飲む店だから子どもの入店は無理だろうと言われた。,"アメリカンなイメージを売りに昼間も運用して欲しい。アメリカ村みたいに英語しか使えないとか、たしか、韓国にはそんな場所があったはず。
それから、遊具のある公園が欲しい。ドライブで疲れた子どもも公園でのびのびできたら良いのにと思った。",5,"風景、街の雰囲気は独特なディープさが味があって良いと思う。キンタコが移転してて雰囲気が殺風景で残念だった。
",女性,1973,沖縄県,400-600万円未満,金武・並里エリア,金武町,2026-05-18 18:43:43
7892,7181,3泊,"5,000円以上 10,000円未満","アウトドア:ビーチ・海水浴,アウトドア:マリンスポーツ,アウトドア:登山・トレッキング,ドライブ・ツーリング",0,0,0,0,0,0,0,0,0,0,0,0,1,1,1,0,0,0,0,1,0,0,0,,パートナー(恋人・夫婦など),,"観光パンフレット・ポスター,インターネット・アプリ",0,0,0,1,0,0,0,0,0,1,0,0,0,0,0,0,0,0,0,0,,レンタカー,0,1,0,0,0,0,0,0,,レンタカー,0,1,0,0,0,0,0,0,,大変満足,,3泊,本部町：美ら海水族館・瀬底島周辺エリア,本部町：美ら海水族館・瀬底島周辺エリア,本部町：美ら海水族館・瀬底島周辺エリア,,,,,"30,000円以上 40,000円未満","5,000円以上 10,000円未満","5,000円以上 10,000円未満","5,000円以上 10,000円未満",6-10回目,半年以内,必ず来たい,半年以内,大変満足,シュノーケルとドライブで満喫しました,8,"海の綺麗さと、自然の豊かさです
",ある,"ひじ大滝に行けないのが残念です
早く復旧して欲しいです",なかやんばる(名護市・本部町・今帰仁村),古宇利島(オーシャンタワー/ハートロック),,門口(じょうぐち)やんばる(金武町・宜野座村・恩納村),道の駅ぎのざ,,"5,000円未満",満足,,,8,,女性,1956,愛知県,600-800万円未満,道の駅おおぎみエリア,大宜味村,2026-05-18 19:34:37
7893,7182,4泊,"40,000円以上 50,000円未満","地元の美味しいものを食べる,名所、旧跡の観光,テーマパーク:沖縄美ら海水族館,友人・親戚を尋ねる",0,0,1,0,1,1,0,0,0,0,0,0,0,0,0,0,0,0,0,0,1,0,0,,中学生以上を含む家族(小学生以下は含まない),,その他,0,0,0,0,0,0,0,0,0,0,0,0,0,0,0,0,0,0,0,1,家族のすすめ,"レンタカー,タクシー",0,1,0,0,0,0,1,0,,レンタカー,0,1,0,0,0,0,0,0,,大変満足,,2泊,伊江村：伊江島エリア,名護市①：名護市街・カヌチャリゾート周辺エリア,,,,,,"20,000円以上 30,000円未満","5,000円以上 10,000円未満","5,000円未満","5,000円未満",初めて,,来たい,1-3年後,満足,,8,,ない,,南部,国際通り,,なかやんばる(名護市・本部町・今帰仁村),沖縄美ら海水族館,,"5,000円未満",大変満足,手入れの行き届いた過ごしやすい部屋でした。,,10,,女性,1968,愛知県,100-200万円未満,伊江村エリア,伊江村,2026-05-18 22:07:59