Synergy!ID,HistoryID,宿泊数(県内),交通費,訪問目的(やんばるエリア)_ALL,訪問目的(やんばるエリア)_宿でのんびり過ごす,訪問目的(やんばるエリア)_リゾートホテルを楽しむ,訪問目的(やんばるエリア)_地元の美味しいものを食べる,訪問目的(やんばるエリア)_花見などの自然鑑賞,訪問目的(やんばるエリア)_名所、旧跡の観光,訪問目的(やんばるエリア)_テーマパーク:沖縄美ら海水族館,訪問目的(やんばるエリア)_テーマパーク:JUNGLIA,訪問目的(やんばるエリア)_テーマパーク:その他,訪問目的(やんばるエリア)_買い物、アウトレット,訪問目的(やんばるエリア)_お祭りやイベントへの参加・見物,訪問目的(やんばるエリア)_地域の行事,訪問目的(やんばるエリア)_スポーツ観戦や芸能鑑賞(コンサート等),訪問目的(やんばるエリア)_アウトドア:ビーチ・海水浴,訪問目的(やんばるエリア)_アウトドア:マリンスポーツ,訪問目的(やんばるエリア)_アウトドア:登山・トレッキング,訪問目的(やんばるエリア)_アウトドア:キャンプ,訪問目的(やんばるエリア)_まちあるき・集落散策,訪問目的(やんばるエリア)_各種体験(手作り、果物狩りなど),訪問目的(やんばるエリア)_その他スポーツ(ゴルフ、テニスなど),訪問目的(やんばるエリア)_ドライブ・ツーリング,訪問目的(やんばるエリア)_友人・親戚を尋ねる,訪問目的(やんばるエリア)_出張など仕事関係,訪問目的(やんばるエリア)_その他,訪問目的(やんばるエリア)_その他_text,同行者(やんばるエリア),同行者(やんばるエリア)_その他_text,情報収集(やんばるエリア)_ALL,情報収集(やんばるエリア)_観光展・物産展,情報収集(やんばるエリア)_新聞・雑誌・ガイドブック,情報収集(やんばるエリア)_TV・ラジオ番組やCM,情報収集(やんばるエリア)_観光パンフレット・ポスター,情報収集(やんばるエリア)_観光協会のHP,情報収集(やんばるエリア)_美ら海水族館等の観光関連事業者HP,情報収集(やんばるエリア)_宿泊事業者のHP,情報収集(やんばるエリア)_Chat GPT等の生成AI,情報収集(やんばるエリア)_Google map,情報収集(やんばるエリア)_インターネット・アプリ,情報収集(やんばるエリア)_YouTube,情報収集(やんばるエリア)_Twitter,情報収集(やんばるエリア)_Instagram,情報収集(やんばるエリア)_Facebook,情報収集(やんばるエリア)_ブログ,情報収集(やんばるエリア)_友人・知人,情報収集(やんばるエリア)_観光協会・空港・道の駅等の案内所,情報収集(やんばるエリア)_タクシードライバーや地元の人,情報収集(やんばるエリア)_宿泊施設,情報収集(やんばるエリア)_その他,情報収集(やんばるエリア)_その他_text,やんばるエリアまでの交通手段_ALL,やんばるエリアまでの交通手段_自家用車,やんばるエリアまでの交通手段_レンタカー,やんばるエリアまでの交通手段_ヘリコプター,やんばるエリアまでの交通手段_旅行会社ツアーバス,やんばるエリアまでの交通手段_フェリー,やんばるエリアまでの交通手段_路線バス、高速バス、シャトルバス,やんばるエリアまでの交通手段_タクシー,やんばるエリアまでの交通手段_その他,やんばるエリアまでの交通手段_その他_text,やんばるエリア内での交通手段_ALL,やんばるエリア内での交通手段_自家用車,やんばるエリア内での交通手段_レンタカー,やんばるエリア内での交通手段_タクシー,やんばるエリア内での交通手段_旅行会社ツアーバス,やんばるエリア内での交通手段_路線バス,やんばるエリア内での交通手段_徒歩,やんばるエリア内での交通手段_レンタサイクル,やんばるエリア内での交通手段_その他,やんばるエリア内での交通手段_その他_text,やんばるエリア内での交通手段の満足度,やんばるエリア内での交通手段の満足度の理由,宿泊数(やんばるエリア),宿泊地1泊目(やんばるエリア),宿泊地2泊目(やんばるエリア),宿泊地3泊目(やんばるエリア),宿泊地4泊目(やんばるエリア),宿泊地5泊目(やんばるエリア),宿泊地6泊目(やんばるエリア),宿泊地7泊目(やんばるエリア),宿泊費(やんばるエリア),観光費(やんばるエリア),飲食費(やんばるエリア),土産費(やんばるエリア),訪問回数(やんばるエリア),前回訪問時期(やんばるエリア),今後の来訪意向(やんばるエリア),今後の来訪時期(やんばるエリア),体験・サービス満足度(やんばるエリア),体験・サービス満足度の理由(やんばるエリア),推奨度(やんばるエリア),推奨項目(やんばるエリア),改善点(やんばるエリア),改善点の内容(やんばるエリア),回答前に訪問したエリア(調査地),回答前に訪問した主な施設(調査地),回答前に訪問した主な施設・その他(調査地),回答後に訪問予定のエリア(調査地),回答後に訪問予定の主な施設(調査地),回答後に訪問予定の主な施設・その他(調査地),現地消費額(調査地),体験・サービス満足度(調査地),体験・サービス満足度の理由(調査地),施設に求めるもの(調査地),施設推奨度(調査地),施設推奨項目(調査地),性別,生年,都道府県,世帯年収,訪問地のエリア名,訪問地の市町村,回答日時
7867,7157,2泊,"10,000円以上 20,000円未満","まちあるき・集落散策,その他",0,0,0,0,0,0,0,0,0,0,0,0,0,0,0,0,1,0,0,0,0,0,1,共同店巡り,友人,,"インターネット・アプリ,Instagram,その他",0,0,0,0,0,0,0,0,0,1,0,0,1,0,0,0,0,0,0,1,ポッドキャスト,レンタカー,0,1,0,0,0,0,0,0,,レンタカー,0,1,0,0,0,0,0,0,,大変満足,天気良くてドライブ最高だった,やんばるエリアには宿泊しない,,,,,,,,使わない,使わない,"5,000円未満","20,000円以上 30,000円未満",4-5回目,3-5年前,必ず来たい,半年-1年後,大変満足,"道の駅安波の屋上からの眺めが良かった
今度は時間を作って、観察棟にも行きたい。
慶佐次のヒルギ林のカニ観察楽しかった
",10,ウミガメ（施設内）、ヤンバルクイナ、トントンミー、ヒルギなど、ヤンバルの自然が楽しい。時間が足りなかった。,ない,,なかやんばる(名護市・本部町・今帰仁村),その他,嘉陽売店と美ら島自然学校,うふやんばる(国頭村・大宜味村・東村),その他,又吉コーヒー,"5,000円未満",大変満足,ヒルギ林を上から眺め、下から観察。うなぎ？、カニ、ハゼ、蝶など生き物に沢山出会えた。,慶佐次売店Ｔシャツかわいい。,10,子どもたちに生き物観察の場として,女性,1970,静岡県,400-600万円未満,有銘・慶佐次・平良エリア,東村,2026-05-18 06:22:14
7869,7158,5泊,"5,000円以上 10,000円未満","宿でのんびり過ごす,地元の美味しいものを食べる,アウトドア:ビーチ・海水浴",1,0,1,0,0,0,0,0,0,0,0,0,1,0,0,0,0,0,0,0,0,0,0,,親,,"YouTube,友人・知人",0,0,0,0,0,0,0,0,0,0,1,0,0,0,0,1,0,0,0,0,,レンタカー,0,1,0,0,0,0,0,0,,レンタカー,0,1,0,0,0,0,0,0,,大変満足,,5泊,本部町：美ら海水族館・瀬底島周辺エリア,本部町：美ら海水族館・瀬底島周辺エリア,本部町：美ら海水族館・瀬底島周辺エリア,本部町：美ら海水族館・瀬底島周辺エリア,本部町：美ら海水族館・瀬底島周辺エリア,,,"20,000円以上 30,000円未満","5,000円未満","20,000円以上 30,000円未満","20,000円以上 30,000円未満",11回目以上,半年-1年前,必ず来たい,半年以内,大変満足,,10,,ない,,なかやんばる(名護市・本部町・今帰仁村),その他,,なかやんばる(名護市・本部町・今帰仁村),その他,,"20,000円以上 30,000円未満",大変満足,,,10,,女性,1979,埼玉県,300-400万円未満,道の駅おおぎみエリア,大宜味村,2026-05-18 09:43:36
7870,7159,日帰り,"5,000円未満",名所、旧跡の観光,0,0,0,0,1,0,0,0,0,0,0,0,0,0,0,0,0,0,0,0,0,0,0,,友人,,"新聞・雑誌・ガイドブック,Instagram",0,1,0,0,0,0,0,0,0,0,0,0,1,0,0,0,0,0,0,0,,自家用車,1,0,0,0,0,0,0,0,,自家用車,1,0,0,0,0,0,0,0,,,,やんばるエリアには宿泊しない,,,,,,,,使わない,"5,000円未満","5,000円未満",使わない,6-10回目,半年以内,必ず来たい,半年以内,大変満足,圧倒的な海の美しさ,10,海が美しい,ある,古宇利島のカフェに行きたいが駐車場が少なく停められない,なかやんばる(名護市・本部町・今帰仁村),古宇利島(オーシャンタワー/ハートロック),,特になし,特に無し,,"5,000円未満",満足,景色が美しい,タワーの中にもドリンクなど販売があってもいいかなと思った,8,景色が美しい,女性,1978,沖縄県,800-1000万円未満,古宇利島エリア,今帰仁村,2026-05-18 09:59:19
7871,7160,4泊,"30,000円以上 40,000円未満","宿でのんびり過ごす,名所、旧跡の観光,テーマパーク:その他,アウトドア:ビーチ・海水浴",1,0,0,0,1,0,0,1,0,0,0,0,1,0,0,0,0,0,0,0,0,0,0,,パートナー(恋人・夫婦など),,"観光展・物産展,観光パンフレット・ポスター,インターネット・アプリ",1,0,0,1,0,0,0,0,0,1,0,0,0,0,0,0,0,0,0,0,,自家用車,1,0,0,0,0,0,0,0,,"自家用車,レンタカー",1,1,0,0,0,0,0,0,,大変満足,,やんばるエリアには宿泊しない,,,,,,,,"10,000円以上 20,000円未満","5,000円以上 10,000円未満","5,000円未満","10,000円以上 20,000円未満",初めて,,必ず来たい,半年-1年後,大変満足,,10,,ない,,なかやんばる(名護市・本部町・今帰仁村),古宇利島(オーシャンタワー/ハートロック),,南部,国際通り,,使わない,大変満足,,,8,,男性,1955,岐阜県,2000万円以上,おんなの駅エリア,恩納村,2026-05-18 10:04:04
7872,7161,2泊,"10,000円以上 20,000円未満","リゾートホテルを楽しむ,地元の美味しいものを食べる,名所、旧跡の観光,テーマパーク:沖縄美ら海水族館,買い物、アウトレット,アウトドア:ビーチ・海水浴",0,1,1,0,1,1,0,0,1,0,0,0,1,0,0,0,0,0,0,0,0,0,0,,未就学児を含む家族,,"Instagram,ブログ,友人・知人",0,0,0,0,0,0,0,0,0,0,0,0,1,0,1,1,0,0,0,0,,レンタカー,0,1,0,0,0,0,0,0,,レンタカー,0,1,0,0,0,0,0,0,,大変満足,,2泊,恩納村：万座毛・青の洞窟・ハレクラニ周辺エリア,恩納村：万座毛・青の洞窟・ハレクラニ周辺エリア,,,,,,"50,000円以上 100,000円未満","20,000円以上 30,000円未満","20,000円以上 30,000円未満","20,000円以上 30,000円未満",4-5回目,3-5年前,必ず来たい,3-5年後,大変満足,,10,ビーチの綺麗さ、静かな感じが好きです,ない,,門口(じょうぐち)やんばる(金武町・宜野座村・恩納村),恩納村海岸(青の洞窟),,なかやんばる(名護市・本部町・今帰仁村),ナゴパイナップルパーク,,"10,000円以上 20,000円未満",大変満足,美ら海水族館が大好きで、お土産も可愛いものが多く楽しかったです,,10,,女性,1985,東京都,400-600万円未満,海洋博公園・観光拠点エリア,本部町,2026-05-18 10:30:29
7873,7162,2泊,"20,000円以上 30,000円未満","地元の美味しいものを食べる,花見などの自然鑑賞,名所、旧跡の観光,テーマパーク:沖縄美ら海水族館",0,0,1,1,1,1,0,0,0,0,0,0,0,0,0,0,0,0,0,0,0,0,0,,その他家族,,"TV・ラジオ番組やCM,インターネット・アプリ",0,0,1,0,0,0,0,0,0,1,0,0,0,0,0,0,0,0,0,0,,レンタカー,0,1,0,0,0,0,0,0,,レンタカー,0,1,0,0,0,0,0,0,,大変満足,"海がとても綺麗　
食べ物が美味しい",2泊,名護市②：ブセナリゾート周辺エリア,本部町：美ら海水族館・瀬底島周辺エリア,,,,,,"20,000円以上 30,000円未満","5,000円以上 10,000円未満","20,000円以上 30,000円未満","5,000円以上 10,000円未満",11回目以上,半年-1年前,必ず来たい,半年-1年後,大変満足,"観光地やホテルのスタッフが
親切",10,"青い海　　
自然が多く残っている",ある,カード決済ができないお店がある,南部,国際通り,,中部,その他,琉球村,"5,000円未満",満足,安くて新鮮な野菜、果物,今までどうりでよい,10,安くて新鮮な野菜、果物,女性,1962,埼玉県,300-400万円未満,おんなの駅エリア,恩納村,2026-05-18 11:03:06
7874,7163,7泊以上,"40,000円以上 50,000円未満","宿でのんびり過ごす,リゾートホテルを楽しむ,地元の美味しいものを食べる,名所、旧跡の観光",1,1,1,0,1,0,0,0,0,0,0,0,0,0,0,0,0,0,0,0,0,0,0,,パートナー(恋人・夫婦など),,"宿泊事業者のHP,インターネット・アプリ,宿泊施設",0,0,0,0,0,0,1,0,0,1,0,0,0,0,0,0,0,0,1,0,,レンタカー,0,1,0,0,0,0,0,0,,レンタカー,0,1,0,0,0,0,0,0,,満足,,7泊以上,恩納村：万座毛・青の洞窟・ハレクラニ周辺エリア,恩納村：万座毛・青の洞窟・ハレクラニ周辺エリア,恩納村：万座毛・青の洞窟・ハレクラニ周辺エリア,恩納村：万座毛・青の洞窟・ハレクラニ周辺エリア,恩納村：万座毛・青の洞窟・ハレクラニ周辺エリア,恩納村：万座毛・青の洞窟・ハレクラニ周辺エリア,恩納村：万座毛・青の洞窟・ハレクラニ周辺エリア,"200,000円以上","10,000円以上 20,000円未満","10,000円以上 20,000円未満","5,000円未満",4-5回目,半年-1年前,必ず来たい,半年以内,満足,,10,,ない,,うふやんばる(国頭村・大宜味村・東村),その他,山原酒造,うふやんばる(国頭村・大宜味村・東村),その他,そばよしこ,"5,000円未満",満足,,,10,,男性,1957,東京都,200-300万円未満,道の駅おおぎみエリア,大宜味村,2026-05-18 11:41:16
7875,7164,7泊以上,"100,000円以上","リゾートホテルを楽しむ,地元の美味しいものを食べる,名所、旧跡の観光,アウトドア:ビーチ・海水浴,まちあるき・集落散策",0,1,1,0,1,0,0,0,0,0,0,0,1,0,0,0,1,0,0,0,0,0,0,,パートナー(恋人・夫婦など),,"観光展・物産展,YouTube,タクシードライバーや地元の人",1,0,0,0,0,0,0,0,0,0,1,0,0,0,0,0,0,1,0,0,,レンタカー,0,1,0,0,0,0,0,0,,レンタカー,0,1,0,0,0,0,0,0,,満足,自分の都合で自由に移動できるから。,やんばるエリアには宿泊しない,,,,,,,,"5,000円以上 10,000円未満","5,000円未満","5,000円未満","5,000円未満",6-10回目,半年以内,必ず来たい,半年以内,満足,"いつも自分で見つけた新しい発見があり、ちょっと空港からは遠いですが、ゆっくり訪れたい所です。
前回はよしこのおそばがとても美味しかった。",8,子供でも大人でも海も施設も楽しめるから。,ない,,門口(じょうぐち)やんばる(金武町・宜野座村・恩納村),道の駅ぎのざ,,門口(じょうぐち)やんばる(金武町・宜野座村・恩納村),その他,山原酒造,"5,000円未満",満足,とても見やすい。,プラネタリウムも楽しかったです。,8,ここの果物と野菜,女性,1960,東京都,100万円未満,道の駅おおぎみエリア,大宜味村,2026-05-18 11:46:49
7876,7165,3泊,"50,000円以上 100,000円未満","リゾートホテルを楽しむ,名所、旧跡の観光,友人・親戚を尋ねる",0,1,0,0,1,0,0,0,0,0,0,0,0,0,0,0,0,0,0,0,1,0,0,,パートナー(恋人・夫婦など),,"Instagram,友人・知人",0,0,0,0,0,0,0,0,0,0,0,0,1,0,0,1,0,0,0,0,,レンタカー,0,1,0,0,0,0,0,0,,レンタカー,0,1,0,0,0,0,0,0,,満足,山道を走る際に少し馬力が足りなかった為、大変満足ではなく、満足、です。,3泊,名護市②：ブセナリゾート周辺エリア,名護市②：ブセナリゾート周辺エリア,名護市①：名護市街・カヌチャリゾート周辺エリア,,,,,"50,000円以上 100,000円未満","10,000円以上 20,000円未満","20,000円以上 30,000円未満","10,000円以上 20,000円未満",4-5回目,半年以内,必ず来たい,半年-1年後,大変満足,自然がちゃんと感じられてとても満足です。,10,自然を感じるならやんばる、素敵な個人のお店もいくつかあるのでオススメしたいです。,ない,特にありません。,うふやんばる(国頭村・大宜味村・東村),やんばる野生生物保護センター,,なかやんばる(名護市・本部町・今帰仁村),今帰仁城跡,,"5,000円未満",満足,ショップに素敵なものがたくさん売ってました。,もっと色々なお店が入っていると嬉しいです。,7,ショップでは北部のものがわりと買えるのでオススメしたいです。,女性,1966,埼玉県,600-800万円未満,嵐山エリア,名護市,2026-05-18 12:06:34
7877,7166,4泊,"5,000円未満",地元の美味しいものを食べる,0,0,1,0,0,0,0,0,0,0,0,0,0,0,0,0,0,0,0,0,0,0,0,,パートナー(恋人・夫婦など),,"新聞・雑誌・ガイドブック,観光パンフレット・ポスター,観光協会のHP,Google map,インターネット・アプリ,YouTube,Twitter,Instagram",0,1,0,1,1,0,0,0,1,1,1,1,1,0,0,0,0,0,0,0,,レンタカー,0,1,0,0,0,0,0,0,,レンタカー,0,1,0,0,0,0,0,0,,やや満足,,やんばるエリアには宿泊しない,,,,,,,,使わない,"5,000円未満","5,000円未満","5,000円未満",6-10回目,半年-1年前,必ず来たい,1-3年後,大変満足,都会からはなれてちょうど良い,10,道の駅。何でも食べられて、買い物できる。,ない,,中部,その他,ブルーシール,なかやんばる(名護市・本部町・今帰仁村),その他,特になし,"5,000円未満",大変満足,食べ物が美味しかったです。,十分満足でふ。,10,,女性,1981,北海道,答えられない,おんなの駅エリア,恩納村,2026-05-18 12:31:29
7878,7167,3泊,"5,000円未満","リゾートホテルを楽しむ,地元の美味しいものを食べる,アウトドア:ビーチ・海水浴,アウトドア:マリンスポーツ",0,1,1,0,0,0,0,0,0,0,0,0,1,1,0,0,0,0,0,0,0,0,0,,その他家族,,"YouTube,友人・知人",0,0,0,0,0,0,0,0,0,0,1,0,0,0,0,1,0,0,0,0,,自家用車,1,0,0,0,0,0,0,0,,自家用車,1,0,0,0,0,0,0,0,,,,2泊,恩納村：万座毛・青の洞窟・ハレクラニ周辺エリア,恩納村：万座毛・青の洞窟・ハレクラニ周辺エリア,,,,,,"30,000円以上 40,000円未満","5,000円未満","10,000円以上 20,000円未満","20,000円以上 30,000円未満",11回目以上,半年以内,必ず来たい,半年以内,満足,,9,,ない,,なかやんばる(名護市・本部町・今帰仁村),その他,ふりっぱー,中部,美浜アメリカンビレッジ,,"10,000円以上 20,000円未満",満足,,,9,,女性,1993,沖縄県,300-400万円未満,おんなの駅エリア,恩納村,2026-05-18 12:39:08
7879,7168,3泊,"5,000円未満","地元の美味しいものを食べる,買い物、アウトレット,ドライブ・ツーリング",0,0,1,0,0,0,0,0,1,0,0,0,0,0,0,0,0,0,0,1,0,0,0,,友人,,Instagram,0,0,0,0,0,0,0,0,0,0,0,0,1,0,0,0,0,0,0,0,,自家用車,1,0,0,0,0,0,0,0,,自家用車,1,0,0,0,0,0,0,0,,,,やんばるエリアには宿泊しない,,,,,,,,"30,000円以上 40,000円未満","5,000円以上 10,000円未満","20,000円以上 30,000円未満","30,000円以上 40,000円未満",11回目以上,5年以上前,必ず来たい,5年以上,満足,トイレがあまり清潔ではない,7,南部より海が綺麗で美味しいものがたくさんあります,ない,,中部,残波岬,,中部,美浜アメリカンビレッジ,,"30,000円以上 40,000円未満",満足,ウニソースおいしい,上記のウニソース、持ち帰り用はパウチで販売して欲しい,9,ウニソース焼き美味しい,女性,1970,福岡県,1200-1500万円未満,おんなの駅エリア,恩納村,2026-05-18 12:40:22
7880,7169,3泊,"5,000円未満","宿でのんびり過ごす,リゾートホテルを楽しむ,地元の美味しいものを食べる,アウトドア:ビーチ・海水浴,友人・親戚を尋ねる",1,1,1,0,0,0,0,0,0,0,0,0,1,0,0,0,0,0,0,0,1,0,0,,友人,,友人・知人,0,0,0,0,0,0,0,0,0,0,0,0,0,0,0,1,0,0,0,0,,自家用車,1,0,0,0,0,0,0,0,,自家用車,1,0,0,0,0,0,0,0,,,,2泊,恩納村：万座毛・青の洞窟・ハレクラニ周辺エリア,恩納村：万座毛・青の洞窟・ハレクラニ周辺エリア,,,,,,"20,000円以上 30,000円未満","10,000円以上 20,000円未満","20,000円以上 30,000円未満","5,000円以上 10,000円未満",初めて,,やや来たい,3-5年後,満足,,7,,ない,,なかやんばる(名護市・本部町・今帰仁村),,,南部,,,"5,000円以上 10,000円未満",満足,,,7,,女性,1982,福岡県,600-800万円未満,おんなの駅エリア,恩納村,2026-05-18 12:40:34
7881,7170,4泊,"20,000円以上 30,000円未満","リゾートホテルを楽しむ,テーマパーク:JUNGLIA,ドライブ・ツーリング",0,1,0,0,0,0,1,0,0,0,0,0,0,0,0,0,0,0,0,1,0,0,0,,パートナー(恋人・夫婦など),,"インターネット・アプリ,Instagram",0,0,0,0,0,0,0,0,0,1,0,0,1,0,0,0,0,0,0,0,,レンタカー,0,1,0,0,0,0,0,0,,レンタカー,0,1,0,0,0,0,0,0,,満足,"いつもレンタカーを利用してます。
他に方法が分からない。",3泊,本部町：美ら海水族館・瀬底島周辺エリア,本部町：美ら海水族館・瀬底島周辺エリア,本部町：美ら海水族館・瀬底島周辺エリア,,,,,"20,000円以上 30,000円未満","20,000円以上 30,000円未満","20,000円以上 30,000円未満","20,000円以上 30,000円未満",2-3回目,1-3年前,何とも言えない,1-3年後,満足,,8,,ない,"自然が豊かで、そのままで良いと
思います。",なかやんばる(名護市・本部町・今帰仁村),JUNGLIA,,なかやんばる(名護市・本部町・今帰仁村),その他,ホテルへ戻る,"5,000円未満",満足,"買い物が楽しかった。
食べる時間がなかった。","素敵な場所なので、またゆっくり
行きたい。店員さんの対応も良かった。
ありがとうございます。
",8,,女性,1973,千葉県,1000-1200万円未満,今帰仁の駅そーれエリア,今帰仁村,2026-05-18 12:49:06
7882,7171,3泊,"100,000円以上",テーマパーク:沖縄美ら海水族館,0,0,0,0,0,1,0,0,0,0,0,0,0,0,0,0,0,0,0,0,0,0,0,,未就学児を含む家族,,美ら海水族館等の観光関連事業者HP,0,0,0,0,0,1,0,0,0,0,0,0,0,0,0,0,0,0,0,0,,レンタカー,0,1,0,0,0,0,0,0,,レンタカー,0,1,0,0,0,0,0,0,,大変満足,,1泊,本部町：美ら海水族館・瀬底島周辺エリア,,,,,,,"50,000円以上 100,000円未満","5,000円以上 10,000円未満","5,000円以上 10,000円未満","5,000円以上 10,000円未満",2-3回目,5年以上前,必ず来たい,1-3年後,大変満足,,10,,ない,,中部,その他,ネオパークオキナワ,中部,その他,,"5,000円以上 10,000円未満",大変満足,,,10,,女性,1985,埼玉県,1000-1200万円未満,海洋博公園・観光拠点エリア,本部町,2026-05-18 13:19:17
7883,7172,4泊,"10,000円以上 20,000円未満","宿でのんびり過ごす,リゾートホテルを楽しむ,地元の美味しいものを食べる,テーマパーク:沖縄美ら海水族館,アウトドア:ビーチ・海水浴",1,1,1,0,0,1,0,0,0,0,0,0,1,0,0,0,0,0,0,0,0,0,0,,未就学児を含む家族,,"Google map,YouTube,友人・知人",0,0,0,0,0,0,0,0,1,0,1,0,0,0,0,1,0,0,0,0,,レンタカー,0,1,0,0,0,0,0,0,,レンタカー,0,1,0,0,0,0,0,0,,満足,,3泊,本部町：美ら海水族館・瀬底島周辺エリア,本部町：美ら海水族館・瀬底島周辺エリア,本部町：美ら海水族館・瀬底島周辺エリア,,,,,"40,000円以上 50,000円未満","5,000円以上 10,000円未満","5,000円以上 10,000円未満","5,000円以上 10,000円未満",初めて,,必ず来たい,半年-1年後,大変満足,,10,,ない,,なかやんばる(名護市・本部町・今帰仁村),沖縄美ら海水族館,,なかやんばる(名護市・本部町・今帰仁村),ナゴパイナップルパーク,,"5,000円未満",大変満足,,,10,,男性,1991,東京都,1000-1200万円未満,海洋博公園・観光拠点エリア,本部町,2026-05-18 13:41:54
