1214,1161,4泊,"10,000円以上 20,000円未満","宿でのんびり過ごす,リゾートホテルを楽しむ,アウトドア:ビーチ・海水浴",1,1,0,0,0,0,0,0,0,0,0,0,1,0,0,0,0,0,0,0,0,0,0,,パートナー(恋人・夫婦など),,インターネット・アプリ,0,0,0,0,0,0,0,0,0,1,0,0,0,0,0,0,0,0,0,0,,レンタカー,0,1,0,0,0,0,0,0,,レンタカー,0,1,0,0,0,0,0,0,,満足,色々寄り道ができるので,2泊,"20,000円以上 30,000円未満","5,000円以上 10,000円未満","10,000円以上 20,000円未満","5,000円以上 10,000円未満",4-5回目,半年-1年前,必ず来たい,半年-1年後,大変満足,海が綺麗なので,10,自然あふれて海が綺麗,ない,,うふやんばる(国頭村・大宜味村・東村),その他,又吉コーヒー,なかやんばる(名護市・本部町・今帰仁村),沖縄美ら海水族館,,"5,000円未満",普通,,,5,,男性,1978,千葉県,600-800万円未満,道の駅ゆいゆい国頭エリア,国頭村,2025-11-12 16:35:08
1215,1162,4泊,"5,000円以上 10,000円未満","リゾートホテルを楽しむ,地元の美味しいものを食べる,名所、旧跡の観光,アウトドア:ビーチ・海水浴",0,1,1,0,1,0,0,0,0,0,0,0,1,0,0,0,0,0,0,0,0,0,0,,パートナー(恋人・夫婦など),,"インターネット・アプリ,YouTube",0,0,0,0,0,0,0,0,0,1,1,0,0,0,0,0,0,0,0,0,,レンタカー,0,1,0,0,0,0,0,0,,レンタカー,0,1,0,0,0,0,0,0,,満足,,2泊,"30,000円以上 40,000円未満","5,000円以上 10,000円未満","10,000円以上 20,000円未満","5,000円以上 10,000円未満",4-5回目,3-5年前,来たい,1-3年後,満足,,8,,ない,,うふやんばる(国頭村・大宜味村・東村),その他,,うふやんばる(国頭村・大宜味村・東村),やんばる野生生物保護センター,,"5,000円未満",普通,,,8,,女性,1972,千葉県,400-600万円未満,道の駅ゆいゆい国頭エリア,国頭村,2025-11-12 16:35:18
1216,1163,6泊,"50,000円以上 100,000円未満","宿でのんびり過ごす,リゾートホテルを楽しむ,地元の美味しいものを食べる,テーマパーク:その他,買い物、アウトレット,各種体験(手作り、果物狩りなど)",1,1,1,0,0,0,0,1,1,0,0,0,0,0,0,0,0,1,0,0,0,0,0,,未就学児を含む家族,,"TV・ラジオ番組やCM,Google map,インターネット・アプリ,Instagram",0,0,1,0,0,0,0,0,1,1,0,0,1,0,0,0,0,0,0,0,,レンタカー,0,1,0,0,0,0,0,0,,レンタカー,0,1,0,0,0,0,0,0,,大変満足,行動範囲が広がるのと、雨が降ることが多かったので濡れずに移動できて便利だった,4泊,"50,000円以上 100,000円未満","10,000円以上 20,000円未満","30,000円以上 40,000円未満","10,000円以上 20,000円未満",4-5回目,1-3年前,必ず来たい,半年-1年後,大変満足,自然に触れ合い、見たことのない動物や植物が見れた。色々な体験ができ楽しめた。,10,"ネオパーク レッサーパンダにエサやりができるのが楽しい
パイナップルパーク カートに乗ってパイナップルや植物を見れて面白い
",ない,,なかやんばる(名護市・本部町・今帰仁村),古宇利島(オーシャンタワー/ハートロック),,門口(じょうぐち)やんばる(金武町・宜野座村・恩納村),恩納村海岸(青の洞窟),,"5,000円未満",大変満足,"レッサーパンダにエサやりできるのが良い
バードエリアやふれあい広場、お土産も充実してた",途中に軽食やドリンクが置いてある売店があるといいです,10,"レッサーパンダエサやり体験
手頃な価格でエサやりが出来ることと、とても近くでレッサーパンダを見ることができる",女性,1997,神奈川県,400-600万円未満,嵐山エリア,名護市,2025-11-12 16:56:28
1217,1164,6泊,"40,000円以上 50,000円未満","地元の美味しいものを食べる,テーマパーク:その他,買い物、アウトレット",0,0,1,0,0,0,0,1,1,0,0,0,0,0,0,0,0,0,0,0,0,0,0,,その他家族,,インターネット・アプリ,0,0,0,0,0,0,0,0,0,1,0,0,0,0,0,0,0,0,0,0,,レンタカー,0,1,0,0,0,0,0,0,,レンタカー,0,1,0,0,0,0,0,0,,満足,やはり車で移動できるので、色々な所に行けて便利だと思いました。,4泊,"40,000円以上 50,000円未満","20,000円以上 30,000円未満","20,000円以上 30,000円未満","5,000円以上 10,000円未満",初めて,,必ず来たい,半年以内,満足,パイナップルパークで乗り物に乗り、パーク内でも写真スポットがたくさんあったので、とても楽しかったのと、ネオパークでレッサーパンダの餌やり体験がとても楽しかったです^_^,10,古宇利島からの海が絶景だったことと、やはりパイナップルパークとネオパークが楽しかったので勧めるたいです^_^,ない,,なかやんばる(名護市・本部町・今帰仁村),ナゴパイナップルパーク,,なかやんばる(名護市・本部町・今帰仁村),沖縄美ら海水族館,,"5,000円未満",満足,レッサーパンダの餌やりや色々な種類の鳥や生き物がいて、楽しかったです^_^,レッサーパンダの物の拡大^_^,10,"レッサーパンダに餌やりができること。
国内で餌やりができる所が他にないので、貴重だと思いました^_^",女性,1970,東京都,300-400万円未満,嵐山エリア,名護市,2025-11-12 17:00:00
1218,1165,4泊,"30,000円以上 40,000円未満","宿でのんびり過ごす,リゾートホテルを楽しむ,地元の美味しいものを食べる",1,1,1,0,0,0,0,0,0,0,0,0,0,0,0,0,0,0,0,0,0,0,0,,友人,,"観光パンフレット・ポスター,インターネット・アプリ",0,0,0,1,0,0,0,0,0,1,0,0,0,0,0,0,0,0,0,0,,レンタカー,0,1,0,0,0,0,0,0,,レンタカー,0,1,0,0,0,0,0,0,,満足,空港からゆっくり下道で海を堪能しながら来たけど、台風で景色が。。。,2泊,"40,000円以上 50,000円未満","5,000円以上 10,000円未満","10,000円以上 20,000円未満","10,000円以上 20,000円未満",2-3回目,半年以内,来たい,半年-1年後,満足,とにかく自然に癒される。,8,自然豊かで、市内に比べて交通や人が少ないゆっくり過ごせる,ない,やんばるクイナ出るエリアも柵とかの対策されていて，良いと思った,南部,その他,高良食堂,中部,その他,ハレクニラ沖縄,"30,000円以上 40,000円未満",満足,"初めて訪れたが、敷地内広くて
ゆっくり過ごせる","オクマ限定もチョコ小さいサイズがあって、お土産に良い
そのあと，リップなど小さいコスメ入れるのに良いと思った",8,自然とゆっくり過ごせて、ゆっくり海を見ながらの大浴場,女性,1987,大分県,200-300万円未満,道の駅ゆいゆい国頭エリア,国頭村,2025-11-12 19:03:19
1219,1166,4泊,"5,000円以上 10,000円未満","宿でのんびり過ごす,リゾートホテルを楽しむ,花見などの自然鑑賞,名所、旧跡の観光,まちあるき・集落散策,各種体験(手作り、果物狩りなど),ドライブ・ツーリング,友人・親戚を尋ねる",1,1,0,1,1,0,0,0,0,0,0,0,0,0,0,0,1,1,0,1,1,0,0,,友人,,"新聞・雑誌・ガイドブック,TV・ラジオ番組やCM,観光パンフレット・ポスター,インターネット・アプリ,Instagram,宿泊施設",0,1,1,1,0,0,0,0,0,1,0,0,1,0,0,0,0,0,1,0,,レンタカー,0,1,0,0,0,0,0,0,,"レンタカー,徒歩",0,1,0,0,0,1,0,0,,大変満足,"車があるとどこでも行ける。
道の駅や人が少ない所、観光地から離れた所へも行きやすい。",2泊,"30,000円以上 40,000円未満","30,000円以上 40,000円未満","5,000円以上 10,000円未満","40,000円以上 50,000円未満",初めて,,必ず来たい,半年-1年後,大変満足,雨続きだけど、ホテルで１日過ごすことができゆっくり休むことができた。,9,海もあるけど、山もある。自然がいっぱいあるところ。道の駅もたくさんあり現地の方も優しくて、特産物もあり楽しかった。,ない,今の所思い浮かばないです、,南部,その他,那覇市,中部,残波岬,,"30,000円以上 40,000円未満",大変満足,"アルコールだけでなく、ソフトドリンクや軽食が常にある。
体験は、まだやってないので予約間に合えばやります。",お土産のポーチ？名前入りでとても可愛かったです。中身無しでポーチ？だけでも販売して欲しいです笑,9,"観光地だけど、離れてて静か。
人もゴミゴミしてないし、ゆっくり過ごせるところ。",女性,1990,広島県,400-600万円未満,道の駅ゆいゆい国頭エリア,国頭村,2025-11-12 19:05:50
1220,1167,2泊,"20,000円以上 30,000円未満","地元の美味しいものを食べる,名所、旧跡の観光",0,0,1,0,1,0,0,0,0,0,0,0,0,0,0,0,0,0,0,0,0,0,0,,パートナー(恋人・夫婦など),,Instagram,0,0,0,0,0,0,0,0,0,0,0,0,1,0,0,0,0,0,0,0,,自家用車,1,0,0,0,0,0,0,0,,自家用車,1,0,0,0,0,0,0,0,,,,2泊,"10,000円以上 20,000円未満","5,000円以上 10,000円未満","20,000円以上 30,000円未満","10,000円以上 20,000円未満",6-10回目,半年以内,必ず来たい,半年以内,満足,,10,,ない,,南部,首里城公園,,なかやんばる(名護市・本部町・今帰仁村),今帰仁城跡,,"5,000円以上 10,000円未満",大変満足,,,10,,女性,1997,沖縄県,200-300万円未満,道の駅ゆいゆい国頭エリア,国頭村,2025-11-12 20:09:39
1221,1168,6泊,"40,000円以上 50,000円未満","リゾートホテルを楽しむ,地元の美味しいものを食べる,名所、旧跡の観光,テーマパーク:沖縄美ら海水族館,まちあるき・集落散策,ドライブ・ツーリング",0,1,1,0,1,1,0,0,0,0,0,0,0,0,0,0,1,0,0,1,0,0,0,,パートナー(恋人・夫婦など),,"新聞・雑誌・ガイドブック,インターネット・アプリ,YouTube",0,1,0,0,0,0,0,0,0,1,1,0,0,0,0,0,0,0,0,0,,レンタカー,0,1,0,0,0,0,0,0,,レンタカー,0,1,0,0,0,0,0,0,,満足,天候が悪かったのでレンタカーで良かった,やんばるエリアには宿泊しない,使わない,"5,000円未満","5,000円未満","5,000円未満",初めて,,必ず来たい,半年-1年後,満足,人柄が良かった,9,自然の雄大さ,ない,,なかやんばる(名護市・本部町・今帰仁村),沖縄美ら海水族館,,うふやんばる(国頭村・大宜味村・東村),辺戸岬,,"5,000円未満",満足,人柄,,9,,男性,1955,北海道,300-400万円未満,道の駅ゆいゆい国頭エリア,国頭村,2025-11-12 20:13:46
1222,1169,6泊,"10,000円以上 20,000円未満",アウトドア:マリンスポーツ,0,0,0,0,0,0,0,0,0,0,0,0,0,1,0,0,0,0,0,0,0,0,0,,その他,部活動,"Google map,Instagram",0,0,0,0,0,0,0,0,1,0,0,0,1,0,0,0,0,0,0,0,,レンタカー,0,1,0,0,0,0,0,0,,レンタカー,0,1,0,0,0,0,0,0,,やや満足,,6泊,"50,000円以上 100,000円未満",使わない,"5,000円未満",使わない,2-3回目,1-3年前,必ず来たい,1-3年後,大変満足,,7,美しい自然,ない,,南部,国際通り,,その他離島,特に無し,,"5,000円未満",大変満足,,,10,朝食でいろんな種類の沖縄料理が食べ放題なのが最高です。,女性,2002,神奈川県,600-800万円未満,道の駅ゆいゆい国頭エリア,国頭村,2025-11-12 20:14:30
1223,1170,日帰り,"5,000円未満",その他スポーツ(ゴルフ、テニスなど),0,0,0,0,0,0,0,0,0,0,0,0,0,0,0,0,0,0,1,0,0,0,0,,友人,,友人・知人,0,0,0,0,0,0,0,0,0,0,0,0,0,0,0,1,0,0,0,0,,自家用車,1,0,0,0,0,0,0,0,,自家用車,1,0,0,0,0,0,0,0,,,,やんばるエリアには宿泊しない,使わない,"5,000円以上 10,000円未満","5,000円未満",使わない,11回目以上,半年以内,来たい,半年以内,満足,,9,,ある,道の舗装,なかやんばる(名護市・本部町・今帰仁村),その他,宜野座ゴルフクラブ,うふやんばる(国頭村・大宜味村・東村),,,"5,000円以上 10,000円未満",満足,,,7,,男性,2000,東京都,200-300万円未満,-,-,2025-11-12 20:14:47
1224,1171,4泊,"50,000円以上 100,000円未満","アウトドア:ビーチ・海水浴,アウトドア:キャンプ,出張など仕事関係",0,0,0,0,0,0,0,0,0,0,0,0,1,0,0,1,0,0,0,0,0,1,0,,自分ひとり,,"インターネット・アプリ,Instagram",0,0,0,0,0,0,0,0,0,1,0,0,1,0,0,0,0,0,0,0,,路線バス、高速バス、シャトルバス,0,0,0,0,0,1,0,0,,レンタカー,0,1,0,0,0,0,0,0,,やや不満,レンタカー会社が少なく高い！,4泊,"40,000円以上 50,000円未満","20,000円以上 30,000円未満","20,000円以上 30,000円未満","10,000円以上 20,000円未満",4-5回目,半年以内,必ず来たい,半年-1年後,満足,地元民の温かさ！これに尽きます！,10,やんばるの自然と人の温かさは本当に特別です！,ある,昼の時間にタクシーが動いてない,南部,平和祈念公園,,その他離島,,沖永良部島,"20,000円以上 30,000円未満",満足,ビーチが綺麗！,雨の日でも楽しめるアクティビティがあると良い,10,"都会から離れており、自然を堪能したい方にはもってこい！
ラウンジ付きのプランにすれば、朝から晩までお酒も飲み放題！",男性,1998,茨城県,200-300万円未満,道の駅ゆいゆい国頭エリア,国頭村,2025-11-12 20:19:40
1225,1172,6泊,"30,000円以上 40,000円未満","リゾートホテルを楽しむ,地元の美味しいものを食べる,名所、旧跡の観光,まちあるき・集落散策,ドライブ・ツーリング",0,1,1,0,1,0,0,0,0,0,0,0,0,0,0,0,1,0,0,1,0,0,0,,友人,,"Google map,インターネット・アプリ,Instagram",0,0,0,0,0,0,0,0,1,1,0,0,1,0,0,0,0,0,0,0,,レンタカー,0,1,0,0,0,0,0,0,,レンタカー,0,1,0,0,0,0,0,0,,大変満足,レンタルした車も良かったし、レンタルした会社の対応もとても良かったから。,4泊,"50,000円以上 100,000円未満","5,000円以上 10,000円未満","30,000円以上 40,000円未満","5,000円未満",4-5回目,1-3年前,必ず来たい,半年以内,満足,天候が悪く、あまり屋外で遊べませんでしたが、立ち寄ったやんばるの施設でとても職員の方の対応が良く、是非また天候のいい時に来て散策したいと思った。,10,沖縄の街エリアにはない、自然の良さがあるから。,ない,"特に無いです。
トイレもどこもキレイにされており、感心いたしました。",なかやんばる(名護市・本部町・今帰仁村),古宇利島(オーシャンタワー/ハートロック),,なかやんばる(名護市・本部町・今帰仁村),その他,特になし,"5,000円未満",やや不満,資料館のようなエリアに利用日の限定があり、入れなかったから。,飲食は選択の種類があり、また沖縄のやちむんで提供されたカレーがレストラン等ではないのに、紙皿やプラスチックトレイではなく、とても良かった。,10,"やんばるくいな関係の物が沢山あったのと、やちむんで提供されたカレーがとても良かったから。
どこにでもある、お土産屋さんではなく、特徴があったから。",女性,1961,長崎県,300-400万円未満,道の駅ゆいゆい国頭エリア,国頭村,2025-11-12 20:33:11
1226,1173,3泊,"40,000円以上 50,000円未満","地元の美味しいものを食べる,買い物、アウトレット,友人・親戚を尋ねる",0,0,1,0,0,0,0,0,1,0,0,0,0,0,0,0,0,0,0,0,1,0,0,,未就学児を含む家族,,"Instagram,友人・知人",0,0,0,0,0,0,0,0,0,0,0,0,1,0,0,1,0,0,0,0,,レンタカー,0,1,0,0,0,0,0,0,,レンタカー,0,1,0,0,0,0,0,0,,大変満足,"レンタカーを利用しました。
自分たちのペースで自由に行きたいところへ行くことができるから",3泊,"40,000円以上 50,000円未満","5,000円以上 10,000円未満","40,000円以上 50,000円未満","30,000円以上 40,000円未満",11回目以上,半年-1年前,必ず来たい,1-3年後,大変満足,那覇周辺と違い、のんびりと自然を感じることができるから,10,やんばるの海が、人も少なくて、きれいでゆっくりとぼーっとできるから,ある,"子連れだと、夜ご飯選びに困ることがありました。
お店がどこでもやってるわけではなく、子どもが食べられるものお考えると、居酒屋などは候補から外れ、子連れで行けそうなところは閉まっていたりしたことがあります。
いつも泊まっているリゾートホテルで毎夕食となると食費がかさむなと思うと、外で探すことが多いです。",うふやんばる(国頭村・大宜味村・東村),辺戸岬,,なかやんばる(名護市・本部町・今帰仁村),沖縄美ら海水族館,,"50,000円以上 100,000円未満",大変満足,"親族に合うため毎年泊まっています。
スタッフの方もみんな親切で、ご飯も美味しく、プライベートビーチもあるので、ゆっくりと楽しく過ごすことができるから","飲食、お土産共に毎回大満足しています。
アクティビティは、まだ利用したことがないので、次回利用したいと思っています。
（今回は雨のためアクティビティを利用することができませんでした）",10,"ご飯がおいしい
手作りのポークたまごを食べられたり、沖縄料理をたくさん楽しむことができるから",女性,1993,埼玉県,800-1000万円未満,道の駅ゆいゆい国頭エリア,国頭村,2025-11-12 20:51:33
1227,1174,7泊以上,"20,000円以上 30,000円未満","リゾートホテルを楽しむ,地元の美味しいものを食べる,テーマパーク:沖縄美ら海水族館,テーマパーク:JUNGLIA,アウトドア:ビーチ・海水浴,アウトドア:マリンスポーツ,各種体験(手作り、果物狩りなど)",0,1,1,0,0,1,1,0,0,0,0,0,1,1,0,0,0,1,0,0,0,0,0,,パートナー(恋人・夫婦など),,"インターネット・アプリ,YouTube",0,0,0,0,0,0,0,0,0,1,1,0,0,0,0,0,0,0,0,0,,レンタカー,0,1,0,0,0,0,0,0,,レンタカー,0,1,0,0,0,0,0,0,,満足,,2泊,"100,000円以上 200,000円未満","20,000円以上 30,000円未満","10,000円以上 20,000円未満","5,000円以上 10,000円未満",2-3回目,半年以内,来たい,半年以内,満足,まだ体験していないものが沢山ある,8,手が入りきっていない自然,ある,飲食店が早く閉まる,なかやんばる(名護市・本部町・今帰仁村),沖縄美ら海水族館,,うふやんばる(国頭村・大宜味村・東村),辺戸岬,,"5,000円未満",大変満足,"美味しい。ボリューム満点。
マグロが美味しい",,9,美味しさと、夕方の風景,男性,1963,兵庫県,600-800万円未満,道の駅ゆいゆい国頭エリア,国頭村,2025-11-12 20:51:52