Synergy!ID,HistoryID,宿泊数(県内),交通費,訪問目的(やんばるエリア)_ALL,訪問目的(やんばるエリア)_宿でのんびり過ごす,訪問目的(やんばるエリア)_リゾートホテルを楽しむ,訪問目的(やんばるエリア)_地元の美味しいものを食べる,訪問目的(やんばるエリア)_花見などの自然鑑賞,訪問目的(やんばるエリア)_名所、旧跡の観光,訪問目的(やんばるエリア)_テーマパーク:沖縄美ら海水族館,訪問目的(やんばるエリア)_テーマパーク:JUNGLIA,訪問目的(やんばるエリア)_テーマパーク:その他,訪問目的(やんばるエリア)_買い物、アウトレット,訪問目的(やんばるエリア)_お祭りやイベントへの参加・見物,訪問目的(やんばるエリア)_地域の行事,訪問目的(やんばるエリア)_スポーツ観戦や芸能鑑賞(コンサート等),訪問目的(やんばるエリア)_アウトドア:ビーチ・海水浴,訪問目的(やんばるエリア)_アウトドア:マリンスポーツ,訪問目的(やんばるエリア)_アウトドア:登山・トレッキング,訪問目的(やんばるエリア)_アウトドア:キャンプ,訪問目的(やんばるエリア)_まちあるき・集落散策,訪問目的(やんばるエリア)_各種体験(手作り、果物狩りなど),訪問目的(やんばるエリア)_その他スポーツ(ゴルフ、テニスなど),訪問目的(やんばるエリア)_ドライブ・ツーリング,訪問目的(やんばるエリア)_友人・親戚を尋ねる,訪問目的(やんばるエリア)_出張など仕事関係,訪問目的(やんばるエリア)_その他,訪問目的(やんばるエリア)_その他_text,同行者(やんばるエリア),同行者(やんばるエリア)_その他_text,情報収集(やんばるエリア)_ALL,情報収集(やんばるエリア)_観光展・物産展,情報収集(やんばるエリア)_新聞・雑誌・ガイドブック,情報収集(やんばるエリア)_TV・ラジオ番組やCM,情報収集(やんばるエリア)_観光パンフレット・ポスター,情報収集(やんばるエリア)_観光協会のHP,情報収集(やんばるエリア)_美ら海水族館等の観光関連事業者HP,情報収集(やんばるエリア)_宿泊事業者のHP,情報収集(やんばるエリア)_Chat GPT等の生成AI,情報収集(やんばるエリア)_Google map,情報収集(やんばるエリア)_インターネット・アプリ,情報収集(やんばるエリア)_YouTube,情報収集(やんばるエリア)_Twitter,情報収集(やんばるエリア)_Instagram,情報収集(やんばるエリア)_Facebook,情報収集(やんばるエリア)_ブログ,情報収集(やんばるエリア)_友人・知人,情報収集(やんばるエリア)_観光協会・空港・道の駅等の案内所,情報収集(やんばるエリア)_タクシードライバーや地元の人,情報収集(やんばるエリア)_宿泊施設,情報収集(やんばるエリア)_その他,情報収集(やんばるエリア)_その他_text,やんばるエリアまでの交通手段_ALL,やんばるエリアまでの交通手段_自家用車,やんばるエリアまでの交通手段_レンタカー,やんばるエリアまでの交通手段_ヘリコプター,やんばるエリアまでの交通手段_旅行会社ツアーバス,やんばるエリアまでの交通手段_フェリー,やんばるエリアまでの交通手段_路線バス、高速バス、シャトルバス,やんばるエリアまでの交通手段_タクシー,やんばるエリアまでの交通手段_その他,やんばるエリアまでの交通手段_その他_text,やんばるエリア内での交通手段_ALL,やんばるエリア内での交通手段_自家用車,やんばるエリア内での交通手段_レンタカー,やんばるエリア内での交通手段_タクシー,やんばるエリア内での交通手段_旅行会社ツアーバス,やんばるエリア内での交通手段_路線バス,やんばるエリア内での交通手段_徒歩,やんばるエリア内での交通手段_レンタサイクル,やんばるエリア内での交通手段_その他,やんばるエリア内での交通手段_その他_text,やんばるエリア内での交通手段の満足度,やんばるエリア内での交通手段の満足度の理由,宿泊数(やんばるエリア),宿泊費(やんばるエリア),観光費(やんばるエリア),飲食費(やんばるエリア),土産費(やんばるエリア),訪問回数(やんばるエリア),前回訪問時期(やんばるエリア),今後の来訪意向(やんばるエリア),今後の来訪時期(やんばるエリア),体験・サービス満足度(やんばるエリア),体験・サービス満足度の理由(やんばるエリア),推奨度(やんばるエリア),推奨項目(やんばるエリア),改善点(やんばるエリア),改善点の内容(やんばるエリア),回答前に訪問したエリア(調査地),回答前に訪問した主な施設(調査地),回答前に訪問した主な施設・その他(調査地),回答後に訪問予定のエリア(調査地),回答後に訪問予定の主な施設(調査地),回答後に訪問予定の主な施設・その他(調査地),現地消費額(調査地),体験・サービス満足度(調査地),体験・サービス満足度の理由(調査地),施設に求めるもの(調査地),施設推奨度(調査地),施設推奨項目(調査地),性別,生年,都道府県,世帯年収,訪問地のエリア名,訪問地の市町村,回答日時
624,586,2泊,"20,000円以上 30,000円未満","地元の美味しいものを食べる,買い物、アウトレット",0,0,1,0,0,0,0,0,1,0,0,0,0,0,0,0,0,0,0,0,0,0,0,,パートナー(恋人・夫婦など),,インターネット・アプリ,0,0,0,0,0,0,0,0,0,1,0,0,0,0,0,0,0,0,0,0,,レンタカー,0,1,0,0,0,0,0,0,,レンタカー,0,1,0,0,0,0,0,0,,満足,,2泊,"40,000円以上 50,000円未満","5,000円以上 10,000円未満","20,000円以上 30,000円未満","5,000円以上 10,000円未満",初めて,,来たい,1-3年後,満足,,7,,ない,,なかやんばる(名護市・本部町・今帰仁村),沖縄美ら海水族館,,なかやんばる(名護市・本部町・今帰仁村),沖縄美ら海水族館,,"5,000円未満",満足,,,7,,女性,1959,福岡県,200-300万円未満,名護市街エリア,名護市,2025-10-23 6:22:14
625,587,2泊,"20,000円以上 30,000円未満","リゾートホテルを楽しむ,買い物、アウトレット",0,1,0,0,0,0,0,0,1,0,0,0,0,0,0,0,0,0,0,0,0,0,0,,パートナー(恋人・夫婦など),,インターネット・アプリ,0,0,0,0,0,0,0,0,0,1,0,0,0,0,0,0,0,0,0,0,,レンタカー,0,1,0,0,0,0,0,0,,レンタカー,0,1,0,0,0,0,0,0,,満足,,2泊,"30,000円以上 40,000円未満","5,000円以上 10,000円未満","10,000円以上 20,000円未満","10,000円以上 20,000円未満",初めて,,来たい,1-3年後,満足,,7,,ない,,なかやんばる(名護市・本部町・今帰仁村),沖縄美ら海水族館,,なかやんばる(名護市・本部町・今帰仁村),,,"5,000円以上 10,000円未満",満足,,,7,,男性,1953,福岡県,200-300万円未満,名護市街エリア,名護市,2025-10-23 6:54:05
626,588,7泊以上,"5,000円以上 10,000円未満",出張など仕事関係,0,0,0,0,0,0,0,0,0,0,0,0,0,0,0,0,0,0,0,0,0,1,0,,自分ひとり,,"Google map,インターネット・アプリ",0,0,0,0,0,0,0,0,1,1,0,0,0,0,0,0,0,0,0,0,,その他,0,0,0,0,0,0,0,1,仕事先の送迎,"路線バス,その他",0,0,0,0,1,0,0,1,自転車,やや満足,待つ,7泊以上,"30,000円以上 40,000円未満","10,000円以上 20,000円未満","10,000円以上 20,000円未満","5,000円以上 10,000円未満",2-3回目,1-3年前,必ず来たい,1-3年後,やや満足,楽しめるところがちょっと遠い,8,景色,ある,街灯が少ない,門口(じょうぐち)やんばる(金武町・宜野座村・恩納村),その他,石川,その他離島,特に無し,,"5,000円以上 10,000円未満",満足,ご飯が美味しい,美味しかったです,7,レストラン,女性,1972,北海道,600-800万円未満,伊芸・屋嘉エリア,金武町,2025-10-23 10:28:01
627,589,4泊,"30,000円以上 40,000円未満","宿でのんびり過ごす,地元の美味しいものを食べる,テーマパーク:沖縄美ら海水族館",1,0,1,0,0,1,0,0,0,0,0,0,0,0,0,0,0,0,0,0,0,0,0,,その他家族,,"観光展・物産展,観光パンフレット・ポスター,Instagram,宿泊施設",1,0,0,1,0,0,0,0,0,0,0,0,1,0,0,0,0,0,1,0,,レンタカー,0,1,0,0,0,0,0,0,,レンタカー,0,1,0,0,0,0,0,0,,大変満足,海が大好きで1年ぶりに来ました！住民の方々の対応もすごく皆さん優しくて天気も雨予報でしたが後半天気が良くなり海も見れました！とても楽しめました！また来ます！,2泊,"30,000円以上 40,000円未満","10,000円以上 20,000円未満","20,000円以上 30,000円未満","20,000円以上 30,000円未満",2-3回目,半年-1年前,必ず来たい,半年-1年後,大変満足,"皆さんの優しさで更に楽しめました！
",10,渋滞も少なく海綺麗でご飯も美味しいです！,ない,,門口(じょうぐち)やんばる(金武町・宜野座村・恩納村),道の駅ぎのざ,,なかやんばる(名護市・本部町・今帰仁村),ナゴパイナップルパーク,,"5,000円以上 10,000円未満",満足,子供にもニコニコ皆さんがして下さいました！,島バナナと海ぶどう毎回購入します！,10,特産品が新鮮！！！子供がミニトマトやバナナ興奮していました！,女性,1995,鹿児島県,2000万円以上,道の駅ぎのざエリア,宜野座村,2025-10-23 10:47:35
628,590,日帰り,"20,000円以上 30,000円未満","地元の美味しいものを食べる,テーマパーク:沖縄美ら海水族館,アウトドア:ビーチ・海水浴,アウトドア:キャンプ,各種体験(手作り、果物狩りなど)",0,0,1,0,0,1,0,0,0,0,0,0,1,0,0,1,0,1,0,0,0,0,0,,未就学児を含む家族,,インターネット・アプリ,0,0,0,0,0,0,0,0,0,1,0,0,0,0,0,0,0,0,0,0,,自家用車,1,0,0,0,0,0,0,0,,自家用車,1,0,0,0,0,0,0,0,,,,やんばるエリアには宿泊しない,使わない,"20,000円以上 30,000円未満","10,000円以上 20,000円未満",使わない,11回目以上,半年以内,必ず来たい,半年以内,普通,可もなく不可もなく、ただ、もう少し地元還元していただければ嬉しいなあ、と。,5,"大石林山
行くたび楽しい、飽きることなく満喫できる",ある,観光の方が多くなるのはいいのですが、敷地内侵入や交通ルール無視等で観光シーズンは外出したくない。,なかやんばる(名護市・本部町・今帰仁村),古宇利島(オーシャンタワー/ハートロック),,特になし,特に無し,,使わない,普通,開店時間が思ったより遅く、何も買わずに帰ったせめて10時には開いててほしいな,どれも美味しそうで価格も付加価値考えると妥当かなと。,5,普通,女性,1989,沖縄県,400-600万円未満,今帰仁の駅そーれエリア,今帰仁村,2025-10-23 10:50:42
630,591,3泊,"5,000円以上 10,000円未満","宿でのんびり過ごす,リゾートホテルを楽しむ,地元の美味しいものを食べる,花見などの自然鑑賞,名所、旧跡の観光",1,1,1,1,1,0,0,0,0,0,0,0,0,0,0,0,0,0,0,0,0,0,0,,パートナー(恋人・夫婦など),,"新聞・雑誌・ガイドブック,Chat GPT等の生成AI",0,1,0,0,0,0,0,1,0,0,0,0,0,0,0,0,0,0,0,0,,レンタカー,0,1,0,0,0,0,0,0,,レンタカー,0,1,0,0,0,0,0,0,,やや満足,レンタカーが乗り慣れた車種ではないので、すんなりといかず、イライラするところあり。道は、一般道路でも渋滞もなく信号も少なく快適,やんばるエリアには宿泊しない,"10,000円以上 20,000円未満","5,000円以上 10,000円未満","5,000円未満","5,000円未満",初めて,,来たい,1-3年後,満足,皆さん親切です,8,沖縄の海とは違った自然を感じられる,ない,,うふやんばる(国頭村・大宜味村・東村),辺戸岬,,うふやんばる(国頭村・大宜味村・東村),アスムイハイクス,,"5,000円未満",満足,"食事がおいしく、おしゃれ
電子マネー使える","お土産がもう少しあればと思います　
でも、ほかでは手に入らなそうなものがありました",8,綺麗で涼しいです,女性,1965,東京都,800-1000万円未満,辺戸岬観光案内所エリア,国頭村,2025-10-23 13:15:23
631,592,4泊,"5,000円以上 10,000円未満","宿でのんびり過ごす,地元の美味しいものを食べる,花見などの自然鑑賞,名所、旧跡の観光,アウトドア:ビーチ・海水浴,アウトドア:マリンスポーツ,アウトドア:登山・トレッキング,まちあるき・集落散策",1,0,1,1,1,0,0,0,0,0,0,0,1,1,1,0,1,0,0,0,0,0,0,,パートナー(恋人・夫婦など),,YouTube,0,0,0,0,0,0,0,0,0,0,1,0,0,0,0,0,0,0,0,0,,レンタカー,0,1,0,0,0,0,0,0,,レンタカー,0,1,0,0,0,0,0,0,,大変満足,"行きたい場所に自由に行けるから。
観光地でない場所にも気軽に行ける。",3泊,"30,000円以上 40,000円未満",使わない,"20,000円以上 30,000円未満","10,000円以上 20,000円未満",11回目以上,半年-1年前,必ず来たい,半年-1年後,大変満足,"自然豊かである。
観光地化し過ぎていないのでのんびりできる。",10,"自然
のんびりできる",ない,,門口(じょうぐち)やんばる(金武町・宜野座村・恩納村),その他,金武　モーシヌ森公園,なかやんばる(名護市・本部町・今帰仁村),,道の駅羽地,"5,000円未満",大変満足,綺麗,,10,施設が綺麗。いろいろな情報が手に入る,女性,1984,愛知県,1000-1200万円未満,道の駅ぎのざエリア,宜野座村,2025-10-23 14:23:07
632,593,1泊,"5,000円未満","宿でのんびり過ごす,地元の美味しいものを食べる",1,0,1,0,0,0,0,0,0,0,0,0,0,0,0,0,0,0,0,0,0,0,0,,パートナー(恋人・夫婦など),,"Google map,Instagram",0,0,0,0,0,0,0,0,1,0,0,0,1,0,0,0,0,0,0,0,,自家用車,1,0,0,0,0,0,0,0,,自家用車,1,0,0,0,0,0,0,0,,,,1泊,"20,000円以上 30,000円未満","5,000円未満","10,000円以上 20,000円未満","5,000円未満",11回目以上,半年以内,必ず来たい,半年以内,満足,,10,,ない,,特になし,,,特になし,,,"5,000円未満",満足,,,10,,女性,1999,沖縄県,800-1000万円未満,嵐山エリア,名護市,2025-10-23 14:29:53
633,594,4泊,"20,000円以上 30,000円未満","花見などの自然鑑賞,ドライブ・ツーリング",0,0,0,1,0,0,0,0,0,0,0,0,0,0,0,0,0,0,0,1,0,0,0,,自分ひとり,,インターネット・アプリ,0,0,0,0,0,0,0,0,0,1,0,0,0,0,0,0,0,0,0,0,,レンタカー,0,1,0,0,0,0,0,0,,"レンタカー,徒歩",0,1,0,0,0,1,0,0,,大変満足,本来、穏やかなリーフが干渉出来る景観ですが、辺戸岬では荒々しい波飛沫等も鑑賞する事が出来て、良い思い出になりました。,やんばるエリアには宿泊しない,"5,000円未満","5,000円未満","5,000円未満","5,000円未満",2-3回目,5年以上前,必ず来たい,1-3年後,満足,"交通経路（高速道路の整備等）がより進み、時間的なストレスが減少すれば、訪れる回数も増えると感じます。
又、飲食関係でも何か名物を確立すれば、もっと様々な目的を持った観光客が、多く訪れる筈だと感じます。
是非、ご検討を。",10,沖縄本土に於いても、他に代え難い感動が有るから。,ない,現時点では、特に有りません。,中部,残波岬,,中部,その他,古宇利島,"5,000円未満",やや満足,ソフトクリームが食べたかった。,ハンバーガー系の、人気店が有ると嬉しい。,9,ここにしか無い自然。,男性,1969,鹿児島県,600-800万円未満,辺戸岬観光案内所エリア,国頭村,2025-10-23 14:41:32
634,595,6泊,"20,000円以上 30,000円未満","リゾートホテルを楽しむ,地元の美味しいものを食べる,名所、旧跡の観光,テーマパーク:沖縄美ら海水族館",0,1,1,0,1,1,0,0,0,0,0,0,0,0,0,0,0,0,0,0,0,0,0,,パートナー(恋人・夫婦など),,"新聞・雑誌・ガイドブック,美ら海水族館等の観光関連事業者HP,インターネット・アプリ,ブログ",0,1,0,0,0,1,0,0,0,1,0,0,0,0,1,0,0,0,0,0,,レンタカー,0,1,0,0,0,0,0,0,,レンタカー,0,1,0,0,0,0,0,0,,満足,,3泊,"50,000円以上 100,000円未満","5,000円未満","20,000円以上 30,000円未満","5,000円未満",初めて,,来たい,半年-1年後,満足,,8,,ない,,なかやんばる(名護市・本部町・今帰仁村),今帰仁城跡,,中部,北谷サンセットビーチ,,"5,000円以上 10,000円未満",満足,,,7,,男性,1960,東京都,800-1000万円未満,-,-,2025-10-23 15:12:31
635,596,4泊,"5,000円以上 10,000円未満","テーマパーク:その他,買い物、アウトレット",0,0,0,0,0,0,0,1,1,0,0,0,0,0,0,0,0,0,0,0,0,0,0,,未就学児を含む家族,,"インターネット・アプリ,YouTube,Instagram,ブログ",0,0,0,0,0,0,0,0,0,1,1,0,1,0,1,0,0,0,0,0,,レンタカー,0,1,0,0,0,0,0,0,,レンタカー,0,1,0,0,0,0,0,0,,満足,高速を使えば以外と近いなと感じた。,やんばるエリアには宿泊しない,使わない,"5,000円以上 10,000円未満","5,000円未満","5,000円未満",2-3回目,半年-1年前,来たい,1-3年後,満足,パイナップルパーク・ネオオキナワパークに行きましたが子連れにとても良いテーマパークでした。,9,子連れでも楽しめる。,ある,テーマパーク代が値段が少し高い,うふやんばる(国頭村・大宜味村・東村),その他,パイナップルパーク,南部,その他,アメリカンビレッジ,"5,000円未満",満足,バードウォッチングやレッサーパンダの餌やり時間がもっと分散された時間帯だと見やすいと思った。,飲食店・カフェがもう少しあると便利,8,"子連れでも楽しめる。
1日いても飽きないくらい楽しい",女性,1989,東京都,800-1000万円未満,嵐山エリア,名護市,2025-10-23 15:25:46
636,597,7泊以上,"30,000円以上 40,000円未満",アウトドア:マリンスポーツ,0,0,0,0,0,0,0,0,0,0,0,0,0,1,0,0,0,0,0,0,0,0,0,,友人,,"新聞・雑誌・ガイドブック,美ら海水族館等の観光関連事業者HP",0,1,0,0,0,1,0,0,0,0,0,0,0,0,0,0,0,0,0,0,,自家用車,1,0,0,0,0,0,0,0,,"自家用車,徒歩",1,0,0,0,0,1,0,0,,,,7泊以上,"200,000円以上","100,000円以上 200,000円未満","50,000円以上 100,000円未満","40,000円以上 50,000円未満",11回目以上,半年以内,必ず来たい,半年以内,大変満足,人がとても暖かい。,10,,ない,,門口(じょうぐち)やんばる(金武町・宜野座村・恩納村),万座毛,,うふやんばる(国頭村・大宜味村・東村),辺戸岬,,"5,000円以上 10,000円未満",大変満足,,,10,,男性,1993,神奈川県,1200-1500万円未満,おんなの駅エリア,恩納村,2025-10-23 15:55:33
637,598,3泊,"50,000円以上 100,000円未満","地元の美味しいものを食べる,名所、旧跡の観光,買い物、アウトレット,地域の行事,まちあるき・集落散策,各種体験(手作り、果物狩りなど)",0,0,1,0,1,0,0,0,1,0,1,0,0,0,0,0,1,1,0,0,0,0,0,,パートナー(恋人・夫婦など),,友人・知人,0,0,0,0,0,0,0,0,0,0,0,0,0,0,0,1,0,0,0,0,,レンタカー,0,1,0,0,0,0,0,0,,レンタカー,0,1,0,0,0,0,0,0,,大変満足,沖縄県の出会う皆さんの人柄が優しい,2泊,"50,000円以上 100,000円未満","50,000円以上 100,000円未満","40,000円以上 50,000円未満","50,000円以上 100,000円未満",4-5回目,半年-1年前,必ず来たい,半年-1年後,大変満足,,10,,ない,,なかやんばる(名護市・本部町・今帰仁村),ナゴパイナップルパーク,,特になし,特に無し,,"5,000円以上 10,000円未満",大変満足,,,10,ご案内からとても親切でありがとうございました！,女性,1991,宮崎県,600-800万円未満,名護市街エリア,名護市,2025-10-23 17:13:54
638,599,3泊,"100,000円以上","リゾートホテルを楽しむ,地元の美味しいものを食べる,テーマパーク:沖縄美ら海水族館,テーマパーク:JUNGLIA",0,1,1,0,0,1,1,0,0,0,0,0,0,0,0,0,0,0,0,0,0,0,0,,パートナー(恋人・夫婦など),,"宿泊事業者のHP,YouTube",0,0,0,0,0,0,1,0,0,0,1,0,0,0,0,0,0,0,0,0,,レンタカー,0,1,0,0,0,0,0,0,,レンタカー,0,1,0,0,0,0,0,0,,大変満足,渋滞もなく快適に過ごせました,2泊,"100,000円以上 200,000円未満","40,000円以上 50,000円未満","10,000円以上 20,000円未満","5,000円以上 10,000円未満",初めて,,必ず来たい,5年以上,大変満足,"リゾートホテルも素晴らしいし、飲食店もよい！
",10,ジャングリア、美ら海水族館、居酒屋等のグルメ,ない,,なかやんばる(名護市・本部町・今帰仁村),JUNGLIA,,なかやんばる(名護市・本部町・今帰仁村),沖縄美ら海水族館,,"10,000円以上 20,000円未満",大変満足,"頼んだものが全て美味しい！
ホテルまでの送迎付き",,10,本当に料理が美味しくて感動しています！！,男性,1994,群馬県,800-1000万円未満,道の駅許田エリア,名護市,2025-10-23 19:02:48