1928,1822,3泊,"50,000円以上 100,000円未満","地元の美味しいものを食べる,名所、旧跡の観光,テーマパーク:沖縄美ら海水族館,各種体験(手作り、果物狩りなど)",0,0,1,0,1,1,0,0,0,0,0,0,0,0,0,0,0,1,0,0,0,0,0,,未就学児を含む家族,,"Google map,インターネット・アプリ,Instagram",0,0,0,0,0,0,0,0,1,1,0,0,1,0,0,0,0,0,0,0,,レンタカー,0,1,0,0,0,0,0,0,,レンタカー,0,1,0,0,0,0,0,0,,やや満足,,3泊,"40,000円以上 50,000円未満","5,000円以上 10,000円未満","20,000円以上 30,000円未満","30,000円以上 40,000円未満",2-3回目,1-3年前,必ず来たい,半年-1年後,やや満足,"とても楽しかったです！
観光地もたくさんありみどころが多くありました。
居住地域ではもうコートを着て過ごしている中、こちらでは半袖の方もちらほら！気候がよく気持ちよかったです！
子どもへのサービスも多くみられ嬉しかったです！
しいてあげるなら、順番という概念があまりないのでしょうか。店員さんも、順番というより目の前の方を案内する姿や、並ばせるような仕組みがあまりないところもあり、強引に、多少強気になっておかないとなかなか事が進まないところもあると感じました。
また、入場券などでレジで抽選ができるところが何箇所かありましたが、何度もいろいろ購入しましたが当たらず残念でした。周りにも当たっている方はおらず、本当に当たりはでるのでしょうか？",8,観光地が充実しているところ,ある,"道路や歩道の雑草が鬱蒼としており、見映えが悪く、通行しづらい場所があると感じました。それも含めて沖縄と思えば仕方がないとは思いますが…。
あとは、こども用トイレがあったり、補助便座がひとつでも置いてあるといいなと思いました。手を洗うところも高すぎて届かないので踏み台か、低い洗い場があると助かります。
私たち家族には乳児はおりませんが、おむつ替え台があまりないようでベンチなとで赤ちゃんのオムツ交換をされている方がみえました。ベビールームやオムツ交換台などがあればいいなと思いました。",なかやんばる(名護市・本部町・今帰仁村),ナゴパイナップルパーク,,なかやんばる(名護市・本部町・今帰仁村),古宇利島(オーシャンタワー/ハートロック),,"5,000円以上 10,000円未満",大変満足,,"ジンベエザメなどの工作や、ワークショップがあると嬉しいです！
水族館でよくある、ぬいぐるみなどがあたるハズレなしのくじがやりたかったです！",10,,女性,1992,岐阜県,600-800万円未満,海洋博公園・観光拠点エリア,本部町,2025-11-26 22:20:29
1929,1823,3泊,"5,000円以上 10,000円未満","名所、旧跡の観光,テーマパーク:沖縄美ら海水族館",0,0,0,0,1,1,0,0,0,0,0,0,0,0,0,0,0,0,0,0,0,0,0,,未就学児を含む家族,,"美ら海水族館等の観光関連事業者HP,Google map,インターネット・アプリ,YouTube",0,0,0,0,0,1,0,0,1,1,1,0,0,0,0,0,0,0,0,0,,レンタカー,0,1,0,0,0,0,0,0,,"レンタカー,徒歩",0,1,0,0,0,1,0,0,,大変満足,"レンタカーを使用いたしました。
一つ一つの場所を観光するために、少し間で休憩するときに、車で一息つける事と、0歳の子供と一緒のため、予定が変更になっても動きやすいので。また、駐車場料金が無料やお得なところが多いイメージで、大変助かりました！",3泊,"30,000円以上 40,000円未満","20,000円以上 30,000円未満","10,000円以上 20,000円未満","5,000円以上 10,000円未満",初めて,,必ず来たい,半年-1年後,大変満足,"今回は、美ら海水族館へ伺いました。水族館だけでなく、広い公園とビーチで沢山写真を撮ったり、綺麗にお掃除されていて、ベンチなどの休憩する場所が沢山あるのがとても助かりました。

スタッフの方に場所などを聞いたりしてもとても丁寧に案内してくださり好印象でした！
また、帰りはドライブをしながら街並みをのんびり眺められる時間がとても幸せでした！",9,上記と同様です。,ない,,門口(じょうぐち)やんばる(金武町・宜野座村・恩納村),万座毛,,なかやんばる(名護市・本部町・今帰仁村),古宇利島(オーシャンタワー/ハートロック),,"5,000円以上 10,000円未満",大変満足,0歳の子供と一緒の観光でしたので、楽しいイルカショーや水族館はもちろん、ベンチが沢山あって休憩しやすかったり、ビーチや海辺で写真を沢山撮れた事がとても嬉しかったためです。また、場所に迷っていた際にスタッフさんが親切に案内してくださったことが好印象でした！,観光地のため、失礼かもしれませんが、売店のような気楽に買い物ができて、外のベンチで食事ができたら有難いかもしれません。(0歳の息子と一緒だったため)見つけられていなかったらすみません！,10,上記の満足と同様です！,女性,1994,神奈川県,300-400万円未満,海洋博公園・観光拠点エリア,本部町,2025-11-26 22:23:32
1930,1824,1泊,"50,000円以上 100,000円未満","宿でのんびり過ごす,リゾートホテルを楽しむ,地元の美味しいものを食べる,花見などの自然鑑賞,買い物、アウトレット,その他",1,1,1,1,0,0,0,0,1,0,0,0,0,0,0,0,0,0,0,0,0,0,1,虫探し,未就学児を含む家族,,"Instagram,友人・知人",0,0,0,0,0,0,0,0,0,0,0,0,1,0,0,1,0,0,0,0,,自家用車,1,0,0,0,0,0,0,0,,自家用車,1,0,0,0,0,0,0,0,,,,1泊,"50,000円以上 100,000円未満","5,000円未満","20,000円以上 30,000円未満",使わない,11回目以上,半年以内,必ず来たい,半年以内,大変満足,"自然がいっぱいで子供に優しいやんばるが好きです。

サーフィンするので昔は1週間に3回ぐらいやんばるに来てました！！

懐かしい思い出と新しく息子と作る思い出が好きです。",10,"自然が沢山
人が優しい
公園や海が綺麗
シークワサー好きにはたまらない
星が綺麗",ない,とくになしです。,南部,識名園,,うふやんばる(国頭村・大宜味村・東村),その他,やんばる森の美術館　シークワサーパーク,"50,000円以上 100,000円未満",大変満足,"正直以前宿泊した時は…ん？て思う接客や施設についてが多く、
今回は息子が泊まりたい！と言うので
また予約しました。

今回はスタッフさんが素晴らしく
対応も早くすごく良く改善していて
良かったです！！感謝、感動しました。

（チェックアウトの時荷物を部屋から運んでくれる方がめっちゃタメ口で話してくるのは気になりました…笑）
荷物これだけ？！　など","ラウンジの方限定朝食は…正直今回
はしごして和洋食のがいい事に気づきました。ラウンジの朝食は前より質が下がったかなぁ？と。",9,自然とビーチ、あと朝食のスパムおにぎりや味噌汁にたっているお姉様方が最高に優しく朝から幸せになります！,女性,1991,沖縄県,1000-1200万円未満,道の駅ゆいゆい国頭エリア,国頭村,2025-11-26 22:34:01