1904,1800,2泊,"20,000円以上 30,000円未満","リゾートホテルを楽しむ,テーマパーク:沖縄美ら海水族館,アウトドア:ビーチ・海水浴,まちあるき・集落散策,ドライブ・ツーリング",0,1,0,0,0,1,0,0,0,0,0,0,1,0,0,0,1,0,0,1,0,0,0,,パートナー(恋人・夫婦など),,"インターネット・アプリ,YouTube,Instagram",0,0,0,0,0,0,0,0,0,1,1,0,1,0,0,0,0,0,0,0,,レンタカー,0,1,0,0,0,0,0,0,,レンタカー,0,1,0,0,0,0,0,0,,大変満足,自由に動けて楽でした,2泊,"30,000円以上 40,000円未満","10,000円以上 20,000円未満","10,000円以上 20,000円未満","20,000円以上 30,000円未満",2-3回目,5年以上前,来たい,半年-1年後,満足,人がみんな優しい,10,,ない,,なかやんばる(名護市・本部町・今帰仁村),ナゴパイナップルパーク,,なかやんばる(名護市・本部町・今帰仁村),ナゴパイナップルパーク,,"20,000円以上 30,000円未満",満足,,,8,,女性,1969,栃木県,答えられない,海洋博公園・観光拠点エリア,本部町,2025-11-26 15:27:33
1905,1801,2泊,"10,000円以上 20,000円未満",テーマパーク:沖縄美ら海水族館,0,0,0,0,0,1,0,0,0,0,0,0,0,0,0,0,0,0,0,0,0,0,0,,その他家族,,美ら海水族館等の観光関連事業者HP,0,0,0,0,0,1,0,0,0,0,0,0,0,0,0,0,0,0,0,0,,路線バス、高速バス、シャトルバス,0,0,0,0,0,1,0,0,,徒歩,0,0,0,0,0,1,0,0,,,,やんばるエリアには宿泊しない,"5,000円以上 10,000円未満","5,000円以上 10,000円未満","5,000円未満","5,000円未満",初めて,,来たい,1-3年後,満足,水族館と周辺施設の充実,10,"美ら海水族館、イルカショー、ウミガメ館、マナティー館
とても楽しかったです",ない,,南部,首里城公園,,南部,国際通り,,"5,000円以上 10,000円未満",満足,,,10,,女性,1997,秋田県,1500-2000万円未満,海洋博公園・観光拠点エリア,本部町,2025-11-26 15:28:50
1906,1802,7泊以上,"5,000円以上 10,000円未満","宿でのんびり過ごす,地元の美味しいものを食べる,テーマパーク:沖縄美ら海水族館",1,0,1,0,0,1,0,0,0,0,0,0,0,0,0,0,0,0,0,0,0,0,0,,未就学児を含む家族,,"観光展・物産展,TV・ラジオ番組やCM,YouTube,友人・知人",1,0,1,0,0,0,0,0,0,0,1,0,0,0,0,1,0,0,0,0,,自家用車,1,0,0,0,0,0,0,0,,自家用車,1,0,0,0,0,0,0,0,,,,7泊以上,"5,000円以上 10,000円未満","5,000円以上 10,000円未満","5,000円以上 10,000円未満","5,000円以上 10,000円未満",4-5回目,半年-1年前,来たい,半年-1年後,満足,ヤンバルって感じで最高だった,8,ヤンバルって感じで最高だったから,ある,特にない,うふやんばる(国頭村・大宜味村・東村),やんばる野生生物保護センター,,うふやんばる(国頭村・大宜味村・東村),辺戸岬,,"5,000円以上 10,000円未満",大変満足,無料の施設もあって満足,,8,無理の施設もあって最高,男性,1999,埼玉県,400-600万円未満,海洋博公園・観光拠点エリア,本部町,2025-11-26 15:43:06
1907,1803,7泊以上,"5,000円未満",ドライブ・ツーリング,0,0,0,0,0,0,0,0,0,0,0,0,0,0,0,0,0,0,0,1,0,0,0,,その他家族,,その他,0,0,0,0,0,0,0,0,0,0,0,0,0,0,0,0,0,0,0,1,地元民やで,自家用車,1,0,0,0,0,0,0,0,,自家用車,1,0,0,0,0,0,0,0,,,,やんばるエリアには宿泊しない,"5,000円未満",使わない,"5,000円未満",使わない,11回目以上,半年以内,必ず来たい,半年以内,満足,地元民やで,10,地元民やで,ある,中国人が多すぎる,うふやんばる(国頭村・大宜味村・東村),その他,おじいのお墓参りやで,南部,その他,家,使わない,満足,"アクセサリーが可愛かった
飲食もあるからよかった",駐車場を利用したイベント等をやって欲しい,6,飲食が美味しそう,男性,2006,沖縄県,答えられない,万座毛エリア,恩納村,2025-11-26 15:43:51
1908,1804,7泊以上,"5,000円未満",ドライブ・ツーリング,0,0,0,0,0,0,0,0,0,0,0,0,0,0,0,0,0,0,0,1,0,0,0,,その他家族,,その他,0,0,0,0,0,0,0,0,0,0,0,0,0,0,0,0,0,0,0,1,地元民やで♡,自家用車,1,0,0,0,0,0,0,0,,自家用車,1,0,0,0,0,0,0,0,,,,やんばるエリアには宿泊しない,使わない,使わない,使わない,使わない,11回目以上,半年-1年前,必ず来たい,半年以内,満足,地元民やで♡,10,地元民やで♡,ある,中国人系多すぎやで♡,うふやんばる(国頭村・大宜味村・東村),その他,墓参りやで♡,南部,その他,家やで♡,使わない,満足,アクセサリー可愛かったしトイレ助かったやで♡,駐車場使ったイベントとかあると面白いかもって思ったやで♡,7,食べ物美味しそうだったやで♡,女性,2001,沖縄県,答えられない,万座毛エリア,恩納村,2025-11-26 15:44:00
1909,1805,7泊以上,使わない,"友人・親戚を尋ねる,その他",0,0,0,0,0,0,0,0,0,0,0,0,0,0,0,0,0,0,0,0,1,0,1,結婚式,未就学児を含む家族,,友人・知人,0,0,0,0,0,0,0,0,0,0,0,0,0,0,0,1,0,0,0,0,,自家用車,1,0,0,0,0,0,0,0,,自家用車,1,0,0,0,0,0,0,0,,,,7泊以上,使わない,"10,000円以上 20,000円未満","10,000円以上 20,000円未満","20,000円以上 30,000円未満",4-5回目,半年以内,必ず来たい,半年-1年後,大変満足,海が中南部よりもきれいで、程よい田舎感がよかった。,10,那覇などの都市部に比べてのんびりとしているので、高齢の家族ともゆっくり楽しめそう,ない,,うふやんばる(国頭村・大宜味村・東村),塩屋湾,やんばるビジターセンター,うふやんばる(国頭村・大宜味村・東村),その他,ゆいゆい国頭,使わない,大変満足,今回はイルカショーのみの観覧でしたが、無料で楽しめたのがよかったです。,参加型のイルカショーがあると盛り上がりそうです,10,ベビーカーや車椅子でも移動がしやすいので、いろんな年齢層で楽しめるから,女性,1996,埼玉県,400-600万円未満,海洋博公園・観光拠点エリア,本部町,2025-11-26 15:56:48
1910,1806,4泊,使わない,"テーマパーク:沖縄美ら海水族館,テーマパーク:その他",0,0,0,0,0,1,0,1,0,0,0,0,0,0,0,0,0,0,0,0,0,0,0,,未就学児を含む家族,,"美ら海水族館等の観光関連事業者HP,宿泊事業者のHP",0,0,0,0,0,1,1,0,0,0,0,0,0,0,0,0,0,0,0,0,,レンタカー,0,1,0,0,0,0,0,0,,レンタカー,0,1,0,0,0,0,0,0,,満足,県内の移動は車の方が便利だから,1泊,"20,000円以上 30,000円未満","10,000円以上 20,000円未満","5,000円以上 10,000円未満","5,000円以上 10,000円未満",4-5回目,3-5年前,必ず来たい,1-3年後,大変満足,目的だった美ら海水族館ともとぶ元気村での体験が楽しかったから,9,美ら海水族館が好きだから,ある,他のエリアに比べてホテルや飲食店が少なく感じる。,なかやんばる(名護市・本部町・今帰仁村),ナゴパイナップルパーク,,中部,その他,ルネッサンスリゾートオキナワ,"5,000円以上 10,000円未満",やや満足,水族館の他にもオキちゃん劇場やマナティ館など見るところがあったり、こどもが遊べる遊具があったりたくさん遊べて満足。ただ、公園の他の施設も遊ぶとなると１日ゆっくり来ないと色々回れないなと思った。,水族館周辺にもう少しカフェや飲食店があると嬉しい。,9,美ら海水族館,女性,1982,千葉県,800-1000万円未満,海洋博公園・観光拠点エリア,本部町,2025-11-26 16:06:17
1911,1807,3泊,"20,000円以上 30,000円未満","テーマパーク:沖縄美ら海水族館,友人・親戚を尋ねる",0,0,0,0,0,1,0,0,0,0,0,0,0,0,0,0,0,0,0,0,1,0,0,,友人,,"観光展・物産展,新聞・雑誌・ガイドブック,観光協会のHP,インターネット・アプリ",1,1,0,0,1,0,0,0,0,1,0,0,0,0,0,0,0,0,0,0,,レンタカー,0,1,0,0,0,0,0,0,,レンタカー,0,1,0,0,0,0,0,0,,満足,,やんばるエリアには宿泊しない,"5,000円未満","5,000円以上 10,000円未満","5,000円以上 10,000円未満","5,000円以上 10,000円未満",初めて,,必ず来たい,1-3年後,満足,,7,,ない,,なかやんばる(名護市・本部町・今帰仁村),沖縄美ら海水族館,,,,,使わない,満足,,,6,,女性,1993,東京都,400-600万円未満,海洋博公園・観光拠点エリア,本部町,2025-11-26 16:23:31
1912,1808,1泊,使わない,出張など仕事関係,0,0,0,0,0,0,0,0,0,0,0,0,0,0,0,0,0,0,0,0,0,1,0,,職場の同僚,,"観光展・物産展,新聞・雑誌・ガイドブック,TV・ラジオ番組やCM,観光パンフレット・ポスター,観光協会のHP,美ら海水族館等の観光関連事業者HP,宿泊事業者のHP,Chat GPT等の生成AI,インターネット・アプリ,YouTube",1,1,1,1,1,1,1,1,0,1,1,0,0,0,0,0,0,0,0,0,,自家用車,1,0,0,0,0,0,0,0,,自家用車,1,0,0,0,0,0,0,0,,,,1泊,"5,000円以上 10,000円未満",使わない,"5,000円以上 10,000円未満",使わない,11回目以上,半年以内,必ず来たい,半年以内,大変満足,,10,,ない,,島やんばる(伊江村・伊是名村・伊平屋村),伊是名城跡,,島やんばる(伊江村・伊是名村・伊平屋村),伊江ビーチ,,"5,000円以上 10,000円未満",大変満足,,,10,,女性,1982,沖縄県,400-600万円未満,伊平屋村エリア,伊平屋村,2025-11-26 16:32:01
1913,1809,2泊,"5,000円未満","地元の美味しいものを食べる,テーマパーク:沖縄美ら海水族館",0,0,1,0,0,1,0,0,0,0,0,0,0,0,0,0,0,0,0,0,0,0,0,,小学生を含む家族(未就学児は含まない),,"新聞・雑誌・ガイドブック,TV・ラジオ番組やCM,美ら海水族館等の観光関連事業者HP",0,1,1,0,0,1,0,0,0,0,0,0,0,0,0,0,0,0,0,0,,レンタカー,0,1,0,0,0,0,0,0,,レンタカー,0,1,0,0,0,0,0,0,,大変満足,レンタカーで時間に縛られず気ままに行動できて満足です。,やんばるエリアには宿泊しない,使わない,"5,000円未満","5,000円未満","5,000円未満",11回目以上,半年-1年前,必ず来たい,半年-1年後,満足,美ら海水族館の展示に癒されました。,8,美ら海水族館は実際に行ってみたほうが良い場所だと思います。,ある,美ら海水族館の閉館後に家族連れで行ける沖縄料理のお店が少なくて困りました。,中部,美浜アメリカンビレッジ,,特になし,特に無し,,"5,000円未満",満足,水族館は規模が大きく何度見ても飽きない展示内容だから。,20時頃までレストランが営業してくれるとうれしいです。,8,美ら海水族館の大水槽がここだけの展示で迫力があるので勧めたいです。,女性,1982,長野県,答えられない,海洋博公園・観光拠点エリア,本部町,2025-11-26 16:39:19
1914,1810,4泊,"10,000円以上 20,000円未満",テーマパーク:沖縄美ら海水族館,0,0,0,0,0,1,0,0,0,0,0,0,0,0,0,0,0,0,0,0,0,0,0,,パートナー(恋人・夫婦など),,"新聞・雑誌・ガイドブック,美ら海水族館等の観光関連事業者HP,インターネット・アプリ,Facebook",0,1,0,0,0,1,0,0,0,1,0,0,0,1,0,0,0,0,0,0,,レンタカー,0,1,0,0,0,0,0,0,,レンタカー,0,1,0,0,0,0,0,0,,満足,時間や行き先などの変更が随時可能で自由度が高いこと。,1泊,"20,000円以上 30,000円未満","10,000円以上 20,000円未満","10,000円以上 20,000円未満","5,000円以上 10,000円未満",4-5回目,5年以上前,必ず来たい,1-3年後,満足,予定していた内容がすべてスムーズに行えたため。,10,海をはじめとした素敵な自然の中で、予定を詰め込まずにのんびり過ごせる点が大好きです。極端に不便ではないところも良いですよね。たまにしか来ないヨソ者が口を出せる事ではありませんが、これ以上の自然破壊や開発はしてほしくないなと感じております。,ない,,なかやんばる(名護市・本部町・今帰仁村),沖縄美ら海水族館,,うふやんばる(国頭村・大宜味村・東村),その他,特になし,"5,000円未満",満足,動物に無理をさせていない点が良いと思います。でもウミガメの水槽はカメの数と大きさに比べるとだいぶ狭いように感じました。,,6,海を見ながらゆっくりできる点が良いと思います。,女性,1974,埼玉県,800-1000万円未満,海洋博公園・観光拠点エリア,本部町,2025-11-26 16:41:49
1915,1811,3泊,"30,000円以上 40,000円未満",出張など仕事関係,0,0,0,0,0,0,0,0,0,0,0,0,0,0,0,0,0,0,0,0,0,1,0,,学校関係(修学旅行・社会見学等),,その他,0,0,0,0,0,0,0,0,0,0,0,0,0,0,0,0,0,0,0,1,旅行会社,旅行会社ツアーバス,0,0,0,1,0,0,0,0,,旅行会社ツアーバス,0,0,0,1,0,0,0,0,,満足,渋滞がなかった,3泊,"30,000円以上 40,000円未満","5,000円以上 10,000円未満","20,000円以上 30,000円未満","20,000円以上 30,000円未満",2-3回目,3-5年前,来たい,3-5年後,満足,楽しめるから,8,楽しめるから,ある,飲料代が高い,南部,平和祈念公園,,なかやんばる(名護市・本部町・今帰仁村),JUNGLIA,,"5,000円未満",満足,楽しめるから,,8,楽しめるから,男性,1961,広島県,答えられない,海洋博公園・観光拠点エリア,本部町,2025-11-26 16:58:04
1916,1812,3泊,"5,000円以上 10,000円未満","テーマパーク:沖縄美ら海水族館,ドライブ・ツーリング",0,0,0,0,0,1,0,0,0,0,0,0,0,0,0,0,0,0,0,1,0,0,0,,親,,"観光協会のHP,Chat GPT等の生成AI",0,0,0,0,1,0,0,1,0,0,0,0,0,0,0,0,0,0,0,0,,レンタカー,0,1,0,0,0,0,0,0,,レンタカー,0,1,0,0,0,0,0,0,,満足,高速道路が利用出来た,やんばるエリアには宿泊しない,"5,000円以上 10,000円未満","5,000円以上 10,000円未満","5,000円未満","5,000円以上 10,000円未満",初めて,,必ず来たい,3-5年後,満足,,9,,ない,,なかやんばる(名護市・本部町・今帰仁村),ナゴパイナップルパーク,,南部,首里城公園,,"5,000円以上 10,000円未満",満足,,,8,,男性,1968,山口県,800-1000万円未満,海洋博公園・観光拠点エリア,本部町,2025-11-26 17:22:49
1917,1813,4泊,"10,000円以上 20,000円未満","テーマパーク:沖縄美ら海水族館,テーマパーク:JUNGLIA,アウトドア:マリンスポーツ,アウトドア:登山・トレッキング",0,0,0,0,0,1,1,0,0,0,0,0,0,1,1,0,0,0,0,0,0,0,0,,パートナー(恋人・夫婦など),,"TV・ラジオ番組やCM,インターネット・アプリ,YouTube",0,0,1,0,0,0,0,0,0,1,1,0,0,0,0,0,0,0,0,0,,レンタカー,0,1,0,0,0,0,0,0,,レンタカー,0,1,0,0,0,0,0,0,,満足,"予約しやすく、価格も手頃だった。
道路状況や駐車場なども問題なかった。",4泊,"50,000円以上 100,000円未満","20,000円以上 30,000円未満","20,000円以上 30,000円未満","5,000円以上 10,000円未満",初めて,,やや来たい,1-3年後,満足,天気が良くて、アクティビティが楽しめた。景色も良く、リラックスできた。,8,"ジャングリアや美ら海水族館は他にはないから。
また、その近くで、ゆったりリラックスできる景観の良さもあるから。",ある,アクティビティ参加について、高齢者に制限が厳しいと感じた。,なかやんばる(名護市・本部町・今帰仁村),JUNGLIA,,特になし,特に無し,,"5,000円未満",満足,"広々として綺麗で心地よかった。
海洋文化館も楽しかった。",,6,天気が良ければ、海のそばでのんびりできる。,女性,1964,東京都,1000-1200万円未満,海洋博公園・観光拠点エリア,本部町,2025-11-26 17:39:50
1918,1814,5泊,"5,000円以上 10,000円未満","リゾートホテルを楽しむ,地元の美味しいものを食べる,名所、旧跡の観光,テーマパーク:沖縄美ら海水族館",0,1,1,0,1,1,0,0,0,0,0,0,0,0,0,0,0,0,0,0,0,0,0,,未就学児を含む家族,,"新聞・雑誌・ガイドブック,Instagram,観光協会・空港・道の駅等の案内所,宿泊施設",0,1,0,0,0,0,0,0,0,0,0,0,1,0,0,0,1,0,1,0,,レンタカー,0,1,0,0,0,0,0,0,,"レンタカー,タクシー,路線バス",0,1,1,0,1,0,0,0,,満足,レンタカー代が安い。,4泊,"50,000円以上 100,000円未満","10,000円以上 20,000円未満","20,000円以上 30,000円未満","10,000円以上 20,000円未満",6-10回目,3-5年前,必ず来たい,1-3年後,大変満足,観光が楽しい、海の透明度が高い、リゾートホテルがとてもよかった。,9,"名護パイナップルパーク。
自分が学生時代に行ったっきり、10年以上ぶりの訪問でしたが、子ども向けでとても楽しかった。3歳の子どもが大喜びだったのでまた絶対に行きたい。",ない,,門口(じょうぐち)やんばる(金武町・宜野座村・恩納村),琉球村,,なかやんばる(名護市・本部町・今帰仁村),古宇利島(オーシャンタワー/ハートロック),,"10,000円以上 20,000円未満",大変満足,"入り口までのパイナップルの乗り物に乗るまでに結構待ったこと、ベビーカーを折りたたまないといけなかったことがマイナスだが、それ以外は非常に良かった。
色んな植物があり自然を楽しめて、乗り物好きの子ども大喜び。
お土産も充実していた。","ソフトクリームは美味しかった。席数を増やしてほしい。
トイレまでが遠く、一旦外に出ないといけないのが不便だった。(ワインセラーを抜けてお土産やさん併設のところ)",9,子連れに特におすすめしたい。,女性,1991,兵庫県,600-800万円未満,屋部エリア,名護市,2025-11-26 18:27:21
1919,1815,4泊,"10,000円以上 20,000円未満","宿でのんびり過ごす,リゾートホテルを楽しむ,地元の美味しいものを食べる,テーマパーク:沖縄美ら海水族館",1,1,1,0,0,1,0,0,0,0,0,0,0,0,0,0,0,0,0,0,0,0,0,,パートナー(恋人・夫婦など),,"新聞・雑誌・ガイドブック,宿泊施設",0,1,0,0,0,0,0,0,0,0,0,0,0,0,0,0,0,0,1,0,,レンタカー,0,1,0,0,0,0,0,0,,レンタカー,0,1,0,0,0,0,0,0,,大変満足,,4泊,使わない,"5,000円以上 10,000円未満","5,000円未満","5,000円以上 10,000円未満",初めて,,必ず来たい,1-3年後,大変満足,,10,,ない,,,,,,,,使わない,大変満足,,,10,,女性,1995,神奈川県,1000-1200万円未満,海洋博公園・観光拠点エリア,本部町,2025-11-26 18:28:43
1920,1816,日帰り,"5,000円未満","地元の美味しいものを食べる,花見などの自然鑑賞,まちあるき・集落散策,ドライブ・ツーリング",0,0,1,1,0,0,0,0,0,0,0,0,0,0,0,0,1,0,0,1,0,0,0,,パートナー(恋人・夫婦など),,美ら海水族館等の観光関連事業者HP,0,0,0,0,0,1,0,0,0,0,0,0,0,0,0,0,0,0,0,0,,自家用車,1,0,0,0,0,0,0,0,,自家用車,1,0,0,0,0,0,0,0,,,,やんばるエリアには宿泊しない,使わない,"5,000円未満","5,000円未満","5,000円未満",11回目以上,半年以内,必ず来たい,半年以内,大変満足,"色々なイベントや見所があって楽しい
自然や風景に癒されに来ています",10,日常から離れて、自然を感じてほしい,ない,,なかやんばる(名護市・本部町・今帰仁村),沖縄美ら海水族館,,なかやんばる(名護市・本部町・今帰仁村),その他,イオン,"5,000円未満",大変満足,イベントに参加したが、楽しかった,,10,自然にふれて、風景に癒されて、イベントに参加して楽しんでほしい,女性,1976,沖縄県,100-200万円未満,海洋博公園・観光拠点エリア,本部町,2025-11-26 18:41:38
1922,1817,4泊,"30,000円以上 40,000円未満","リゾートホテルを楽しむ,地元の美味しいものを食べる,花見などの自然鑑賞,名所、旧跡の観光,テーマパーク:沖縄美ら海水族館",0,1,1,1,1,1,0,0,0,0,0,0,0,0,0,0,0,0,0,0,0,0,0,,パートナー(恋人・夫婦など),,"新聞・雑誌・ガイドブック,観光協会のHP,Chat GPT等の生成AI,インターネット・アプリ,YouTube",0,1,0,0,1,0,0,1,0,1,1,0,0,0,0,0,0,0,0,0,,レンタカー,0,1,0,0,0,0,0,0,,レンタカー,0,1,0,0,0,0,0,0,,満足,レンタカーで自由に移動ができた。,4泊,"100,000円以上 200,000円未満","10,000円以上 20,000円未満","20,000円以上 30,000円未満","10,000円以上 20,000円未満",4-5回目,3-5年前,来たい,1-3年後,満足,自然,8,自然,ない,,特になし,特に無し,,南部,国際通り,,"5,000円以上 10,000円未満",満足,,,8,美ら海水族館,男性,1952,神奈川県,400-600万円未満,海洋博公園・観光拠点エリア,本部町,2025-11-26 19:39:46
1923,1818,3泊,"20,000円以上 30,000円未満","テーマパーク:沖縄美ら海水族館,テーマパーク:その他,買い物、アウトレット",0,0,0,0,0,1,0,1,1,0,0,0,0,0,0,0,0,0,0,0,0,0,0,,団体旅行,,宿泊事業者のHP,0,0,0,0,0,0,1,0,0,0,0,0,0,0,0,0,0,0,0,0,,旅行会社ツアーバス,0,0,0,1,0,0,0,0,,旅行会社ツアーバス,0,0,0,1,0,0,0,0,,満足,,2泊,"20,000円以上 30,000円未満","5,000円未満","5,000円未満","10,000円以上 20,000円未満",2-3回目,3-5年前,来たい,3-5年後,満足,,5,,ない,,なかやんばる(名護市・本部町・今帰仁村),沖縄美ら海水族館,,門口(じょうぐち)やんばる(金武町・宜野座村・恩納村),琉球村,,"20,000円以上 30,000円未満",やや満足,,,4,,女性,1958,石川県,200-300万円未満,海洋博公園・観光拠点エリア,本部町,2025-11-26 20:49:55
1924,1819,3泊,"5,000円以上 10,000円未満","テーマパーク:沖縄美ら海水族館,テーマパーク:JUNGLIA",0,0,0,0,0,1,1,0,0,0,0,0,0,0,0,0,0,0,0,0,0,0,0,,学校関係(修学旅行・社会見学等),,"美ら海水族館等の観光関連事業者HP,インターネット・アプリ",0,0,0,0,0,1,0,0,0,1,0,0,0,0,0,0,0,0,0,0,,旅行会社ツアーバス,0,0,0,1,0,0,0,0,,タクシー,0,0,1,0,0,0,0,0,,大変満足,中々、空港からは、距離もある場所で、運転技術を必要とする地形であったので自走は難しかっただろうと感じました。,やんばるエリアには宿泊しない,使わない,"10,000円以上 20,000円未満","5,000円未満","5,000円未満",初めて,,必ず来たい,半年-1年後,やや不満,"ジャングリアについては、初来場でしたが、あらゆるものの単価が高い。
また、休憩場所があまり豊富で無い。物価高の中、適当な額なのかもしれないが、高いチケットで入場しても抽選式の完全予約制がどうにも活用しにくかった。",9,自然が豊富。リゾート感は味わえる。ご褒美旅行には最高。,ある,もう少し、リーズナブルにして頂きたい！,南部,平和祈念公園,,中部,美浜アメリカンビレッジ,,"5,000円未満",大変満足,天気にも恵まれ、沖縄の美ら海が素晴らしい景色だった。ジンベイザメの雄大さに心があらわれた。,"高校生などの客が多かった。リーズナブルに買い物ができたら嬉しい。
イルカショーは見栄えがあり楽しかった",9,ジンベイザメを巨大水槽で、大きさを体感してほしい。,女性,1971,静岡県,600-800万円未満,海洋博公園・観光拠点エリア,本部町,2025-11-26 21:21:23
1925,1820,日帰り,使わない,"地元の美味しいものを食べる,花見などの自然鑑賞,テーマパーク:沖縄美ら海水族館,各種体験(手作り、果物狩りなど),ドライブ・ツーリング",0,0,1,1,0,1,0,0,0,0,0,0,0,0,0,0,0,1,0,1,0,0,0,,その他家族,,"新聞・雑誌・ガイドブック,ブログ",0,1,0,0,0,0,0,0,0,0,0,0,0,0,1,0,0,0,0,0,,フェリー,0,0,0,0,1,0,0,0,,その他,0,0,0,0,0,0,0,1,,満足,,やんばるエリアには宿泊しない,"5,000円未満","5,000円未満","5,000円未満",使わない,11回目以上,半年以内,必ず来たい,半年以内,満足,,8,,ない,,なかやんばる(名護市・本部町・今帰仁村),古宇利島(オーシャンタワー/ハートロック),,なかやんばる(名護市・本部町・今帰仁村),その他,瀬底島,使わない,満足,,,8,,女性,1979,沖縄県,答えられない,海洋博公園・観光拠点エリア,本部町,2025-11-26 21:26:44
1926,1821,4泊,"40,000円以上 50,000円未満","宿でのんびり過ごす,リゾートホテルを楽しむ,テーマパーク:沖縄美ら海水族館,買い物、アウトレット,ドライブ・ツーリング",1,1,0,0,0,1,0,0,1,0,0,0,0,0,0,0,0,0,0,1,0,0,0,,中学生以上を含む家族(小学生以下は含まない),,"YouTube,友人・知人",0,0,0,0,0,0,0,0,0,0,1,0,0,0,0,1,0,0,0,0,,レンタカー,0,1,0,0,0,0,0,0,,レンタカー,0,1,0,0,0,0,0,0,,満足,,やんばるエリアには宿泊しない,"5,000円以上 10,000円未満","5,000円以上 10,000円未満","5,000円未満","10,000円以上 20,000円未満",2-3回目,5年以上前,来たい,半年-1年後,満足,,8,自然が素晴らしい,ある,公共交通機関の充実,門口(じょうぐち)やんばる(金武町・宜野座村・恩納村),万座毛,アメリカンビレッジ,南部,その他,DUTYFREE,"10,000円以上 20,000円未満",満足,,,8,,女性,1962,福岡県,1200-1500万円未満,海洋博公園・観光拠点エリア,本部町,2025-11-26 21:31:23
