2764,2576,3泊,"5,000円未満","テーマパーク:沖縄美ら海水族館,テーマパーク:JUNGLIA",0,0,0,0,0,1,1,0,0,0,0,0,0,0,0,0,0,0,0,0,0,0,0,,パートナー(恋人・夫婦など),,"新聞・雑誌・ガイドブック,宿泊施設",0,1,0,0,0,0,0,0,0,0,0,0,0,0,0,0,0,0,1,0,,レンタカー,0,1,0,0,0,0,0,0,,レンタカー,0,1,0,0,0,0,0,0,,満足,道路が走りやすいため,3泊,"5,000円以上 10,000円未満","5,000円未満","5,000円未満","5,000円以上 10,000円未満",初めて,,来たい,1-3年後,満足,のんびり観光できるため,9,ゆっくり観光できるため,ない,,門口(じょうぐち)やんばる(金武町・宜野座村・恩納村),恩納村海岸(青の洞窟),,なかやんばる(名護市・本部町・今帰仁村),JUNGLIA,,"5,000円未満",満足,ジンベイサメの迫力が凄いため,,9,水族館の見応えある魚たち,男性,1972,埼玉県,800-1000万円未満,海洋博公園・観光拠点エリア,本部町,2025-12-14 13:18:03
2765,2577,2泊,"5,000円未満","花見などの自然鑑賞,買い物、アウトレット,ドライブ・ツーリング",0,0,0,1,0,0,0,0,1,0,0,0,0,0,0,0,0,0,0,1,0,0,0,,親,,"観光展・物産展,観光パンフレット・ポスター,Google map",1,0,0,1,0,0,0,0,1,0,0,0,0,0,0,0,0,0,0,0,,レンタカー,0,1,0,0,0,0,0,0,,レンタカー,0,1,0,0,0,0,0,0,,大変満足,,やんばるエリアには宿泊しない,"5,000円未満",使わない,"5,000円未満","5,000円未満",初めて,,来たい,1-3年後,満足,,7,,ない,,門口(じょうぐち)やんばる(金武町・宜野座村・恩納村),琉球村,,なかやんばる(名護市・本部町・今帰仁村),その他,ホテルに行くため訪問地なし,使わない,やや満足,天気がイマイチだった,,8,,女性,1976,佐賀県,200-300万円未満,辺戸岬観光案内所エリア,国頭村,2025-12-14 13:22:25
2766,2578,2泊,"5,000円以上 10,000円未満",その他,0,0,0,0,0,0,0,0,0,0,0,0,0,0,0,0,0,0,0,0,0,0,1,,自分ひとり,,Google map,0,0,0,0,0,0,0,0,1,0,0,0,0,0,0,0,0,0,0,0,,路線バス、高速バス、シャトルバス,0,0,0,0,0,1,0,0,,路線バス,0,0,0,0,1,0,0,0,,やや満足,,2泊,"5,000円以上 10,000円未満","5,000円未満","5,000円未満",使わない,11回目以上,1-3年前,何とも言えない,1-3年後,満足,,5,,ある,,,,,,,,使わない,満足,,,8,,無回答,2010,沖縄県,400-600万円未満,道の駅おおぎみエリア,大宜味村,2025-12-14 13:38:09
2767,2579,3泊,"10,000円以上 20,000円未満","地元の美味しいものを食べる,買い物、アウトレット",0,0,1,0,0,0,0,0,1,0,0,0,0,0,0,0,0,0,0,0,0,0,0,,中学生以上を含む家族(小学生以下は含まない),,YouTube,0,0,0,0,0,0,0,0,0,0,1,0,0,0,0,0,0,0,0,0,,レンタカー,0,1,0,0,0,0,0,0,,レンタカー,0,1,0,0,0,0,0,0,,大変満足,自家用車と同じ車をレンタルしたので、運転しやすく楽しめました。,やんばるエリアには宿泊しない,使わない,使わない,"5,000円以上 10,000円未満","5,000円以上 10,000円未満",4-5回目,1-3年前,来たい,1-3年後,満足,皆さん親切に対応して下さいました。,8,自然が豊か。,ない,,なかやんばる(名護市・本部町・今帰仁村),古宇利島(オーシャンタワー/ハートロック),,門口(じょうぐち)やんばる(金武町・宜野座村・恩納村),道の駅ぎのざ,,"5,000円以上 10,000円未満",大変満足,美味しい、景観が素晴らしい。,現状で良いと思う。,10,"景観が素晴らしい。
施設内もキレイ。",女性,1968,東京都,800-1000万円未満,今帰仁の駅そーれエリア,今帰仁村,2025-12-14 13:45:14
2768,2580,3泊,"30,000円以上 40,000円未満","各種体験(手作り、果物狩りなど),ドライブ・ツーリング",0,0,0,0,0,0,0,0,0,0,0,0,0,0,0,0,0,1,0,1,0,0,0,,パートナー(恋人・夫婦など),,観光協会のHP,0,0,0,0,1,0,0,0,0,0,0,0,0,0,0,0,0,0,0,0,,レンタカー,0,1,0,0,0,0,0,0,,レンタカー,0,1,0,0,0,0,0,0,,大変満足,色々な所に行けて大変満足,やんばるエリアには宿泊しない,"20,000円以上 30,000円未満","20,000円以上 30,000円未満","5,000円以上 10,000円未満",使わない,2-3回目,3-5年前,必ず来たい,1-3年後,大変満足,,10,,ない,,うふやんばる(国頭村・大宜味村・東村),その他,やんばるんチャー東村,その他離島,特に無し,,"5,000円未満",大変満足,景色のいい場所でハンバーガー最高です,,10,,男性,1999,兵庫県,300-400万円未満,今帰仁の駅そーれエリア,今帰仁村,2025-12-14 13:53:48
2769,2581,7泊以上,"100,000円以上","花見などの自然鑑賞,名所、旧跡の観光,アウトドア:登山・トレッキング",0,0,0,1,1,0,0,0,0,0,0,0,0,0,1,0,0,0,0,0,0,0,0,,その他家族,,"Google map,インターネット・アプリ,Instagram",0,0,0,0,0,0,0,0,1,1,0,0,1,0,0,0,0,0,0,0,,レンタカー,0,1,0,0,0,0,0,0,,"レンタカー,タクシー",0,1,1,0,0,0,0,0,,大変満足,自由に移動できてこその沖縄旅行だから,2泊,"20,000円以上 30,000円未満",使わない,"20,000円以上 30,000円未満","5,000円未満",6-10回目,半年以内,必ず来たい,半年以内,大変満足,自然が良い、また南部のように混んでいないところがとても良い。,10,ドライブと星空,ない,,中部,その他,ガーラ　やちむんの里,なかやんばる(名護市・本部町・今帰仁村),今帰仁城跡,,使わない,大変満足,景色が素晴らしい,散歩コースがしっかりと確立されていたのでこれ以上は特に求めていない。自然がいつまでも綺麗に残ればそれで良い。,10,景色が素晴らしい,男性,1995,沖縄県,300-400万円未満,真栄田岬エリア,恩納村,2025-12-14 14:28:13
2771,2582,2泊,"5,000円以上 10,000円未満","宿でのんびり過ごす,地元の美味しいものを食べる,アウトドア:登山・トレッキング",1,0,1,0,0,0,0,0,0,0,0,0,0,0,1,0,0,0,0,0,0,0,0,,自分ひとり,,"観光展・物産展,観光パンフレット・ポスター,Google map,宿泊施設",1,0,0,1,0,0,0,0,1,0,0,0,0,0,0,0,0,0,1,0,,レンタカー,0,1,0,0,0,0,0,0,,レンタカー,0,1,0,0,0,0,0,0,,普通,,1泊,"10,000円以上 20,000円未満","5,000円未満","5,000円未満","5,000円未満",6-10回目,半年以内,必ず来たい,1-3年後,大変満足,"登山が良かった。
次は天気の良い日にあたりたい。",8,"古宇利島のプチホテル
登山、トレッキング",ない,,なかやんばる(名護市・本部町・今帰仁村),その他,登山　嘉津宇岳,南部,首里城公園,,"5,000円未満",大変満足,,,10,,男性,1972,広島県,400-600万円未満,名護市街エリア,名護市,2025-12-14 15:06:47
2773,2583,3泊,"5,000円未満","地元の美味しいものを食べる,名所、旧跡の観光,買い物、アウトレット,まちあるき・集落散策,ドライブ・ツーリング,友人・親戚を尋ねる",0,0,1,0,1,0,0,0,1,0,0,0,0,0,0,0,1,0,0,1,1,0,0,,パートナー(恋人・夫婦など),,"Google map,インターネット・アプリ,YouTube",0,0,0,0,0,0,0,0,1,1,1,0,0,0,0,0,0,0,0,0,,自家用車,1,0,0,0,0,0,0,0,,自家用車,1,0,0,0,0,0,0,0,,,,2泊,"30,000円以上 40,000円未満","20,000円以上 30,000円未満","10,000円以上 20,000円未満","5,000円以上 10,000円未満",4-5回目,1-3年前,必ず来たい,半年-1年後,大変満足,海、景色、宿、街並み,9,ローカル感、市街地とは違う気張らない魅力,ない,,うふやんばる(国頭村・大宜味村・東村),塩屋湾,,南部,,,"5,000円未満",満足,,,8,,男性,1977,埼玉県,800-1000万円未満,道の駅ぎのざエリア,宜野座村,2025-12-14 15:11:49
2774,2584,2泊,"5,000円以上 10,000円未満","地元の美味しいものを食べる,花見などの自然鑑賞,名所、旧跡の観光,テーマパーク:沖縄美ら海水族館,まちあるき・集落散策",0,0,1,1,1,1,0,0,0,0,0,0,0,0,0,0,1,0,0,0,0,0,0,,パートナー(恋人・夫婦など),,"インターネット・アプリ,Instagram,観光協会・空港・道の駅等の案内所",0,0,0,0,0,0,0,0,0,1,0,0,1,0,0,0,1,0,0,0,,自家用車,1,0,0,0,0,0,0,0,,自家用車,1,0,0,0,0,0,0,0,,,,1泊,"20,000円以上 30,000円未満","5,000円以上 10,000円未満","5,000円以上 10,000円未満","5,000円以上 10,000円未満",11回目以上,半年-1年前,必ず来たい,半年以内,大変満足,道の駅とか売店で、地域の人の生産者の顔が見えたり、雰囲気を感じられるように展示や販売されてるのが、中南部より深く感じる気がします。,10,"手付かずの自然！
ゆっくり流れる時間！
仕事がなければ
もっと長い日数滞在したい！",ある,大きな有名な施設だけでなく、他の地元の施設にも行きやすいような表示が、もっと大きく、もっと数多くあると行きやすいなと思います！あと、ポケモンGOみたいなヤンバルGOみたいなアプリあると楽しみ増えそうだなと思いました！,なかやんばる(名護市・本部町・今帰仁村),その他,許田の道の駅,門口(じょうぐち)やんばる(金武町・宜野座村・恩納村),道の駅ぎのざ,,"5,000円以上 10,000円未満",満足,何度来ても楽しい。今回はオキちゃんにお別れしにきました。50年もずっと、ありがとう。,少し高いかな…💦,10,"ジンベエザメとオキちゃんショー
チンアナゴとクラゲ🪼
時間があれば本当は熱帯ドリームセンターも回りたい。母が花が好き🌺",女性,1974,沖縄県,400-600万円未満,海洋博公園・観光拠点エリア,本部町,2025-12-14 15:24:14
2775,2585,1泊,"5,000円以上 10,000円未満","宿でのんびり過ごす,リゾートホテルを楽しむ,地元の美味しいものを食べる,花見などの自然鑑賞,名所、旧跡の観光,買い物、アウトレット,友人・親戚を尋ねる",1,1,1,1,1,0,0,0,1,0,0,0,0,0,0,0,0,0,0,0,1,0,0,,パートナー(恋人・夫婦など),,その他,0,0,0,0,0,0,0,0,0,0,0,0,0,0,0,0,0,0,0,1,,自家用車,1,0,0,0,0,0,0,0,,自家用車,1,0,0,0,0,0,0,0,,,,1泊,"10,000円以上 20,000円未満","5,000円以上 10,000円未満","5,000円未満","5,000円未満",初めて,,必ず来たい,半年以内,大変満足,自然の中ドライブが最高。,10,,ある,食べ物屋さんが少ない気がします。,うふやんばる(国頭村・大宜味村・東村),辺戸岬,やんばるの展望台めぐり,うふやんばる(国頭村・大宜味村・東村),辺戸岬,,"5,000円未満",満足,,,10,,男性,1974,沖縄県,300-400万円未満,ヤンバルクイナ生態展示学習施設クイナの森エリア,国頭村,2025-12-14 15:36:01
2776,2586,1泊,"5,000円以上 10,000円未満","リゾートホテルを楽しむ,地元の美味しいものを食べる,花見などの自然鑑賞,買い物、アウトレット,ドライブ・ツーリング,その他",0,1,1,1,0,0,0,0,1,0,0,0,0,0,0,0,0,0,0,1,0,0,1,,パートナー(恋人・夫婦など),,その他,0,0,0,0,0,0,0,0,0,0,0,0,0,0,0,0,0,0,0,1,ドライブをして目に入りました。,自家用車,1,0,0,0,0,0,0,0,,自家用車,1,0,0,0,0,0,0,0,,,,1泊,"5,000円以上 10,000円未満","10,000円以上 20,000円未満","5,000円以上 10,000円未満","5,000円未満",2-3回目,半年以内,必ず来たい,半年以内,大変満足,日常の生活からの癒しそしてパワーをもらえる。食事をしてもフレンドリーで心があたたまるし人への思いやり感謝の心を忘れないでおこうと思う気持ちが生まれます。,10,"自然が豊富。人の優しさ、あたたかさ。
ご飯も美味しい。",ない,,うふやんばる(国頭村・大宜味村・東村),その他,新川ダム,うふやんばる(国頭村・大宜味村・東村),辺戸岬,,"5,000円未満",大変満足,マースのパイナップルと健康長寿のお守りを2つ購入。店員さんも優しくてモニターでヤンバルクイナや天然ウナギの動画もよかった。また絶対来ます,飲食の種類（惣菜類）や野菜や果物があると嬉しいかも。,10,トイレも清潔で何よりも店員さんが親切なところ。,女性,1975,沖縄県,200-300万円未満,ヤンバルクイナ生態展示学習施設クイナの森エリア,国頭村,2025-12-14 15:42:16
2777,2587,3泊,"50,000円以上 100,000円未満",出張など仕事関係,0,0,0,0,0,0,0,0,0,0,0,0,0,0,0,0,0,0,0,0,0,1,0,,学校関係(修学旅行・社会見学等),,"新聞・雑誌・ガイドブック,観光協会のHP,美ら海水族館等の観光関連事業者HP,宿泊事業者のHP",0,1,0,0,1,1,1,0,0,0,0,0,0,0,0,0,0,0,0,0,,その他,0,0,0,0,0,0,0,1,チャーターバス,レンタカー,0,1,0,0,0,0,0,0,,満足,,2泊,"40,000円以上 50,000円未満","10,000円以上 20,000円未満","10,000円以上 20,000円未満","5,000円以上 10,000円未満",4-5回目,3-5年前,必ず来たい,1-3年後,満足,,10,,ない,,うふやんばる(国頭村・大宜味村・東村),辺戸岬,,なかやんばる(名護市・本部町・今帰仁村),沖縄美ら海水族館,,"5,000円未満",大変満足,,,10,,無回答,1959,大阪府,答えられない,海洋博公園・観光拠点エリア,本部町,2025-12-14 15:44:25
2778,2588,1泊,"5,000円未満",宿でのんびり過ごす,1,0,0,0,0,0,0,0,0,0,0,0,0,0,0,0,0,0,0,0,0,0,0,,未就学児を含む家族,,"宿泊事業者のHP,インターネット・アプリ,Instagram",0,0,0,0,0,0,1,0,0,1,0,0,1,0,0,0,0,0,0,0,,自家用車,1,0,0,0,0,0,0,0,,自家用車,1,0,0,0,0,0,0,0,,,,1泊,"20,000円以上 30,000円未満","5,000円以上 10,000円未満","5,000円以上 10,000円未満","5,000円未満",11回目以上,半年以内,必ず来たい,半年以内,満足,期待どおりだから。山原の雰囲気が好きだから,8,我那覇焼肉店、沖縄そば,ない,,なかやんばる(名護市・本部町・今帰仁村),その他,ネオパーク,特になし,特に無し,,"5,000円未満",やや満足,入り口付近の渋滞が気になる。奥の方の駐車場は空いているのに。,キッチンカーなどがあってもいいかなと思った。,6,おっぱソフトは必ず食べよう,女性,1992,沖縄県,1500-2000万円未満,道の駅許田エリア,名護市,2025-12-14 15:53:08
2779,2589,2泊,"5,000円以上 10,000円未満","地元の美味しいものを食べる,名所、旧跡の観光",0,0,1,0,1,0,0,0,0,0,0,0,0,0,0,0,0,0,0,0,0,0,0,,自分ひとり,,観光協会のHP,0,0,0,0,1,0,0,0,0,0,0,0,0,0,0,0,0,0,0,0,,レンタカー,0,1,0,0,0,0,0,0,,レンタカー,0,1,0,0,0,0,0,0,,満足,移動範囲が広がり、便利です。,やんばるエリアには宿泊しない,"5,000円未満","5,000円未満","5,000円未満","5,000円未満",初めて,,必ず来たい,半年以内,大変満足,"食べ物が美味しかったです！
あとは自然や綺麗な海もみれて沖縄に来たという感じで満足です。",10,自分が来て良かったので、今度は家族と一緒にきたいです。,ない,,中部,美浜アメリカンビレッジ,,特になし,,,"5,000円未満",大変満足,食事がおいしい、サービスで増量してくれて幸せです。,,10,,女性,1985,兵庫県,400-600万円未満,おんなの駅エリア,恩納村,2025-12-14 16:27:08
2780,2590,2泊,"100,000円以上","宿でのんびり過ごす,名所、旧跡の観光,テーマパーク:沖縄美ら海水族館,買い物、アウトレット,アウトドア:ビーチ・海水浴",1,0,0,0,1,1,0,0,1,0,0,0,1,0,0,0,0,0,0,0,0,0,0,,中学生以上を含む家族(小学生以下は含まない),,"観光展・物産展,新聞・雑誌・ガイドブック,観光協会のHP,美ら海水族館等の観光関連事業者HP",1,1,0,0,1,1,0,0,0,0,0,0,0,0,0,0,0,0,0,0,,レンタカー,0,1,0,0,0,0,0,0,,レンタカー,0,1,0,0,0,0,0,0,,大変満足,どれも、楽しめたから。お店の人の対応も良かった,3泊,"200,000円以上","20,000円以上 30,000円未満","20,000円以上 30,000円未満","10,000円以上 20,000円未満",11回目以上,半年以内,必ず来たい,半年以内,大変満足,環境がきれい,10,素晴らしい自然をみんなにも見てほしい,ない,,なかやんばる(名護市・本部町・今帰仁村),沖縄美ら海水族館,,中部,東南植物楽園,,"5,000円未満",大変満足,店員さんの対応がいい。商品も充実している？,,10,スイーツが美味しかったから,女性,1981,愛知県,1200-1500万円未満,万座毛エリア,恩納村,2025-12-14 16:27:43
2781,2591,3泊,"5,000円以上 10,000円未満","宿でのんびり過ごす,リゾートホテルを楽しむ,地元の美味しいものを食べる,花見などの自然鑑賞,名所、旧跡の観光,アウトドア:登山・トレッキング,アウトドア:キャンプ,まちあるき・集落散策,ドライブ・ツーリング",1,1,1,1,1,0,0,0,0,0,0,0,0,0,1,1,1,0,0,1,0,0,0,,友人,,"Google map,友人・知人",0,0,0,0,0,0,0,0,1,0,0,0,0,0,0,1,0,0,0,0,,自家用車,1,0,0,0,0,0,0,0,,自家用車,1,0,0,0,0,0,0,0,,,,2泊,"5,000円以上 10,000円未満","5,000円未満","5,000円以上 10,000円未満","5,000円未満",11回目以上,半年以内,必ず来たい,半年以内,大変満足,自然豊かな場所に「いる」だけで満足,10,"沖縄の自然を感じてほしい
又、沖縄戦に関する色々な事実も知ってほしい",ない,,島やんばる(伊江村・伊是名村・伊平屋村),その他,旅行村(キャンプ),島やんばる(伊江村・伊是名村・伊平屋村),伊江島タッチュー,,"5,000円未満",満足,珍しいハイビスカスが沢山見られました,ハイビスカスティーや、ローゼルジャムを使ったスイーツなどをいただけるカフェがあったらいいかも。,7,植物が好きな人なら良いと思います。,女性,1968,沖縄県,200-300万円未満,伊江村エリア,伊江村,2025-12-14 16:36:41
2782,2592,2泊,"10,000円以上 20,000円未満",テーマパーク:沖縄美ら海水族館,0,0,0,0,0,1,0,0,0,0,0,0,0,0,0,0,0,0,0,0,0,0,0,,団体旅行,,"TV・ラジオ番組やCM,Google map",0,0,1,0,0,0,0,0,1,0,0,0,0,0,0,0,0,0,0,0,,レンタカー,0,1,0,0,0,0,0,0,,レンタカー,0,1,0,0,0,0,0,0,,満足,,やんばるエリアには宿泊しない,使わない,"5,000円未満","5,000円未満","5,000円未満",初めて,,来たい,1-3年後,普通,,5,,ない,,南部,平和祈念公園,,南部,国際通り,,"5,000円以上 10,000円未満",やや満足,,,8,,男性,1976,熊本県,300-400万円未満,道の駅許田エリア,名護市,2025-12-14 16:54:06
2784,2593,7泊以上,"20,000円以上 30,000円未満","テーマパーク:沖縄美ら海水族館,テーマパーク:JUNGLIA,友人・親戚を尋ねる,出張など仕事関係",0,0,0,0,0,1,1,0,0,0,0,0,0,0,0,0,0,0,0,0,1,1,0,,自分ひとり,,"観光展・物産展,Google map,友人・知人,観光協会・空港・道の駅等の案内所",1,0,0,0,0,0,0,0,1,0,0,0,0,0,0,1,1,0,0,0,,自家用車,1,0,0,0,0,0,0,0,,自家用車,1,0,0,0,0,0,0,0,,,,7泊以上,"10,000円以上 20,000円未満","5,000円未満","5,000円以上 10,000円未満","5,000円以上 10,000円未満",初めて,,来たい,1-3年後,大変満足,自然,9,自然、景色,ない,,うふやんばる(国頭村・大宜味村・東村),辺戸岬,,なかやんばる(名護市・本部町・今帰仁村),今帰仁城跡,,"5,000円以上 10,000円未満",満足,,ご飯が美味しい,10,景色,男性,1981,埼玉県,800-1000万円未満,辺戸岬観光案内所エリア,国頭村,2025-12-14 17:16:39
2785,2594,日帰り,"10,000円以上 20,000円未満","地元の美味しいものを食べる,花見などの自然鑑賞,ドライブ・ツーリング",0,0,1,1,0,0,0,0,0,0,0,0,0,0,0,0,0,0,0,1,0,0,0,,パートナー(恋人・夫婦など),,"新聞・雑誌・ガイドブック,Google map,Instagram",0,1,0,0,0,0,0,0,1,0,0,0,1,0,0,0,0,0,0,0,,自家用車,1,0,0,0,0,0,0,0,,自家用車,1,0,0,0,0,0,0,0,,,,1泊,"10,000円以上 20,000円未満","5,000円未満","5,000円未満","5,000円未満",初めて,,必ず来たい,半年以内,大変満足,山々や海の自然あふれるところをドライブできてとっても気持ちよかった。夜偶然、ケナガネズミを見れたのもとてもいい思い出になった。道の駅やカフェも地元ならではの食べ物が多く、そこで出会う人との会話も楽しかった。とても癒された。今度は春、桜の季節に来たい。,10,"アガリパークがとてもおすすめ✨
ネオパークの隣にあってあそこでは一日遊べると思った。cookhalというカフェが気に入った。事前に申し込めば、胡椒の見学体験もできるし、自然や植物好きにはたまらないスポット。",ある,飲食店が営業時間、朝は遅く、夜は早く閉まってしまうため、現地でふらっと寄れるところを探すのは結構困難。,中部,残波岬,,うふやんばる(国頭村・大宜味村・東村),福地川海浜公園,,"5,000円未満",大変満足,"Cookhal
地元野菜が買えて、ランチでも食べれて大変満足。今度はワークショップ参加してみたいと思った。",大変満足。,10,お土産もやんばる特産のものが多く、あまり空港で見かけないものばかりだから、とってもレア感が味わえてよかった。,女性,1998,鹿児島県,300-400万円未満,嵐山エリア,名護市,2025-12-14 18:02:36
2786,2595,2泊,"5,000円以上 10,000円未満","地元の美味しいものを食べる,名所、旧跡の観光,テーマパーク:沖縄美ら海水族館,テーマパーク:JUNGLIA",0,0,1,0,1,1,1,0,0,0,0,0,0,0,0,0,0,0,0,0,0,0,0,,パートナー(恋人・夫婦など),,"宿泊事業者のHP,Google map,インターネット・アプリ,Instagram",0,0,0,0,0,0,1,0,1,1,0,0,1,0,0,0,0,0,0,0,,レンタカー,0,1,0,0,0,0,0,0,,レンタカー,0,1,0,0,0,0,0,0,,大変満足,行きたいところに自由に行ける,2泊,"10,000円以上 20,000円未満","5,000円以上 10,000円未満","5,000円以上 10,000円未満","5,000円以上 10,000円未満",初めて,,来たい,5年以上,大変満足,美ら海水族館、ジャングリア、古宇利島に行きました。どこも良く、移動もレンタカーで渋滞などなく有意義に過ごせたました。,10,ジャングリア。程よい混み具合で楽しめ、働いている人も笑顔で、気持ち良かった。,ある,道路の看板の文字が薄くなっているところが多かった。,なかやんばる(名護市・本部町・今帰仁村),古宇利島(オーシャンタワー/ハートロック),,南部,その他,那覇空港,"5,000円未満",大変満足,接客態度が良かった。,,10,万座毛の雄大さは一見の価値あり。,女性,1969,神奈川県,1000-1200万円未満,万座毛エリア,恩納村,2025-12-14 18:14:08
2787,2596,3泊,"10,000円以上 20,000円未満","地元の美味しいものを食べる,花見などの自然鑑賞,名所、旧跡の観光,買い物、アウトレット,ドライブ・ツーリング",0,0,1,1,1,0,0,0,1,0,0,0,0,0,0,0,0,0,0,1,0,0,0,,パートナー(恋人・夫婦など),,"インターネット・アプリ,Instagram",0,0,0,0,0,0,0,0,0,1,0,0,1,0,0,0,0,0,0,0,,レンタカー,0,1,0,0,0,0,0,0,,レンタカー,0,1,0,0,0,0,0,0,,大変満足,行きたいところに行ける,3泊,"20,000円以上 30,000円未満",使わない,"10,000円以上 20,000円未満","5,000円以上 10,000円未満",2-3回目,半年-1年前,必ず来たい,1-3年後,満足,お店の人も丁寧で良かったから。,8,海をはじめ、自然が良い。,ない,,うふやんばる(国頭村・大宜味村・東村),辺戸岬,,なかやんばる(名護市・本部町・今帰仁村),古宇利島(オーシャンタワー/ハートロック),,"5,000円未満",満足,,,7,,女性,1969,神奈川県,答えられない,芭蕉布会館エリア,大宜味村,2025-12-14 18:42:48
2788,2597,3泊,"10,000円以上 20,000円未満","地元の美味しいものを食べる,花見などの自然鑑賞",0,0,1,1,0,0,0,0,0,0,0,0,0,0,0,0,0,0,0,0,0,0,0,,パートナー(恋人・夫婦など),,"新聞・雑誌・ガイドブック,Google map,Instagram",0,1,0,0,0,0,0,0,1,0,0,0,1,0,0,0,0,0,0,0,,レンタカー,0,1,0,0,0,0,0,0,,レンタカー,0,1,0,0,0,0,0,0,,満足,"やんばるエリアにおいては、駐車場は分かりやすいし、季節柄 道路は空いているので。
那覇市内は交通量が多く、空港周辺は何とかしてほしい。",2泊,"10,000円以上 20,000円未満","5,000円未満","5,000円以上 10,000円未満","5,000円未満",2-3回目,半年-1年前,必ず来たい,半年-1年後,満足,皆さん親切,8,自然が豊富,ない,,うふやんばる(国頭村・大宜味村・東村),辺戸岬,,中部,美浜アメリカンビレッジ,,"5,000円未満",満足,持ち帰れないもの(果物)ばかりで、残念だから,昔の大宜味の道の駅を知っているので、昔ながらの施設の再利用。,8,現地の方の作った作物や果物,男性,1973,東京都,600-800万円未満,-,-,2025-12-14 19:11:49
