6631,5962,2泊,"5,000円以上 10,000円未満","リゾートホテルを楽しむ,花見などの自然鑑賞,テーマパーク:沖縄美ら海水族館,テーマパーク:その他",0,1,0,1,0,1,0,1,0,0,0,0,0,0,0,0,0,0,0,0,0,0,0,,パートナー(恋人・夫婦など),,"観光パンフレット・ポスター,インターネット・アプリ",0,0,0,1,0,0,0,0,0,1,0,0,0,0,0,0,0,0,0,0,,自家用車,1,0,0,0,0,0,0,0,,自家用車,1,0,0,0,0,0,0,0,,,,2泊,"20,000円以上 30,000円未満","5,000円未満","5,000円未満","5,000円以上 10,000円未満",4-5回目,半年以内,必ず来たい,半年-1年後,やや満足,美ら海水族館やGODACなどはまだ行きやすいが、さらに北部は行きたくてもなかなか行きづらい。やんばるの森などの希少動物も見たいが難しい。宿泊施設や飲食店もわからないため、子供がいると連れて行くの大変なため観光地の方ばかり回ってしまう。,7,"美ら海水族館
日本最大級の水族館。ここを知ると他の水族館が小さく乏しく思える",ある,観光地周辺の飲食店に観光客が多いため入りづらいや金額が高めであったりする。リゾートホテル周辺では海に行くため飛び出しがあったり、水着で出回るのはいいが何が羽織って欲しいと思ってしまう。,特になし,特に無し,,特になし,特に無し,,"5,000円未満",やや満足,変わり映えがあまりしないから。もう少し施設の大きさ、JAMSTECの情報やROVなどの機器を活用した展示を増やして欲しい。,水中ドローンなどの操作ができるイベントが限られているので、いつでも擬似体験できる機器があるといい。,5,JAMSTECという日本には海洋調査を行なっている施設があることを知るきっかけになる。その調査のための調査船や深海生物について勧めたい,男性,1989,沖縄県,100万円未満,久辺三区エリア,名護市,2026-02-27 15:18:57
6632,5963,2泊,"10,000円以上 20,000円未満","地元の美味しいものを食べる,テーマパーク:沖縄美ら海水族館,テーマパーク:JUNGLIA",0,0,1,0,0,1,1,0,0,0,0,0,0,0,0,0,0,0,0,0,0,0,0,,自分ひとり,,"Google map,インターネット・アプリ",0,0,0,0,0,0,0,0,1,1,0,0,0,0,0,0,0,0,0,0,,レンタカー,0,1,0,0,0,0,0,0,,レンタカー,0,1,0,0,0,0,0,0,,満足,,やんばるエリアには宿泊しない,使わない,"10,000円以上 20,000円未満","5,000円未満","10,000円以上 20,000円未満",2-3回目,3-5年前,来たい,半年-1年後,やや満足,,7,,ある,,南部,国際通り,,なかやんばる(名護市・本部町・今帰仁村),その他,,"5,000円未満",普通,,,5,,男性,1997,東京都,答えられない,海洋博公園・観光拠点エリア,本部町,2026-02-27 15:19:28
6633,5964,3泊,"30,000円以上 40,000円未満","リゾートホテルを楽しむ,テーマパーク:JUNGLIA,テーマパーク:その他",0,1,0,0,0,0,1,1,0,0,0,0,0,0,0,0,0,0,0,0,0,0,0,,中学生以上を含む家族(小学生以下は含まない),,"宿泊事業者のHP,Google map",0,0,0,0,0,0,1,0,1,0,0,0,0,0,0,0,0,0,0,0,,レンタカー,0,1,0,0,0,0,0,0,,レンタカー,0,1,0,0,0,0,0,0,,大変満足,バス以外の交通手段が見られなかったし、行きたいところへ行きたい時にいけるのが良かった　車がないと楽しめないエリアだと行ってみて感じた,2泊,"50,000円以上 100,000円未満","5,000円未満","5,000円未満","20,000円以上 30,000円未満",初めて,,来たい,1-3年後,満足,,4,のんびりできる自然環境,ある,スーパーなどが距離がある,なかやんばる(名護市・本部町・今帰仁村),JUNGLIA,,門口(じょうぐち)やんばる(金武町・宜野座村・恩納村),恩納村海岸(青の洞窟),,"10,000円以上 20,000円未満",やや満足,機関車の運行が少なく、待ち時間が長く発生してしまう,,3,鳥があんなに間近に見られるのは初めてだったので、エサやりなどとても楽しい時間でした　動物園とはちょっと違う雰囲気が楽しめるパークでした,女性,1980,愛知県,1000-1200万円未満,嵐山エリア,名護市,2026-02-27 15:27:19
6634,5965,6泊,"10,000円以上 20,000円未満","地元の美味しいものを食べる,名所、旧跡の観光,アウトドア:マリンスポーツ,ドライブ・ツーリング",0,0,1,0,1,0,0,0,0,0,0,0,0,1,0,0,0,0,0,1,0,0,0,,パートナー(恋人・夫婦など),,"新聞・雑誌・ガイドブック,YouTube,Instagram",0,1,0,0,0,0,0,0,0,0,1,0,1,0,0,0,0,0,0,0,,レンタカー,0,1,0,0,0,0,0,0,,レンタカー,0,1,0,0,0,0,0,0,,大変満足,,やんばるエリアには宿泊しない,"5,000円以上 10,000円未満","5,000円以上 10,000円未満","5,000円以上 10,000円未満","10,000円以上 20,000円未満",初めて,,来たい,5年以上,満足,,10,,ない,,なかやんばる(名護市・本部町・今帰仁村),ナゴパイナップルパーク,,門口(じょうぐち)やんばる(金武町・宜野座村・恩納村),,,"5,000円未満",満足,,,9,,男性,1999,栃木県,答えられない,有銘・慶佐次・平良エリア,東村,2026-02-27 15:45:07
6635,5966,日帰り,使わない,"花見などの自然鑑賞,名所、旧跡の観光,ドライブ・ツーリング",0,0,0,1,1,0,0,0,0,0,0,0,0,0,0,0,0,0,0,1,0,0,0,,親,,"Google map,Instagram,ブログ",0,0,0,0,0,0,0,0,1,0,0,0,1,0,1,0,0,0,0,0,,自家用車,1,0,0,0,0,0,0,0,,自家用車,1,0,0,0,0,0,0,0,,,,やんばるエリアには宿泊しない,"5,000円未満","5,000円未満","5,000円未満",使わない,11回目以上,半年以内,必ず来たい,半年-1年後,大変満足,,10,,ない,,門口(じょうぐち)やんばる(金武町・宜野座村・恩納村),道の駅ぎのざ,,うふやんばる(国頭村・大宜味村・東村),塩屋湾,,使わない,満足,,,7,,女性,2008,沖縄県,答えられない,辺戸岬観光案内所エリア,国頭村,2026-02-27 16:03:31
6636,5967,2泊,"20,000円以上 30,000円未満","地元の美味しいものを食べる,まちあるき・集落散策",0,0,1,0,0,0,0,0,0,0,0,0,0,0,0,0,1,0,0,0,0,0,0,,自分ひとり,,その他,0,0,0,0,0,0,0,0,0,0,0,0,0,0,0,0,0,0,0,1,書籍の「日本百名島」,"レンタカー,フェリー",0,1,0,0,1,0,0,0,,"レンタカー,徒歩,その他",0,1,0,0,0,1,0,1,レンタバイク,満足,原付のレンタバイクはレンタカーに比べると、機動性があり安価,2泊,"40,000円以上 50,000円未満","10,000円以上 20,000円未満","5,000円以上 10,000円未満","5,000円以上 10,000円未満",2-3回目,5年以上前,来たい,1-3年後,満足,沖縄の原風景みたいなイメージがあり、皆さんが親切である,9,民宿、その料理,ある,高速道路が未整備,なかやんばる(名護市・本部町・今帰仁村),古宇利島(オーシャンタワー/ハートロック),,島やんばる(伊江村・伊是名村・伊平屋村),伊是名城跡,,使わない,やや満足,天気が悪かった,売店が閉まっていた,7,特になし,男性,1962,東京都,400-600万円未満,伊是名エリア,伊是名村,2026-02-27 16:20:05
6637,5968,2泊,"30,000円以上 40,000円未満","リゾートホテルを楽しむ,アウトドア:マリンスポーツ",0,1,0,0,0,0,0,0,0,0,0,0,0,1,0,0,0,0,0,0,0,0,0,,その他家族,,Instagram,0,0,0,0,0,0,0,0,0,0,0,0,1,0,0,0,0,0,0,0,,レンタカー,0,1,0,0,0,0,0,0,,徒歩,0,0,0,0,0,1,0,0,,,,2泊,"30,000円以上 40,000円未満","20,000円以上 30,000円未満","20,000円以上 30,000円未満","10,000円以上 20,000円未満",初めて,,必ず来たい,半年-1年後,大変満足,自然がいっぱい,9,自然,ない,,南部,国際通り,,門口(じょうぐち)やんばる(金武町・宜野座村・恩納村),万座毛,,"10,000円以上 20,000円未満",大変満足,,,9,,女性,1967,埼玉県,600-800万円未満,道の駅ゆいゆい国頭エリア,国頭村,2026-02-27 17:00:00
6638,5969,4泊,"20,000円以上 30,000円未満","リゾートホテルを楽しむ,地元の美味しいものを食べる,アウトドア:ビーチ・海水浴",0,1,1,0,0,0,0,0,0,0,0,0,1,0,0,0,0,0,0,0,0,0,0,,未就学児を含む家族,,"観光展・物産展,YouTube",1,0,0,0,0,0,0,0,0,0,1,0,0,0,0,0,0,0,0,0,,レンタカー,0,1,0,0,0,0,0,0,,レンタカー,0,1,0,0,0,0,0,0,,大変満足,沖縄の開放的な空気の中、レンタカーを利用したことで移動もとてもスムーズで、子ども連れでも快適に観光を楽しむことができました。荷物が多くても気兼ねなく動け、時間に縛られずゆったり回れたのが本当に良かったです。家族みんなで景色やグルメを満喫でき、思い出に残る素敵な沖縄旅行になりました。,2泊,"30,000円以上 40,000円未満","5,000円以上 10,000円未満","5,000円以上 10,000円未満","10,000円以上 20,000円未満",2-3回目,5年以上前,必ず来たい,半年以内,大変満足,手つかずの大自然が広がり、やんばるならではのゆったりとした時間を家族で過ごせたことがとても印象的でした。移動や施設も利用しやすく、子ども連れでも安心して楽しめる環境が整っていて、体験一つひとつが思い出に残るものになりました。自然・人・サービスすべてに温かさを感じ、大満足です。,10,やんばるの森を感じられる自然体験がとても良くて、いちばん人に勧めたいと思いました。空気が澄んでいて時間がゆっくり流れている感じがして、子どもも終始ご機嫌で過ごせたのが嬉しかったです。観光地のにぎやかさとはまた違って、家族でリラックスしながら沖縄らしさを味わえる特別な場所だと思いました。,ある,自然が多く静かな環境でとても魅力的な反面、移動距離が長く次の目的地まで少し時間がかかる場面がありました。子ども連れだったので、休憩できる場所や飲み物を購入できる施設がもう少し点在していると、さらに安心して回れると感じました。また、案内表示がもう少し分かりやすくなると、初めて訪れる人でもスムーズに観光できると思います,なかやんばる(名護市・本部町・今帰仁村),古宇利島(オーシャンタワー/ハートロック),,中部,北谷サンセットビーチ,,"10,000円以上 20,000円未満",大変満足,目の前に大きく広がる海の景色がとても開放的で、訪れた瞬間に感動しました。施設もきれいで利用しやすく、景色をゆっくり楽しみながら快適に過ごせたため大満足です。,沖縄らしい食材を使った軽食や、景色を眺めながらゆっくり過ごせるカフェメニューがもう少し充実していると嬉しいです。お土産はここでしか買えない限定感のある商品や、やんばるの自然を感じられるものが増えると、旅の思い出として選ぶ楽しみが広がると思いました。アクティビティについては、子ども連れでも気軽に参加できる体験や、万座毛の自然や歴史を知れるようなミニガイドなどがあると、滞在時間をより有意義に過ごせると感じました,10,万座毛の絶景を安全で快適に楽しめる展望スペースは、ぜひ人に勧めたいと感じました。目の前に広がる青い海と迫力のある景色をゆっくり眺めることができ、施設内もきれいで休憩や買い物もしやすく、子ども連れでも安心して過ごせたのが良かったです。観光と快適さの両方がそろっていて、誰でも満足できる場所だと思いました,女性,1993,三重県,1200-1500万円未満,万座毛エリア,恩納村,2026-02-27 17:15:27
6639,5970,3泊,"5,000円以上 10,000円未満","地元の美味しいものを食べる,花見などの自然鑑賞,名所、旧跡の観光,テーマパーク:沖縄美ら海水族館,買い物、アウトレット",0,0,1,1,1,1,0,0,1,0,0,0,0,0,0,0,0,0,0,0,0,0,0,,未就学児を含む家族,,"Google map,インターネット・アプリ,Instagram,友人・知人",0,0,0,0,0,0,0,0,1,1,0,0,1,0,0,1,0,0,0,0,,レンタカー,0,1,0,0,0,0,0,0,,レンタカー,0,1,0,0,0,0,0,0,,満足,,3泊,"50,000円以上 100,000円未満","20,000円以上 30,000円未満","40,000円以上 50,000円未満","40,000円以上 50,000円未満",2-3回目,5年以上前,必ず来たい,1-3年後,大変満足,,9,,ない,,なかやんばる(名護市・本部町・今帰仁村),沖縄美ら海水族館,,特になし,特に無し,,"5,000円以上 10,000円未満",満足,,,9,,女性,1992,熊本県,400-600万円未満,万座毛エリア,恩納村,2026-02-27 18:06:27
6640,5971,1泊,"10,000円以上 20,000円未満","地元の美味しいものを食べる,買い物、アウトレット,まちあるき・集落散策",0,0,1,0,0,0,0,0,1,0,0,0,0,0,0,0,1,0,0,0,0,0,0,,親,,新聞・雑誌・ガイドブック,0,1,0,0,0,0,0,0,0,0,0,0,0,0,0,0,0,0,0,0,,レンタカー,0,1,0,0,0,0,0,0,,レンタカー,0,1,0,0,0,0,0,0,,満足,途中で道の駅とか寄り道しながら海沿いをドライブ出来て素敵でした。,1泊,"40,000円以上 50,000円未満","100,000円以上 200,000円未満","20,000円以上 30,000円未満","20,000円以上 30,000円未満",初めて,,必ず来たい,半年-1年後,満足,"綺麗な景色を見て心が癒されました。
主人を亡くして心のリハビリで訪れました。",10,ホテルのサービス、人の温かさ、綺麗な海と山の景色。,ある,"ホテルの駐車場からフロントが遠かった
けど、フロントに到着するとホテルの方が車の移動してくださったり、案内の丁寧さのおもてなしが素晴らしかったです。",南部,国際通り,,南部,首里城公園,,"40,000円以上 50,000円未満",満足,ホテルのサービスや目の前の海の美しさに心が癒されます。,沖縄ならではの食材が食べられたり、お土産もここならではのものが買えて満足です。白い砂浜のビーチを歩くのもとても素敵な体験です。,10,また家族で訪れたい素敵な場所です。,女性,1974,千葉県,200-300万円未満,道の駅ゆいゆい国頭エリア,国頭村,2026-02-27 18:08:06
6641,5972,2泊,"20,000円以上 30,000円未満",テーマパーク:その他,0,0,0,0,0,0,0,1,0,0,0,0,0,0,0,0,0,0,0,0,0,0,0,,未就学児を含む家族,,"美ら海水族館等の観光関連事業者HP,Chat GPT等の生成AI,Google map,Instagram",0,0,0,0,0,1,0,1,1,0,0,0,1,0,0,0,0,0,0,0,,レンタカー,0,1,0,0,0,0,0,0,,レンタカー,0,1,0,0,0,0,0,0,,やや満足,特に問題なく過ごすことができらから,1泊,"10,000円以上 20,000円未満","5,000円以上 10,000円未満","5,000円以上 10,000円未満","5,000円未満",初めて,,来たい,1-3年後,大変満足,美ら海水族館、海洋博公園を満喫できたから,7,観光施設が魅力的,ない,,中部,その他,ADEMOK,南部,その他,以前住んでいたところ,"5,000円以上 10,000円未満",大変満足,大きい水槽が迫力があったから,オリジナルのガチャガチャが豊富で楽しめた,10,,女性,1992,千葉県,400-600万円未満,海洋博公園・観光拠点エリア,本部町,2026-02-27 18:29:56
6642,5973,3泊,"100,000円以上","テーマパーク:沖縄美ら海水族館,テーマパーク:その他,買い物、アウトレット,まちあるき・集落散策",0,0,0,0,0,1,0,1,1,0,0,0,0,0,0,0,1,0,0,0,0,0,0,,未就学児を含む家族,,新聞・雑誌・ガイドブック,0,1,0,0,0,0,0,0,0,0,0,0,0,0,0,0,0,0,0,0,,レンタカー,0,1,0,0,0,0,0,0,,レンタカー,0,1,0,0,0,0,0,0,,大変満足,,やんばるエリアには宿泊しない,"5,000円未満","5,000円未満","10,000円以上 20,000円未満","10,000円以上 20,000円未満",初めて,,必ず来たい,1-3年後,普通,,6,,ない,,なかやんばる(名護市・本部町・今帰仁村),沖縄美ら海水族館,,なかやんばる(名護市・本部町・今帰仁村),JUNGLIA,,"20,000円以上 30,000円未満",大変満足,,,8,,男性,1991,熊本県,400-600万円未満,万座毛エリア,恩納村,2026-02-27 18:37:36
6643,5974,4泊,"50,000円以上 100,000円未満","花見などの自然鑑賞,名所、旧跡の観光,アウトドア:キャンプ",0,0,0,1,1,0,0,0,0,0,0,0,0,0,0,1,0,0,0,0,0,0,0,,パートナー(恋人・夫婦など),,"観光協会のHP,ブログ",0,0,0,0,1,0,0,0,0,0,0,0,0,0,1,0,0,0,0,0,,その他,0,0,0,0,0,0,0,1,単身中のパートナーの車,その他,0,0,0,0,0,0,0,1,単身中のパートナーの車,大変満足,時間に縛られず、自由におもうところに行くことができた。予定の変更にも急な寄り道にも気にすることなく立ち寄れた。,1泊,"20,000円以上 30,000円未満","10,000円以上 20,000円未満","5,000円以上 10,000円未満","5,000円以上 10,000円未満",2-3回目,半年-1年前,必ず来たい,半年-1年後,大変満足,今回の旅行の目的が、ヤンバルの自然を満喫することで、キャンプと星空鑑賞を楽しむことができ今までにない体験に感激しました。,10,"星空鑑賞です。
今までのどの旅行先よりもよく見ることができました。今回星空ソムリエという方からの説明もすごく良かったのでこのツアーを特に進めたいです。",ある,"ネットのつながりやすさ。
目的が自然との触れ合いだったので１泊くらいだと問題なかったのですが、長く逗留する時には安心感があるかと思いました。",なかやんばる(名護市・本部町・今帰仁村),その他,今帰仁城址,特になし,特に無し,,使わない,普通,特に何もしなかったため。,特になし,5,特になし。,女性,1965,山口県,600-800万円未満,伊是名エリア,伊是名村,2026-02-27 18:50:57
6644,5975,3泊,"10,000円以上 20,000円未満",友人・親戚を尋ねる,0,0,0,0,0,0,0,0,0,0,0,0,0,0,0,0,0,0,0,0,1,0,0,,パートナー(恋人・夫婦など),,"インターネット・アプリ,Twitter,Instagram,友人・知人",0,0,0,0,0,0,0,0,0,1,0,1,1,0,0,1,0,0,0,0,,レンタカー,0,1,0,0,0,0,0,0,,レンタカー,0,1,0,0,0,0,0,0,,満足,高速が渋滞してた,2泊,"5,000円以上 10,000円未満","5,000円以上 10,000円未満","5,000円以上 10,000円未満","5,000円以上 10,000円未満",11回目以上,半年-1年前,必ず来たい,半年以内,大変満足,自然を1番感じられる,10,マングローブ,ない,,南部,国際通り,,うふやんばる(国頭村・大宜味村・東村),その他,実家,"5,000円未満",大変満足,うまい,,10,一番美味しい,男性,1998,千葉県,800-1000万円未満,金武・並里エリア,金武町,2026-02-27 20:00:42
6645,5976,3泊,"20,000円以上 30,000円未満",友人・親戚を尋ねる,0,0,0,0,0,0,0,0,0,0,0,0,0,0,0,0,0,0,0,0,1,0,0,,パートナー(恋人・夫婦など),,友人・知人,0,0,0,0,0,0,0,0,0,0,0,0,0,0,0,1,0,0,0,0,,レンタカー,0,1,0,0,0,0,0,0,,レンタカー,0,1,0,0,0,0,0,0,,満足,,2泊,"10,000円以上 20,000円未満","10,000円以上 20,000円未満","10,000円以上 20,000円未満","10,000円以上 20,000円未満",11回目以上,半年-1年前,必ず来たい,半年-1年後,大変満足,,10,,ない,,門口(じょうぐち)やんばる(金武町・宜野座村・恩納村),その他,キンタコ,うふやんばる(国頭村・大宜味村・東村),その他,祖父母家,"100,000円以上",大変満足,,,10,,女性,1997,千葉県,300-400万円未満,-,-,2026-02-27 20:04:18
6646,5977,2泊,"10,000円以上 20,000円未満",テーマパーク:JUNGLIA,0,0,0,0,0,0,1,0,0,0,0,0,0,0,0,0,0,0,0,0,0,0,0,,パートナー(恋人・夫婦など),,"インターネット・アプリ,友人・知人",0,0,0,0,0,0,0,0,0,1,0,0,0,0,0,1,0,0,0,0,,レンタカー,0,1,0,0,0,0,0,0,,レンタカー,0,1,0,0,0,0,0,0,,満足,,2泊,"10,000円以上 20,000円未満","10,000円以上 20,000円未満","5,000円未満","5,000円未満",2-3回目,3-5年前,来たい,3-5年後,やや満足,,7,,ない,,南部,首里城公園,,なかやんばる(名護市・本部町・今帰仁村),JUNGLIA,,"5,000円未満",やや不満,お風呂のお湯の温度が低かった,,3,,男性,1964,東京都,答えられない,道の駅許田エリア,名護市,2026-02-27 21:00:29
6647,5978,3泊,"20,000円以上 30,000円未満","宿でのんびり過ごす,地元の美味しいものを食べる,テーマパーク:JUNGLIA,テーマパーク:その他",1,0,1,0,0,0,1,1,0,0,0,0,0,0,0,0,0,0,0,0,0,0,0,,小学生を含む家族(未就学児は含まない),,インターネット・アプリ,0,0,0,0,0,0,0,0,0,1,0,0,0,0,0,0,0,0,0,0,,レンタカー,0,1,0,0,0,0,0,0,,レンタカー,0,1,0,0,0,0,0,0,,満足,色々観光地を見れるから,3泊,"30,000円以上 40,000円未満","40,000円以上 50,000円未満","40,000円以上 50,000円未満","40,000円以上 50,000円未満",2-3回目,5年以上前,必ず来たい,3-5年後,満足,ジャングリア、名護パイナップルパークが良かった。,9,きれいな海,ある,安全な休憩場所があるといいです。,中部,その他,かりゆし水族館,なかやんばる(名護市・本部町・今帰仁村),沖縄美ら海水族館,,"30,000円以上 40,000円未満",満足,ジャングリアをお天気で楽しめた,名護イオンでお土産をたくさん買えた,9,海もジャングリアも水族館も楽しめた。,女性,1977,神奈川県,答えられない,今帰仁城跡エリア,今帰仁村,2026-02-27 21:00:52
6648,5979,3泊,"20,000円以上 30,000円未満","宿でのんびり過ごす,地元の美味しいものを食べる,名所、旧跡の観光",1,0,1,0,1,0,0,0,0,0,0,0,0,0,0,0,0,0,0,0,0,0,0,,親,,その他,0,0,0,0,0,0,0,0,0,0,0,0,0,0,0,0,0,0,0,1,自然が好きだから ,レンタカー,0,1,0,0,0,0,0,0,,レンタカー,0,1,0,0,0,0,0,0,,大変満足,やんばるエリアは散策ハイキング、大石林山、やんばるくいなの生息ラーニングセンターなど施設が離れていることが多いので、車移動で時間を有効的に使いたいため,2泊,"100,000円以上 200,000円未満","5,000円以上 10,000円未満","20,000円以上 30,000円未満","10,000円以上 20,000円未満",6-10回目,半年-1年前,必ず来たい,半年-1年後,大変満足,やんばる国立公園の中に宿泊し、手付かずの自然を満喫、やんばるくいなの生息を学んだり、本物の沖縄らしい自然を体験できる。高級リゾートのような派手で大型施設がないのも魅力。ゆいゆい道の駅などローカル感に満ちたマーケットもお気に入り。,10,ヤンバルクイナ生態展示学習施設「クイナの森」がお気に入り。野生ではなかなか見られないヤンバルクイナを間近で観察でき、クー太はご飯時、観察時にこちらに近づいてくることもあり、とても可愛らしい姿を見られる。鳥の生態だけでなく、やんばるの森での保護活動や希少種の現状について展示と解説で知ることができる点も魅力。,ない,改善としては、コンビニや商業施設が少ないがこれは最終的には改善してほしくない点。,なかやんばる(名護市・本部町・今帰仁村),今帰仁城跡,,南部,平和祈念公園,,"100,000円以上",大変満足,ヴィラのプライベート感、ラウンジアクセスで夜の時間を楽しんだり、朝食バフェを楽しむのも満足度の一部。何よりスタッフ皆さんのサービスや温かさがまた戻りたいなーと思えるのもポイントです。,"やんばるの自然とリラックスを主役にしたリゾート、静かなビーチ、緑豊かな環境。
郷土料理のおかめもリーズナブルで以前にはなかった沖縄そばなどもあり、商業施設の少ないエリアのためとても便利。ラウンジアクセスがあったとしても、おかめでディナーを手軽に食べてから、7時半以降にラウンジに行くのが理想。
売店は、地元の特産品、沖縄らしいお土産類が揃っている。特にオクマロゴのバック類が可愛い。やんばるローカルのやんばるくいなや動物をデザインした小さいミニトートは大のお気に入り。
",10,やんばるの自然とリラックスを主役にしたリゾート、静かなビーチ、緑豊かな環境。,女性,1970,埼玉県,800-1000万円未満,道の駅ゆいゆい国頭エリア,国頭村,2026-02-27 21:33:36
