4567,4088,4泊,使わない,"テーマパーク:沖縄美ら海水族館,買い物、アウトレット,お祭りやイベントへの参加・見物",0,0,0,0,0,1,0,0,1,1,0,0,0,0,0,0,0,0,0,0,0,0,0,,パートナー(恋人・夫婦など),,"インターネット・アプリ,YouTube,友人・知人",0,0,0,0,0,0,0,0,0,1,1,0,0,0,0,1,0,0,0,0,,自家用車,1,0,0,0,0,0,0,0,,自家用車,1,0,0,0,0,0,0,0,,,,やんばるエリアには宿泊しない,使わない,使わない,"5,000円未満","10,000円以上 20,000円未満",11回目以上,半年-1年前,必ず来たい,半年-1年後,満足,,10,,ない,,なかやんばる(名護市・本部町・今帰仁村),沖縄美ら海水族館,,中部,その他,,"5,000円未満",大変満足,,,10,,男性,1964,兵庫県,300-400万円未満,嵐山エリア,名護市,2026-01-17 13:18:42
4568,4089,日帰り,"5,000円以上 10,000円未満","地元の美味しいものを食べる,地域の行事,まちあるき・集落散策",0,0,1,0,0,0,0,0,0,0,1,0,0,0,0,0,1,0,0,0,0,0,0,,パートナー(恋人・夫婦など),,"観光展・物産展,観光協会・空港・道の駅等の案内所",1,0,0,0,0,0,0,0,0,0,0,0,0,0,0,0,1,0,0,0,,自家用車,1,0,0,0,0,0,0,0,,自家用車,1,0,0,0,0,0,0,0,,,,やんばるエリアには宿泊しない,"5,000円以上 10,000円未満","5,000円以上 10,000円未満","5,000円以上 10,000円未満",使わない,11回目以上,半年以内,必ず来たい,半年以内,満足,"道の駅めぐりと街の散策、
地元の農産物を食べたりと楽しんでます。",8,道の駅は各エリア特色があって誰でも楽しめると思います。,ある,交通の利便性はイマイチですね,門口(じょうぐち)やんばる(金武町・宜野座村・恩納村),万座毛,,うふやんばる(国頭村・大宜味村・東村),塩屋湾,,"5,000円以上 10,000円未満",満足,キッズエリアや販売コーナーが充実していました。,小さい子連れの人は特に楽しめるかと思います。,8,,男性,1983,沖縄県,400-600万円未満,道の駅ぎのざエリア,宜野座村,2026-01-17 13:44:27
4570,4090,1泊,"5,000円未満",テーマパーク:その他,0,0,0,0,0,0,0,1,0,0,0,0,0,0,0,0,0,0,0,0,0,0,0,,小学生を含む家族(未就学児は含まない),,新聞・雑誌・ガイドブック,0,1,0,0,0,0,0,0,0,0,0,0,0,0,0,0,0,0,0,0,,自家用車,1,0,0,0,0,0,0,0,,自家用車,1,0,0,0,0,0,0,0,,,,やんばるエリアには宿泊しない,使わない,"5,000円以上 10,000円未満","5,000円以上 10,000円未満","5,000円未満",4-5回目,半年-1年前,必ず来たい,半年以内,大変満足,楽しかったから,10,"色んな動物がいて見たことの無いのもいたから
",ない,,特になし,,,なかやんばる(名護市・本部町・今帰仁村),その他,ホテル,"5,000円未満",大変満足,楽しかった,お土産が色んなのあった,10,入口の鳥,無回答,2013,沖縄県,答えられない,嵐山エリア,名護市,2026-01-17 13:57:40
4571,4091,7泊以上,"30,000円以上 40,000円未満","宿でのんびり過ごす,リゾートホテルを楽しむ,テーマパーク:沖縄美ら海水族館",1,1,0,0,0,1,0,0,0,0,0,0,0,0,0,0,0,0,0,0,0,0,0,,パートナー(恋人・夫婦など),,"Google map,インターネット・アプリ,Instagram",0,0,0,0,0,0,0,0,1,1,0,0,1,0,0,0,0,0,0,0,,レンタカー,0,1,0,0,0,0,0,0,,レンタカー,0,1,0,0,0,0,0,0,,満足,道が空いていて、どこの施設も基本無料駐車場を完備してくれているため。,4泊,"50,000円以上 100,000円未満","10,000円以上 20,000円未満","30,000円以上 40,000円未満","10,000円以上 20,000円未満",2-3回目,5年以上前,必ず来たい,1-3年後,大変満足,御菓子御殿にて、紅いもタルト体験を出来て楽しかった。普段お土産でもらっているものを実際自分で作るのは、非日常体験で沖縄ならではの体験となったため。,10,HIYORIオーシャンリゾートというホテルがかなりよかった。口コミが高くて、実際の宿泊もかなり手厚いサービスがあり充実した旅行となったため。,ない,,門口(じょうぐち)やんばる(金武町・宜野座村・恩納村),万座毛,,門口(じょうぐち)やんばる(金武町・宜野座村・恩納村),その他,ホテルでの屋内プール,"5,000円以上 10,000円未満",大変満足,海の見える席があって、ケーキを買って食べれるのがよかった。生ケーキがあることを知らなかったので、もっとPRしてほしいと感じた。,,10,駐車場も広く、2階に素敵なご飯屋さんがあった。紅いもタルト作りも予約をしておけば、のんびり参加できてとても楽しかった。実際芋を絞って作るのは難しく、良い経験になった。,女性,1993,東京都,800-1000万円未満,万座毛エリア,恩納村,2026-01-17 13:58:35
4572,4092,4泊,"20,000円以上 30,000円未満","宿でのんびり過ごす,リゾートホテルを楽しむ,地元の美味しいものを食べる,名所、旧跡の観光,テーマパーク:沖縄美ら海水族館,ドライブ・ツーリング",1,1,1,0,1,1,0,0,0,0,0,0,0,0,0,0,0,0,0,1,0,0,0,,パートナー(恋人・夫婦など),,"観光展・物産展,新聞・雑誌・ガイドブック,観光パンフレット・ポスター,美ら海水族館等の観光関連事業者HP,宿泊事業者のHP,Twitter,Instagram",1,1,0,1,0,1,1,0,0,0,0,1,1,0,0,0,0,0,0,0,,レンタカー,0,1,0,0,0,0,0,0,,"レンタカー,徒歩",0,1,0,0,0,1,0,0,,満足,道が広く運転しやすい,3泊,"200,000円以上","50,000円以上 100,000円未満","20,000円以上 30,000円未満","10,000円以上 20,000円未満",2-3回目,5年以上前,必ず来たい,半年-1年後,大変満足,海が綺麗で心が洗われた気がした。,10,海をなんとなく眺める,ある,やんばるエリアに限った話ではないのかもしれないが地元住民の方の運転がフラフラしてる人を度々見かけ怖かった。,門口(じょうぐち)やんばる(金武町・宜野座村・恩納村),万座毛,,なかやんばる(名護市・本部町・今帰仁村),沖縄美ら海水族館,,"5,000円未満",大変満足,お菓子作り体験をしたのだが、難してくていい経験になった。,ぜひ今後も続けてほしい,10,お菓子作り体験を,男性,1997,東京都,600-800万円未満,万座毛エリア,恩納村,2026-01-17 14:05:16
4573,4093,日帰り,"5,000円未満","地元の美味しいものを食べる,ドライブ・ツーリング",0,0,1,0,0,0,0,0,0,0,0,0,0,0,0,0,0,0,0,1,0,0,0,,パートナー(恋人・夫婦など),,"Google map,YouTube,Instagram,Facebook",0,0,0,0,0,0,0,0,1,0,1,0,1,1,0,0,0,0,0,0,,自家用車,1,0,0,0,0,0,0,0,,自家用車,1,0,0,0,0,0,0,0,,,,やんばるエリアには宿泊しない,使わない,"5,000円未満","5,000円未満","5,000円未満",11回目以上,半年以内,必ず来たい,半年以内,大変満足,自然もグルメもありいつ来ても楽しい。,10,美味しいものもたくさんある。車で走りやすい。,ない,,中部,その他,道の駅喜名番所,うふやんばる(国頭村・大宜味村・東村),その他,サンライズひがし,"5,000円未満",大変満足,クレープ美味しかった,以前にあったイチゴのオムレットがまた食べたい,10,子どもも楽しめそう。,女性,1987,沖縄県,1000-1200万円未満,道の駅ぎのざエリア,宜野座村,2026-01-17 14:07:35
4574,4094,2泊,"5,000円以上 10,000円未満","リゾートホテルを楽しむ,地元の美味しいものを食べる,花見などの自然鑑賞,名所、旧跡の観光,テーマパーク:沖縄美ら海水族館",0,1,1,1,1,1,0,0,0,0,0,0,0,0,0,0,0,0,0,0,0,0,0,,パートナー(恋人・夫婦など),,"観光協会のHP,美ら海水族館等の観光関連事業者HP,宿泊事業者のHP,Google map,ブログ",0,0,0,0,1,1,1,0,1,0,0,0,0,0,1,0,0,0,0,0,,路線バス、高速バス、シャトルバス,0,0,0,0,0,1,0,0,,路線バス,0,0,0,0,1,0,0,0,,大変満足,海の色や、初めて見る植物などを見る体験が楽しかった。水族館は美ら海水族館が海洋生物の保全に力を入れていることがわかり、そのような個体を探すのもわくわくしました。,1泊,"20,000円以上 30,000円未満","5,000円以上 10,000円未満","20,000円以上 30,000円未満","20,000円以上 30,000円未満",初めて,,必ず来たい,半年-1年後,大変満足,初めて見る自然がとても素晴らしく、人生でまだ見ないことを体験する大切さを学びました。,10,とにかく行って自分で感じて欲しいと力説したいです。,ある,バスの利用などはあらかじめよく調べないといけないことが多かった。交通会社に直接電話をして聞いて、イメージがつかめた。,門口(じょうぐち)やんばる(金武町・宜野座村・恩納村),金武観音寺,,特になし,特に無し,,"10,000円以上 20,000円未満",大変満足,島の気候がわかる自然が良かった。,特にありません。,8,,女性,1967,徳島県,600-800万円未満,海洋博公園・観光拠点エリア,本部町,2026-01-17 14:19:35
4575,4095,1泊,"5,000円以上 10,000円未満","宿でのんびり過ごす,リゾートホテルを楽しむ,テーマパーク:沖縄美ら海水族館",1,1,0,0,0,1,0,0,0,0,0,0,0,0,0,0,0,0,0,0,0,0,0,,中学生以上を含む家族(小学生以下は含まない),,"美ら海水族館等の観光関連事業者HP,宿泊事業者のHP",0,0,0,0,0,1,1,0,0,0,0,0,0,0,0,0,0,0,0,0,,自家用車,1,0,0,0,0,0,0,0,,"自家用車,徒歩",1,0,0,0,0,1,0,0,,,,1泊,"5,000円以上 10,000円未満","5,000円以上 10,000円未満","5,000円以上 10,000円未満","5,000円未満",4-5回目,半年以内,必ず来たい,半年以内,大変満足,宿泊したホテルも自然を感じられて日常の息抜きにとても良かった。,10,やんばるの生きものや貝などの展示物が綺麗で見やすくて良かったです。,ない,,なかやんばる(名護市・本部町・今帰仁村),古宇利島(オーシャンタワー/ハートロック),,中部,その他,許田道の駅,"5,000円未満",大変満足,バーガーがボリューミーで美味しかった。また、食べるスペースも広くてくつろぐことができた。,沖縄そばがあるとちょっと嬉しい。あと、果物もあると嬉しい。,10,バーガー,女性,2001,沖縄県,1000-1200万円未満,今帰仁の駅そーれエリア,今帰仁村,2026-01-17 14:24:11
4576,4096,2泊,"5,000円以上 10,000円未満","地元の美味しいものを食べる,名所、旧跡の観光,お祭りやイベントへの参加・見物,地域の行事,アウトドア:ビーチ・海水浴,まちあるき・集落散策,各種体験(手作り、果物狩りなど)",0,0,1,0,1,0,0,0,0,1,1,0,1,0,0,0,1,1,0,0,0,0,0,,小学生を含む家族(未就学児は含まない),,"観光展・物産展,新聞・雑誌・ガイドブック,観光パンフレット・ポスター,観光協会のHP,Instagram,観光協会・空港・道の駅等の案内所",1,1,0,1,1,0,0,0,0,0,0,0,1,0,0,0,1,0,0,0,,自家用車,1,0,0,0,0,0,0,0,,自家用車,1,0,0,0,0,0,0,0,,,,やんばるエリアには宿泊しない,"10,000円以上 20,000円未満","10,000円以上 20,000円未満","5,000円以上 10,000円未満","5,000円以上 10,000円未満",6-10回目,半年以内,必ず来たい,半年以内,大変満足,"大宜味村産業まつりから芭蕉布会館、喜如嘉旧小学校へ行きました。芭蕉布について小4の子供が社会科で習い詳しく知りたいといい訪問させていただきました。見学もでき、実際に芭蕉布に触れて、お土産も買い詳しく知ることができました。
親は、まるたのファンなので、芭蕉布の工程に泡盛が使われているのも衝撃的でした！
また、今後も芭蕉布の機織りや藍染の機会などがありましたら体験に来たいです。",10,"昔から残る工程を大切にしていて、その伝統に現地で触れられる点。
独特な動植物に魅力がある点。",ある,"喜如嘉小学校や芭蕉布会館は、カフェが利用できたら一番ですが、一番上にあったりなので、、
駐車場から近い位置に施設外にお茶やアイスなど自販機を置き、自由に休憩できるイスあったら嬉しいです。
",うふやんばる(国頭村・大宜味村・東村),その他,芭蕉布会館,うふやんばる(国頭村・大宜味村・東村),その他,道の駅やんばる,"5,000円未満",大変満足,ハンモッグもあり、自然環境がよく、案内などもおしゃれで凝っていた。,"以前は体験のイベントに参加しましたが、普段からも本屋、カフェと活気があることもっと知れる良いと思いました。
駐車場は、運動場にとめてよいかダメなのかわからず一回入ってしまいました。
ハンモッグは不在でしたので、自由に使っていいか分からなかったので見るだけでしたが子は使いたい様子でした。
カフェへ行く際の、登り2回目の階段右側で子供が上方不注意で頭を打ってしまったので、他に打つ方が出ないことを祈ります。
お土産は芭蕉布の小物がたくさんあり、紅型と芭蕉布のコラボ作品も見られて大満足でした。",10,"cafeの雰囲気がよいです。
ショップの扱う商品も幅広く良かったです。
廃校ですが、おしゃれなお店が並び楽しめるのでもっとやんばるのホットスポットとして、親子やカップルで立ち寄る方が増えて欲しいと感じました。",女性,1990,沖縄県,400-600万円未満,芭蕉布会館エリア,大宜味村,2026-01-17 14:24:53
4577,4097,2泊,"5,000円以上 10,000円未満","宿でのんびり過ごす,地元の美味しいものを食べる,アウトドア:マリンスポーツ",1,0,1,0,0,0,0,0,0,0,0,0,0,1,0,0,0,0,0,0,0,0,0,,パートナー(恋人・夫婦など),,インターネット・アプリ,0,0,0,0,0,0,0,0,0,1,0,0,0,0,0,0,0,0,0,0,,レンタカー,0,1,0,0,0,0,0,0,,レンタカー,0,1,0,0,0,0,0,0,,満足,,1泊,"10,000円以上 20,000円未満","5,000円以上 10,000円未満","5,000円以上 10,000円未満","5,000円未満",初めて,,必ず来たい,半年-1年後,満足,"ホエールウォッチングが見れた
",7,ホエールウォッチング,ない,,なかやんばる(名護市・本部町・今帰仁村),その他,ホエールウォッチング,南部,国際通り,,"5,000円未満",満足,,,6,,男性,1984,千葉県,1000-1200万円未満,道の駅ぎのざエリア,宜野座村,2026-01-17 14:47:44
4578,4098,2泊,"10,000円以上 20,000円未満","アウトドア:マリンスポーツ,ドライブ・ツーリング",0,0,0,0,0,0,0,0,0,0,0,0,0,1,0,0,0,0,0,1,0,0,0,,パートナー(恋人・夫婦など),,YouTube,0,0,0,0,0,0,0,0,0,0,1,0,0,0,0,0,0,0,0,0,,レンタカー,0,1,0,0,0,0,0,0,,レンタカー,0,1,0,0,0,0,0,0,,大変満足,,1泊,"10,000円以上 20,000円未満","5,000円以上 10,000円未満","20,000円以上 30,000円未満","5,000円以上 10,000円未満",2-3回目,5年以上前,必ず来たい,半年-1年後,大変満足,"海がきれいで飛行機の便が多く行きやすい。
自然もたくさんあって良い。
",10,"ホエールウォッチング。
至近距離でホエールウォッチングができて、街も発展してしていて観光におすすめだから。",ない,,なかやんばる(名護市・本部町・今帰仁村),その他,ホエールウォッチングツアー,南部,国際通り,,"5,000円未満",満足,コーヒーが美味しかった。,お土産がたくさんあって楽しかった。,10,眠気ざましに飲んだコーヒーが美味しかった。,女性,1988,千葉県,1000-1200万円未満,道の駅ぎのざエリア,宜野座村,2026-01-17 14:48:20
4579,4099,日帰り,"5,000円未満",まちあるき・集落散策,0,0,0,0,0,0,0,0,0,0,0,0,0,0,0,0,1,0,0,0,0,0,0,,自分ひとり,,インターネット・アプリ,0,0,0,0,0,0,0,0,0,1,0,0,0,0,0,0,0,0,0,0,,その他,0,0,0,0,0,0,0,1,高速船,"路線バス,徒歩",0,0,0,0,1,1,0,0,,やや満足,,やんばるエリアには宿泊しない,"5,000円未満",使わない,"5,000円未満","5,000円未満",11回目以上,5年以上前,何とも言えない,3-5年後,普通,,5,,ない,,特になし,特に無し,,特になし,特に無し,,使わない,やや不満,,,3,,男性,1965,沖縄県,400-600万円未満,名護市街エリア,名護市,2026-01-17 14:51:27
4580,4100,3泊,"50,000円以上 100,000円未満","リゾートホテルを楽しむ,名所、旧跡の観光,テーマパーク:沖縄美ら海水族館,テーマパーク:JUNGLIA,ドライブ・ツーリング",0,1,0,0,1,1,1,0,0,0,0,0,0,0,0,0,0,0,0,1,0,0,0,,パートナー(恋人・夫婦など),,"観光協会のHP,美ら海水族館等の観光関連事業者HP,宿泊事業者のHP,Google map,YouTube",0,0,0,0,1,1,1,0,1,0,1,0,0,0,0,0,0,0,0,0,,レンタカー,0,1,0,0,0,0,0,0,,レンタカー,0,1,0,0,0,0,0,0,,大変満足,"高速道路もあり、国道や県道も整備されており大変走りやすい。
レンタカーは那覇で借りたが、台数に余裕があり、苦労はなかった。
山原地域は、ホテルの送迎などはあるが、車が無いと移動は不便だと思う。車があればいろんな観光地にいけて大変便利だと思う。",3泊,"50,000円以上 100,000円未満","50,000円以上 100,000円未満","30,000円以上 40,000円未満","30,000円以上 40,000円未満",2-3回目,5年以上前,必ず来たい,半年-1年後,大変満足,宿泊したホテル（オクマリゾート）のロケーションやシチュエーションが大変良かった。,10,毎日働くだけの日常から離れた体験ができるので、是非、一度は訪れてほしいエリアであるから。,ある,観光客が使える地域通貨などのサービス。,南部,首里城公園,,なかやんばる(名護市・本部町・今帰仁村),JUNGLIA,,"50,000円以上 100,000円未満",大変満足,ロケーションとシュツエーションが大変良いから。,満足。,10,働くだけの日常から離れて、非日常的生活ができるから。,男性,1970,三重県,800-1000万円未満,道の駅ゆいゆい国頭エリア,国頭村,2026-01-17 14:59:59
4581,4101,4泊,"5,000円未満","宿でのんびり過ごす,リゾートホテルを楽しむ,地元の美味しいものを食べる,花見などの自然鑑賞,名所、旧跡の観光,テーマパーク:沖縄美ら海水族館,買い物、アウトレット,地域の行事,まちあるき・集落散策,ドライブ・ツーリング",1,1,1,1,1,1,0,0,1,0,1,0,0,0,0,0,1,0,0,1,0,0,0,,パートナー(恋人・夫婦など),,"YouTube,Instagram,宿泊施設",0,0,0,0,0,0,0,0,0,0,1,0,1,0,0,0,0,0,1,0,,レンタカー,0,1,0,0,0,0,0,0,,レンタカー,0,1,0,0,0,0,0,0,,大変満足,,4泊,"50,000円以上 100,000円未満","5,000円未満","5,000円以上 10,000円未満","5,000円以上 10,000円未満",11回目以上,半年以内,必ず来たい,半年-1年後,大変満足,,10,,ない,,うふやんばる(国頭村・大宜味村・東村),辺戸岬,,うふやんばる(国頭村・大宜味村・東村),その他,オクマプライベートビーチ,使わない,大変満足,,,10,,女性,1973,東京都,答えられない,道の駅ゆいゆい国頭エリア,国頭村,2026-01-17 15:12:45
4582,4102,1泊,"5,000円以上 10,000円未満","宿でのんびり過ごす,リゾートホテルを楽しむ,テーマパーク:沖縄美ら海水族館",1,1,0,0,0,1,0,0,0,0,0,0,0,0,0,0,0,0,0,0,0,0,0,,中学生以上を含む家族(小学生以下は含まない),,美ら海水族館等の観光関連事業者HP,0,0,0,0,0,1,0,0,0,0,0,0,0,0,0,0,0,0,0,0,,自家用車,1,0,0,0,0,0,0,0,,自家用車,1,0,0,0,0,0,0,0,,,,1泊,"10,000円以上 20,000円未満","5,000円以上 10,000円未満","10,000円以上 20,000円未満","5,000円未満",4-5回目,半年以内,必ず来たい,半年以内,大変満足,自然を感じられて良かった。また、施設やトイレが綺麗でとっても良かった。,10,古宇利島。サイクリングもできて自然を感じられた。,ない,,なかやんばる(名護市・本部町・今帰仁村),古宇利島(オーシャンタワー/ハートロック),,中部,その他,キングタコス,"5,000円未満",大変満足,沖縄そばが美味しかった。,とても満足したが、お土産品店は通路が狭いためゆっくり見れない感じがした。,10,,女性,2001,沖縄県,1000-1200万円未満,道の駅許田エリア,名護市,2026-01-17 15:17:24
4583,4103,7泊以上,"20,000円以上 30,000円未満","地元の美味しいものを食べる,花見などの自然鑑賞,テーマパーク:沖縄美ら海水族館,アウトドア:ビーチ・海水浴",0,0,1,1,0,1,0,0,0,0,0,0,1,0,0,0,0,0,0,0,0,0,0,,友人,,"Google map,Instagram",0,0,0,0,0,0,0,0,1,0,0,0,1,0,0,0,0,0,0,0,,レンタカー,0,1,0,0,0,0,0,0,,レンタカー,0,1,0,0,0,0,0,0,,満足,,やんばるエリアには宿泊しない,"5,000円以上 10,000円未満","5,000円未満","5,000円以上 10,000円未満",使わない,4-5回目,半年以内,来たい,半年-1年後,満足,沖縄らしい自然の多さ、綺麗で鮮やかな花、景色も綺麗で、やんばるエリア大好きです！！,10,"大自然を堪能して欲しいです！
アクティビティーも今度はしたい！",ない,,南部,国際通り,,なかやんばる(名護市・本部町・今帰仁村),古宇利島(オーシャンタワー/ハートロック),,"5,000円未満",満足,"エビが美味しい！お店がかわいい！
友人にもお勧めします",メニューふやしてほしいです！,10,"エビが美味しいから！
そしてお店が可愛い！",女性,1988,大阪府,2000万円以上,屋我地エリア,名護市,2026-01-17 15:21:29
4584,4104,1泊,"10,000円以上 20,000円未満","地元の美味しいものを食べる,テーマパーク:その他",0,0,1,0,0,0,0,1,0,0,0,0,0,0,0,0,0,0,0,0,0,0,0,,パートナー(恋人・夫婦など),,"新聞・雑誌・ガイドブック,宿泊事業者のHP,YouTube",0,1,0,0,0,0,1,0,0,0,1,0,0,0,0,0,0,0,0,0,,レンタカー,0,1,0,0,0,0,0,0,,レンタカー,0,1,0,0,0,0,0,0,,大変満足,自由に行動できるため,やんばるエリアには宿泊しない,"10,000円以上 20,000円未満","5,000円以上 10,000円未満","5,000円未満","5,000円未満",2-3回目,3-5年前,必ず来たい,1-3年後,大変満足,冬なので混雑も控えめだった,8,ネオパークオキナワ,ない,,なかやんばる(名護市・本部町・今帰仁村),その他,名護漁港食堂,,,リザンシーパーク谷茶ベイ,"5,000円以上 10,000円未満",大変満足,鳥が好きなので、ふれあいもできて楽しかった,,8,,女性,1983,神奈川県,1000-1200万円未満,嵐山エリア,名護市,2026-01-17 15:38:24
4585,4105,2泊,"5,000円未満","リゾートホテルを楽しむ,アウトドア:マリンスポーツ",0,1,0,0,0,0,0,0,0,0,0,0,0,1,0,0,0,0,0,0,0,0,0,,自分ひとり,,宿泊事業者のHP,0,0,0,0,0,0,1,0,0,0,0,0,0,0,0,0,0,0,0,0,,その他,0,0,0,0,0,0,0,1,ホテルバス,"徒歩,レンタサイクル",0,0,0,0,0,1,1,0,,普通,ポイントまでが遠い,2泊,"40,000円以上 50,000円未満","10,000円以上 20,000円未満","10,000円以上 20,000円未満","5,000円未満",6-10回目,1-3年前,必ず来たい,半年-1年後,やや不満,遠いのでぜひ電動自転車導入して欲しい,8,自然豊かですが、車がないと不便,ある,アクセス,南部,国際通り,,うふやんばる(国頭村・大宜味村・東村),その他,やんばるの森ツアー,"10,000円以上 20,000円未満",満足,いろんなアクティビティはあるが、現地まで自分で行かなくてはいけないものがある,満足,8,那覇から遠いが好きです,女性,1962,愛知県,1000-1200万円未満,道の駅ゆいゆい国頭エリア,国頭村,2026-01-17 15:38:59
4586,4106,1泊,"10,000円以上 20,000円未満","リゾートホテルを楽しむ,お祭りやイベントへの参加・見物,スポーツ観戦や芸能鑑賞(コンサート等)",0,1,0,0,0,0,0,0,0,1,0,1,0,0,0,0,0,0,0,0,0,0,0,,小学生を含む家族(未就学児は含まない),,"観光展・物産展,観光パンフレット・ポスター",1,0,0,1,0,0,0,0,0,0,0,0,0,0,0,0,0,0,0,0,,自家用車,1,0,0,0,0,0,0,0,,自家用車,1,0,0,0,0,0,0,0,,,,やんばるエリアには宿泊しない,使わない,"5,000円未満","5,000円未満",使わない,2-3回目,1-3年前,やや来たい,半年以内,普通,前回は、旅行初日に体調を崩しやんばるを楽しむ時間がなかった,4,やんばるの自然。ヤンバルクイナを見てほしい,ある,飲食店が少ない,特になし,特に無し,,特になし,特に無し,,"5,000円未満",普通,目的は、サーターアンダギーを食べに来た,子供も楽しめるイベントをしてほしい,5,道の駅は楽しい,女性,1983,沖縄県,400-600万円未満,おんなの駅エリア,恩納村,2026-01-17 15:45:29
