Synergy!ID,HistoryID,宿泊数(県内),交通費,訪問目的(やんばるエリア)_ALL,訪問目的(やんばるエリア)_宿でのんびり過ごす,訪問目的(やんばるエリア)_リゾートホテルを楽しむ,訪問目的(やんばるエリア)_地元の美味しいものを食べる,訪問目的(やんばるエリア)_花見などの自然鑑賞,訪問目的(やんばるエリア)_名所、旧跡の観光,訪問目的(やんばるエリア)_テーマパーク:沖縄美ら海水族館,訪問目的(やんばるエリア)_テーマパーク:JUNGLIA,訪問目的(やんばるエリア)_テーマパーク:その他,訪問目的(やんばるエリア)_買い物、アウトレット,訪問目的(やんばるエリア)_お祭りやイベントへの参加・見物,訪問目的(やんばるエリア)_地域の行事,訪問目的(やんばるエリア)_スポーツ観戦や芸能鑑賞(コンサート等),訪問目的(やんばるエリア)_アウトドア:ビーチ・海水浴,訪問目的(やんばるエリア)_アウトドア:マリンスポーツ,訪問目的(やんばるエリア)_アウトドア:登山・トレッキング,訪問目的(やんばるエリア)_アウトドア:キャンプ,訪問目的(やんばるエリア)_まちあるき・集落散策,訪問目的(やんばるエリア)_各種体験(手作り、果物狩りなど),訪問目的(やんばるエリア)_その他スポーツ(ゴルフ、テニスなど),訪問目的(やんばるエリア)_ドライブ・ツーリング,訪問目的(やんばるエリア)_友人・親戚を尋ねる,訪問目的(やんばるエリア)_出張など仕事関係,訪問目的(やんばるエリア)_その他,訪問目的(やんばるエリア)_その他_text,同行者(やんばるエリア),同行者(やんばるエリア)_その他_text,情報収集(やんばるエリア)_ALL,情報収集(やんばるエリア)_観光展・物産展,情報収集(やんばるエリア)_新聞・雑誌・ガイドブック,情報収集(やんばるエリア)_TV・ラジオ番組やCM,情報収集(やんばるエリア)_観光パンフレット・ポスター,情報収集(やんばるエリア)_観光協会のHP,情報収集(やんばるエリア)_美ら海水族館等の観光関連事業者HP,情報収集(やんばるエリア)_宿泊事業者のHP,情報収集(やんばるエリア)_Chat GPT等の生成AI,情報収集(やんばるエリア)_Google map,情報収集(やんばるエリア)_インターネット・アプリ,情報収集(やんばるエリア)_YouTube,情報収集(やんばるエリア)_Twitter,情報収集(やんばるエリア)_Instagram,情報収集(やんばるエリア)_Facebook,情報収集(やんばるエリア)_ブログ,情報収集(やんばるエリア)_友人・知人,情報収集(やんばるエリア)_観光協会・空港・道の駅等の案内所,情報収集(やんばるエリア)_タクシードライバーや地元の人,情報収集(やんばるエリア)_宿泊施設,情報収集(やんばるエリア)_その他,情報収集(やんばるエリア)_その他_text,やんばるエリアまでの交通手段_ALL,やんばるエリアまでの交通手段_自家用車,やんばるエリアまでの交通手段_レンタカー,やんばるエリアまでの交通手段_ヘリコプター,やんばるエリアまでの交通手段_旅行会社ツアーバス,やんばるエリアまでの交通手段_フェリー,やんばるエリアまでの交通手段_路線バス、高速バス、シャトルバス,やんばるエリアまでの交通手段_タクシー,やんばるエリアまでの交通手段_その他,やんばるエリアまでの交通手段_その他_text,やんばるエリア内での交通手段_ALL,やんばるエリア内での交通手段_自家用車,やんばるエリア内での交通手段_レンタカー,やんばるエリア内での交通手段_タクシー,やんばるエリア内での交通手段_旅行会社ツアーバス,やんばるエリア内での交通手段_路線バス,やんばるエリア内での交通手段_徒歩,やんばるエリア内での交通手段_レンタサイクル,やんばるエリア内での交通手段_その他,やんばるエリア内での交通手段_その他_text,やんばるエリア内での交通手段の満足度,やんばるエリア内での交通手段の満足度の理由,宿泊数(やんばるエリア),宿泊費(やんばるエリア),観光費(やんばるエリア),飲食費(やんばるエリア),土産費(やんばるエリア),訪問回数(やんばるエリア),前回訪問時期(やんばるエリア),今後の来訪意向(やんばるエリア),今後の来訪時期(やんばるエリア),体験・サービス満足度(やんばるエリア),体験・サービス満足度の理由(やんばるエリア),推奨度(やんばるエリア),推奨項目(やんばるエリア),改善点(やんばるエリア),改善点の内容(やんばるエリア),回答前に訪問したエリア(調査地),回答前に訪問した主な施設(調査地),回答前に訪問した主な施設・その他(調査地),回答後に訪問予定のエリア(調査地),回答後に訪問予定の主な施設(調査地),回答後に訪問予定の主な施設・その他(調査地),現地消費額(調査地),体験・サービス満足度(調査地),体験・サービス満足度の理由(調査地),施設に求めるもの(調査地),施設推奨度(調査地),施設推奨項目(調査地),性別,生年,都道府県,世帯年収,訪問地のエリア名,訪問地の市町村,回答日時
4539,4070,3泊,"20,000円以上 30,000円未満","花見などの自然鑑賞,テーマパーク:沖縄美ら海水族館,テーマパーク:JUNGLIA",0,0,0,1,0,1,1,0,0,0,0,0,0,0,0,0,0,0,0,0,0,0,0,,パートナー(恋人・夫婦など),,インターネット・アプリ,0,0,0,0,0,0,0,0,0,1,0,0,0,0,0,0,0,0,0,0,,レンタカー,0,1,0,0,0,0,0,0,,レンタカー,0,1,0,0,0,0,0,0,,大変満足,"自然が豊かで景色がとても良い
",3泊,"50,000円以上 100,000円未満","50,000円以上 100,000円未満","40,000円以上 50,000円未満","20,000円以上 30,000円未満",初めて,,必ず来たい,半年-1年後,大変満足,静かで自然が豊か、景色ぐ良い。,10,自然、景色、星空がとても良い。,ない,,うふやんばる(国頭村・大宜味村・東村),やんばる野生生物保護センター,,その他離島,特に無し,,"50,000円以上 100,000円未満",大変満足,マリンスポーツ等、アクティビティが充実している。,充分楽しむ事ができました。,10,マリンスポーツが充実している所,女性,1971,三重県,800-1000万円未満,道の駅ゆいゆい国頭エリア,国頭村,2026-01-17 8:56:24
4540,4071,6泊,"5,000円以上 10,000円未満","地元の美味しいものを食べる,花見などの自然鑑賞,テーマパーク:沖縄美ら海水族館,買い物、アウトレット,お祭りやイベントへの参加・見物,まちあるき・集落散策",0,0,1,1,0,1,0,0,1,1,0,0,0,0,0,0,1,0,0,0,0,0,0,,親,,"YouTube,友人・知人",0,0,0,0,0,0,0,0,0,0,1,0,0,0,0,1,0,0,0,0,,レンタカー,0,1,0,0,0,0,0,0,,レンタカー,0,1,0,0,0,0,0,0,,満足,,やんばるエリアには宿泊しない,使わない,"5,000円以上 10,000円未満","5,000円以上 10,000円未満","5,000円以上 10,000円未満",初めて,,来たい,1-3年後,満足,,8,,ない,,,,,,,,"5,000円以上 10,000円未満",満足,,,8,,女性,1993,愛知県,200-300万円未満,万座毛エリア,恩納村,2026-01-17 9:12:37
4541,4072,6泊,"5,000円以上 10,000円未満","地元の美味しいものを食べる,名所、旧跡の観光,テーマパーク:沖縄美ら海水族館,まちあるき・集落散策,ドライブ・ツーリング",0,0,1,0,1,1,0,0,0,0,0,0,0,0,0,0,1,0,0,1,0,0,0,,中学生以上を含む家族(小学生以下は含まない),,"Google map,YouTube,Instagram,Facebook",0,0,0,0,0,0,0,0,1,0,1,0,1,1,0,0,0,0,0,0,,レンタカー,0,1,0,0,0,0,0,0,,レンタカー,0,1,0,0,0,0,0,0,,大変満足,時間の制約なく自由に動ける,やんばるエリアには宿泊しない,使わない,"5,000円以上 10,000円未満","5,000円以上 10,000円未満","5,000円以上 10,000円未満",2-3回目,半年-1年前,必ず来たい,半年-1年後,大変満足,水族館や自然環境が素晴らしかった,10,海洋博公園　お金を使わずに楽しめる,ない,,なかやんばる(名護市・本部町・今帰仁村),沖縄美ら海水族館,,なかやんばる(名護市・本部町・今帰仁村),その他,オリオンビール,"5,000円未満",満足,,,10,,男性,1971,三重県,300-400万円未満,万座毛エリア,恩納村,2026-01-17 9:14:08
4542,4073,6泊,"5,000円以上 10,000円未満","地元の美味しいものを食べる,花見などの自然鑑賞,名所、旧跡の観光,テーマパーク:沖縄美ら海水族館,買い物、アウトレット,各種体験(手作り、果物狩りなど)",0,0,1,1,1,1,0,0,1,0,0,0,0,0,0,0,0,1,0,0,0,0,0,,未就学児を含む家族,,"観光協会のHP,美ら海水族館等の観光関連事業者HP,Google map,YouTube",0,0,0,0,1,1,0,0,1,0,1,0,0,0,0,0,0,0,0,0,,レンタカー,0,1,0,0,0,0,0,0,,レンタカー,0,1,0,0,0,0,0,0,,満足,,やんばるエリアには宿泊しない,"5,000円以上 10,000円未満","5,000円以上 10,000円未満","5,000円以上 10,000円未満","5,000円以上 10,000円未満",2-3回目,1-3年前,必ず来たい,1-3年後,満足,水族館も含め美ら海公園　すごく良かったです。やんばる市場もとても良かったです。,9,やんばる市場,ある,道路渋滞,うふやんばる(国頭村・大宜味村・東村),辺戸岬,,なかやんばる(名護市・本部町・今帰仁村),古宇利島(オーシャンタワー/ハートロック),,"5,000円以上 10,000円未満",満足,,,8,美ら海公園とやんばる市場,女性,1972,三重県,100万円未満,万座毛エリア,恩納村,2026-01-17 9:17:04
4543,4074,3泊,"5,000円以上 10,000円未満","宿でのんびり過ごす,リゾートホテルを楽しむ,アウトドア:マリンスポーツ",1,1,0,0,0,0,0,0,0,0,0,0,0,1,0,0,0,0,0,0,0,0,0,,親,,Instagram,0,0,0,0,0,0,0,0,0,0,0,0,1,0,0,0,0,0,0,0,,レンタカー,0,1,0,0,0,0,0,0,,レンタカー,0,1,0,0,0,0,0,0,,大変満足,小回りが利くのでよかった,2泊,"10,000円以上 20,000円未満","5,000円以上 10,000円未満","5,000円以上 10,000円未満","5,000円以上 10,000円未満",11回目以上,半年以内,必ず来たい,半年以内,満足,自然のなかでヨガ体験など手軽にできるアクティビティがあればいいと思います,10,自然、海、山の景色と空気、人の温かさ,ない,,なかやんばる(名護市・本部町・今帰仁村),その他,パンチョリーナ,なかやんばる(名護市・本部町・今帰仁村),その他,古宇利島ドライブ,"5,000円未満",満足,沖縄のものが集まっている,宿泊、体験の値段設定がやや高め,8,ヤンバル工芸をおすすめしたい,女性,1971,和歌山県,600-800万円未満,芭蕉布会館エリア,大宜味村,2026-01-17 9:43:22
4544,4075,4泊,"5,000円以上 10,000円未満","名所、旧跡の観光,テーマパーク:沖縄美ら海水族館",0,0,0,0,1,1,0,0,0,0,0,0,0,0,0,0,0,0,0,0,0,0,0,,自分ひとり,,観光協会のHP,0,0,0,0,1,0,0,0,0,0,0,0,0,0,0,0,0,0,0,0,,路線バス、高速バス、シャトルバス,0,0,0,0,0,1,0,0,,旅行会社ツアーバス,0,0,0,1,0,0,0,0,,満足,,やんばるエリアには宿泊しない,使わない,"5,000円未満","5,000円未満",使わない,初めて,,来たい,3-5年後,満足,,7,,ない,,特になし,特に無し,,特になし,特に無し,,使わない,満足,,,7,,男性,1996,東京都,400-600万円未満,万座毛エリア,恩納村,2026-01-17 9:55:26
4550,4076,3泊,"5,000円以上 10,000円未満","リゾートホテルを楽しむ,アウトドア:ビーチ・海水浴,アウトドア:マリンスポーツ,アウトドア:登山・トレッキング,まちあるき・集落散策",0,1,0,0,0,0,0,0,0,0,0,0,1,1,1,0,1,0,0,0,0,0,0,,親,,"観光展・物産展,Instagram",1,0,0,0,0,0,0,0,0,0,0,0,1,0,0,0,0,0,0,0,,レンタカー,0,1,0,0,0,0,0,0,,レンタカー,0,1,0,0,0,0,0,0,,大変満足,小回りが利く,2泊,"10,000円以上 20,000円未満",使わない,"5,000円以上 10,000円未満","5,000円以上 10,000円未満",11回目以上,半年以内,必ず来たい,半年以内,大変満足,あたたかいもてなし,8,大自然。癒される。,ない,,特になし,特に無し,,なかやんばる(名護市・本部町・今帰仁村),その他,JA　道の駅,"5,000円以上 10,000円未満",大変満足,敷地の広さ　おもてなし,夏は何といってもビーチです！サイコー,10,"帰ってきた感じの雰囲気
敷地の広さ",女性,1971,和歌山県,600-800万円未満,道の駅ゆいゆい国頭エリア,国頭村,2026-01-17 10:21:26
4551,4077,2泊,"50,000円以上 100,000円未満","リゾートホテルを楽しむ,アウトドア:ビーチ・海水浴,アウトドア:マリンスポーツ,ドライブ・ツーリング",0,1,0,0,0,0,0,0,0,0,0,0,1,1,0,0,0,0,0,1,0,0,0,,パートナー(恋人・夫婦など),,"観光展・物産展,インターネット・アプリ,YouTube,Instagram,観光協会・空港・道の駅等の案内所",1,0,0,0,0,0,0,0,0,1,1,0,1,0,0,0,1,0,0,0,,レンタカー,0,1,0,0,0,0,0,0,,レンタカー,0,1,0,0,0,0,0,0,,満足,交通手段がすくない,2泊,"50,000円以上 100,000円未満","5,000円以上 10,000円未満","10,000円以上 20,000円未満","5,000円未満",6-10回目,半年以内,必ず来たい,半年以内,満足,季節によって楽しめる,7,,ない,,うふやんばる(国頭村・大宜味村・東村),その他,オオシッタイ,うふやんばる(国頭村・大宜味村・東村),その他,東村,"5,000円未満",普通,当日申し込みしにくそう,カヤック,5,マングローブ林,女性,1963,大阪府,800-1000万円未満,有銘・慶佐次・平良エリア,東村,2026-01-17 10:34:52
4553,4078,2泊,"10,000円以上 20,000円未満","リゾートホテルを楽しむ,地元の美味しいものを食べる,買い物、アウトレット,アウトドア:マリンスポーツ,各種体験(手作り、果物狩りなど)",0,1,1,0,0,0,0,0,1,0,0,0,0,1,0,0,0,1,0,0,0,0,0,,パートナー(恋人・夫婦など),,TV・ラジオ番組やCM,0,0,1,0,0,0,0,0,0,0,0,0,0,0,0,0,0,0,0,0,,レンタカー,0,1,0,0,0,0,0,0,,レンタカー,0,1,0,0,0,0,0,0,,大変満足,,1泊,"10,000円以上 20,000円未満","10,000円以上 20,000円未満","5,000円以上 10,000円未満","5,000円以上 10,000円未満",初めて,,必ず来たい,半年以内,大変満足,,10,,ない,,中部,美浜アメリカンビレッジ,,うふやんばる(国頭村・大宜味村・東村),やんばる野生生物保護センター,,"5,000円未満",大変満足,,,10,,男性,1999,愛知県,300-400万円未満,おんなの駅エリア,恩納村,2026-01-17 10:49:55
4554,4079,日帰り,"5,000円以上 10,000円未満","地元の美味しいものを食べる,名所、旧跡の観光,買い物、アウトレット,アウトドア:キャンプ",0,0,1,0,1,0,0,0,1,0,0,0,0,0,0,1,0,0,0,0,0,0,0,,パートナー(恋人・夫婦など),,"観光パンフレット・ポスター,YouTube,観光協会・空港・道の駅等の案内所",0,0,0,1,0,0,0,0,0,0,1,0,0,0,0,0,1,0,0,0,,自家用車,1,0,0,0,0,0,0,0,,自家用車,1,0,0,0,0,0,0,0,,,,やんばるエリアには宿泊しない,"10,000円以上 20,000円未満","10,000円以上 20,000円未満","5,000円以上 10,000円未満","10,000円以上 20,000円未満",11回目以上,半年以内,必ず来たい,半年以内,満足,地元のはちみつが美味しくまた手に入れたい。就労支援にも賛同しています。,9,自然や観光が豊富で、食べ物も美味しい店が多いため。,ある,夕方以降空いてる店が少ない,中部,美浜アメリカンビレッジ,,なかやんばる(名護市・本部町・今帰仁村),その他,ホテルランチ,"5,000円以上 10,000円未満",満足,店が豊富で、野菜も買える,オリジナルステッカー等の、ここでしか手にはいらないコアコンピタンス商品,9,楽しんで過ごせ、サーターアンダギーやかき氷が特にお勧めですね!,男性,1976,沖縄県,200-300万円未満,おんなの駅エリア,恩納村,2026-01-17 11:17:51
4556,4080,日帰り,"5,000円未満","地元の美味しいものを食べる,名所、旧跡の観光,ドライブ・ツーリング",0,0,1,0,1,0,0,0,0,0,0,0,0,0,0,0,0,0,0,1,0,0,0,,友人,,"Chat GPT等の生成AI,Google map,インターネット・アプリ",0,0,0,0,0,0,0,1,1,1,0,0,0,0,0,0,0,0,0,0,,自家用車,1,0,0,0,0,0,0,0,,自家用車,1,0,0,0,0,0,0,0,,,,やんばるエリアには宿泊しない,"5,000円未満","5,000円未満","5,000円未満","5,000円以上 10,000円未満",11回目以上,半年以内,必ず来たい,半年以内,大変満足,お土産たくさんあるね！,10,海と特産物,ない,,うふやんばる(国頭村・大宜味村・東村),その他,産業まつり,うふやんばる(国頭村・大宜味村・東村),アスムイハイクス,,"5,000円未満",大変満足,リーズナブルで美味しい,不満は特になし,10,お魚の食事,男性,1977,沖縄県,400-600万円未満,道の駅ゆいゆい国頭エリア,国頭村,2026-01-17 11:53:44
4557,4081,3泊,"5,000円以上 10,000円未満","宿でのんびり過ごす,地元の美味しいものを食べる,花見などの自然鑑賞,名所、旧跡の観光,まちあるき・集落散策,ドライブ・ツーリング",1,0,1,1,1,0,0,0,0,0,0,0,0,0,0,0,1,0,0,1,0,0,0,,パートナー(恋人・夫婦など),,"観光協会のHP,Google map,YouTube,観光協会・空港・道の駅等の案内所",0,0,0,0,1,0,0,0,1,0,1,0,0,0,0,0,1,0,0,0,,レンタカー,0,1,0,0,0,0,0,0,,レンタカー,0,1,0,0,0,0,0,0,,満足,駐車場が必ず完備,2泊,"10,000円以上 20,000円未満","5,000円以上 10,000円未満","5,000円以上 10,000円未満","5,000円以上 10,000円未満",2-3回目,半年以内,必ず来たい,半年-1年後,満足,皆さん親切,7,自然や歴史,ない,,中部,その他,プロ野球自主トレ見学,なかやんばる(名護市・本部町・今帰仁村),その他,八重岳,"5,000円未満",満足,季節の野菜や果物、その他情報がたくさん,,8,"駐車場の止めやすさ
清潔感なと",女性,1972,福岡県,800-1000万円未満,道の駅おおぎみエリア,大宜味村,2026-01-17 12:15:19
4558,4082,日帰り,"5,000円未満",地域の行事,0,0,0,0,0,0,0,0,0,0,1,0,0,0,0,0,0,0,0,0,0,0,0,,未就学児を含む家族,,観光展・物産展,1,0,0,0,0,0,0,0,0,0,0,0,0,0,0,0,0,0,0,0,,自家用車,1,0,0,0,0,0,0,0,,自家用車,1,0,0,0,0,0,0,0,,,,1泊,"10,000円以上 20,000円未満","5,000円以上 10,000円未満","5,000円以上 10,000円未満","5,000円未満",11回目以上,半年以内,必ず来たい,半年以内,大変満足,自然が豊かで人がフレンドリー,10,癒される体験,ない,,特になし,,,特になし,,,"5,000円未満",大変満足,フードコートの種類が豊富で八百屋などもある,,10,,女性,1979,沖縄県,400-600万円未満,道の駅ゆいゆい国頭エリア,国頭村,2026-01-17 12:22:49
4559,4083,2泊,"10,000円以上 20,000円未満","リゾートホテルを楽しむ,地元の美味しいものを食べる,買い物、アウトレット,アウトドア:マリンスポーツ",0,1,1,0,0,0,0,0,1,0,0,0,0,1,0,0,0,0,0,0,0,0,0,,パートナー(恋人・夫婦など),,"観光パンフレット・ポスター,Instagram",0,0,0,1,0,0,0,0,0,0,0,0,1,0,0,0,0,0,0,0,,レンタカー,0,1,0,0,0,0,0,0,,レンタカー,0,1,0,0,0,0,0,0,,大変満足,,1泊,"10,000円以上 20,000円未満","5,000円以上 10,000円未満","5,000円未満","5,000円以上 10,000円未満",初めて,,必ず来たい,半年-1年後,大変満足,,10,,ない,,うふやんばる(国頭村・大宜味村・東村),やんばる野生生物保護センター,,中部,美浜アメリカンビレッジ,,"5,000円以上 10,000円未満",大変満足,,,10,,男性,1999,愛知県,300-400万円未満,万座毛エリア,恩納村,2026-01-17 12:24:11
4561,4084,3泊,"20,000円以上 30,000円未満",テーマパーク:その他,0,0,0,0,0,0,0,1,0,0,0,0,0,0,0,0,0,0,0,0,0,0,0,,その他家族,,美ら海水族館等の観光関連事業者HP,0,0,0,0,0,1,0,0,0,0,0,0,0,0,0,0,0,0,0,0,,レンタカー,0,1,0,0,0,0,0,0,,レンタカー,0,1,0,0,0,0,0,0,,満足,"那覇空港到着後、レンタカーを乗り出すまでに時間が予想以上にかかったため。
それ以外で困ったことなどはありません。",2泊,"20,000円以上 30,000円未満","5,000円以上 10,000円未満","10,000円以上 20,000円未満","5,000円未満",4-5回目,1-3年前,必ず来たい,半年-1年後,大変満足,"今回はタイミングが合い、桜祭りの初日に伺えました。
偶然日にちが重なったので立ち寄ったのですが、ジャングルと桜の組み合わせが、やんばるだからこその風景で感動しました。

まだ咲き始めだったので、満開の時に見にきたいです。

この後、これから梅を見に行ってきます！",10,自然（鳥や虫の声を聞きながらの森林浴）,ない,,なかやんばる(名護市・本部町・今帰仁村),その他,八重山桜まつり,うふやんばる(国頭村・大宜味村・東村),その他,オオシッタ,"5,000円未満",満足,"魚が新鮮で美味しかったです。
店員さんの接客も明るく範囲外が良かった。",新鮮な魚を食べること,8,美味しくボリュームもたっぷりだったので、魚好きの人に勧めたい。,女性,1973,埼玉県,600-800万円未満,名護市街エリア,名護市,2026-01-17 12:34:34
4564,4085,3泊,"5,000円以上 10,000円未満","テーマパーク:沖縄美ら海水族館,アウトドア:ビーチ・海水浴,ドライブ・ツーリング",0,0,0,0,0,1,0,0,0,0,0,0,1,0,0,0,0,0,0,1,0,0,0,,未就学児を含む家族,,"新聞・雑誌・ガイドブック,観光パンフレット・ポスター,美ら海水族館等の観光関連事業者HP,Google map",0,1,0,1,0,1,0,0,1,0,0,0,0,0,0,0,0,0,0,0,,レンタカー,0,1,0,0,0,0,0,0,,レンタカー,0,1,0,0,0,0,0,0,,満足,道がわかりやすかったです,やんばるエリアには宿泊しない,"10,000円以上 20,000円未満","5,000円以上 10,000円未満","10,000円以上 20,000円未満","10,000円以上 20,000円未満",2-3回目,半年以内,必ず来たい,半年-1年後,満足,美ら海水族館以外にも海洋博公園がとても充実していたこと,8,海洋博公園でいろいろと回ることができるから、日数を確保するといい,ある,美ら海水族館のベビールームをもう少し広くしてもらえたらありがたい,中部,残波岬,,特になし,特に無し,,"5,000円以上 10,000円未満",大変満足,美ら海水族館以外の施設も大変充実していたから,手軽に食べられるフードトラックがあり、食べるスペースもありよかった。1月でも外のベンチで食べられて気持ちよかった。お土産も,10,マナティ館やウミガメ館もとてもよかったので、ゆっくりじっくり回りたいと思ったから,女性,1990,東京都,800-1000万円未満,海洋博公園・観光拠点エリア,本部町,2026-01-17 13:08:54
4565,4086,3泊,"10,000円以上 20,000円未満","宿でのんびり過ごす,リゾートホテルを楽しむ,地元の美味しいものを食べる,名所、旧跡の観光",1,1,1,0,1,0,0,0,0,0,0,0,0,0,0,0,0,0,0,0,0,0,0,,未就学児を含む家族,,"観光パンフレット・ポスター,インターネット・アプリ,YouTube,Instagram,ブログ,観光協会・空港・道の駅等の案内所",0,0,0,1,0,0,0,0,0,1,1,0,1,0,1,0,1,0,0,0,,レンタカー,0,1,0,0,0,0,0,0,,レンタカー,0,1,0,0,0,0,0,0,,満足,自分たちのタイミングで行動できる,2泊,"20,000円以上 30,000円未満","5,000円未満","5,000円未満","5,000円未満",4-5回目,1-3年前,来たい,半年-1年後,満足,"沖縄に来たなという感じが味わえてよかった
",9,"今回ヘリオス酒造に見学に行ったがとても楽しめたので勧めたい
万座毛も綺麗になって初めて訪れたがゆっくりランチができてよかった",ない,,中部,残波岬,,南部,国際通り,,"5,000円未満",満足,"綺麗になっていて見やすかったし子供連れだったのでトイレや軽食等助かった
あと写真のサービスが嬉しかった",,9,"景色と施設の綺麗さ
子連れでもおすすめ",女性,1983,大阪府,600-800万円未満,万座毛エリア,恩納村,2026-01-17 13:11:41
4566,4087,日帰り,"5,000円未満","地元の美味しいものを食べる,花見などの自然鑑賞,名所、旧跡の観光",0,0,1,1,1,0,0,0,0,0,0,0,0,0,0,0,0,0,0,0,0,0,0,,パートナー(恋人・夫婦など),,美ら海水族館等の観光関連事業者HP,0,0,0,0,0,1,0,0,0,0,0,0,0,0,0,0,0,0,0,0,,自家用車,1,0,0,0,0,0,0,0,,自家用車,1,0,0,0,0,0,0,0,,,,やんばるエリアには宿泊しない,使わない,"5,000円以上 10,000円未満","10,000円以上 20,000円未満","10,000円以上 20,000円未満",11回目以上,半年-1年前,必ず来たい,半年-1年後,大変満足,,10,,ない,,なかやんばる(名護市・本部町・今帰仁村),沖縄美ら海水族館,,なかやんばる(名護市・本部町・今帰仁村),,,"5,000円以上 10,000円未満",満足,,,8,,女性,1973,沖縄県,400-600万円未満,嵐山エリア,名護市,2026-01-17 13:15:34
