4588,4107,日帰り,"5,000円未満",名所、旧跡の観光,0,0,0,0,1,0,0,0,0,0,0,0,0,0,0,0,0,0,0,0,0,0,0,,パートナー(恋人・夫婦など),,Google map,0,0,0,0,0,0,0,0,1,0,0,0,0,0,0,0,0,0,0,0,,自家用車,1,0,0,0,0,0,0,0,,自家用車,1,0,0,0,0,0,0,0,,,,やんばるエリアには宿泊しない,"5,000円以上 10,000円未満","5,000円未満","5,000円未満","5,000円未満",4-5回目,半年-1年前,必ず来たい,半年-1年後,大変満足,自然がいっぱいで素敵でした。,10,スピリチュアルな場所が多い,ない,そのまま自然を守ってください。,なかやんばる(名護市・本部町・今帰仁村),その他,スピリチュアルな場所,中部,美浜アメリカンビレッジ,,"5,000円未満",大変満足,全てがよかったです。,,10,辺戸岬は自然がとても感じられて良かった,女性,1997,沖縄県,200-300万円未満,辺戸岬観光案内所エリア,国頭村,2026-01-17 15:57:03
4590,4108,2泊,"5,000円未満","リゾートホテルを楽しむ,地元の美味しいものを食べる,テーマパーク:沖縄美ら海水族館,買い物、アウトレット",0,1,1,0,0,1,0,0,1,0,0,0,0,0,0,0,0,0,0,0,0,0,0,,親,,"TV・ラジオ番組やCM,観光協会のHP,美ら海水族館等の観光関連事業者HP,Google map",0,0,1,0,1,1,0,0,1,0,0,0,0,0,0,0,0,0,0,0,,路線バス、高速バス、シャトルバス,0,0,0,0,0,1,0,0,,徒歩,0,0,0,0,0,1,0,0,,,,2泊,"50,000円以上 100,000円未満","5,000円未満","10,000円以上 20,000円未満","5,000円以上 10,000円未満",初めて,,来たい,1-3年後,大変満足,気候も景色も良く、食事も含めて沖縄らしさを満喫できた、,10,美ら海水族館のジンベイザメは生で見る価値大。,ない,,特になし,,,特になし,特に無し,,"5,000円未満",大変満足,水族館は想像以上に楽しく印象的だった。ホテルからも近くて散策も気持ち良かった。,沖縄ならではのもの。特に海に関するもの。,10,景色が素晴らしく、綺麗に整備されていて、水族館は必見。,男性,1970,神奈川県,1000-1200万円未満,海洋博公園・観光拠点エリア,本部町,2026-01-17 16:30:52
4591,4109,4泊,"5,000円以上 10,000円未満","宿でのんびり過ごす,リゾートホテルを楽しむ,地元の美味しいものを食べる,名所、旧跡の観光,テーマパーク:沖縄美ら海水族館,テーマパーク:その他,買い物、アウトレット,ドライブ・ツーリング",1,1,1,0,1,1,0,1,1,0,0,0,0,0,0,0,0,0,0,1,0,0,0,,パートナー(恋人・夫婦など),,"宿泊事業者のHP,インターネット・アプリ,YouTube,Instagram",0,0,0,0,0,0,1,0,0,1,1,0,1,0,0,0,0,0,0,0,,レンタカー,0,1,0,0,0,0,0,0,,レンタカー,0,1,0,0,0,0,0,0,,やや満足,自由に行動できる,4泊,"40,000円以上 50,000円未満","5,000円以上 10,000円未満","20,000円以上 30,000円未満","20,000円以上 30,000円未満",11回目以上,半年以内,必ず来たい,半年以内,大変満足,魅力的な宿が多い,10,自然と便利さの融合,ある,鉄軌道が那覇から伸びていれば移動が早よ戻んてきなはれ楽になる,なかやんばる(名護市・本部町・今帰仁村),沖縄美ら海水族館,,うふやんばる(国頭村・大宜味村・東村),辺戸岬,,"5,000円未満",満足,環境がいい,地元の名産がある,10,環境の良さ,男性,1973,東京都,800-1000万円未満,辺戸岬観光案内所エリア,国頭村,2026-01-17 16:31:08
4592,4110,3泊,"20,000円以上 30,000円未満","地元の美味しいものを食べる,花見などの自然鑑賞,名所、旧跡の観光,買い物、アウトレット,その他",0,0,1,1,1,0,0,0,1,0,0,0,0,0,0,0,0,0,0,0,0,0,1,ヤンバルクイナ生態展示施設,パートナー(恋人・夫婦など),,"新聞・雑誌・ガイドブック,インターネット・アプリ,YouTube,Instagram",0,1,0,0,0,0,0,0,0,1,1,0,1,0,0,0,0,0,0,0,,レンタカー,0,1,0,0,0,0,0,0,,レンタカー,0,1,0,0,0,0,0,0,,大変満足,カーナビが使いやすかった,1泊,"10,000円以上 20,000円未満","5,000円以上 10,000円未満","5,000円以上 10,000円未満","10,000円以上 20,000円未満",2-3回目,半年-1年前,必ず来たい,3-5年後,満足,初めて訪れた場所（辺戸岬、今帰仁城跡、ヤンバルクイナ）など期待値を上回った為,8,辺戸岬の海の青さ、鯨が見えたらしい,ない,,なかやんばる(名護市・本部町・今帰仁村),その他,本部町市場,中部,その他,万座毛,"5,000円以上 10,000円未満",大変満足,"美味しいランチをいただきました
ガーリックステーキ
大東寿司、天ぷら",,8,美味しい食べ物、果物,女性,1968,佐賀県,600-800万円未満,道の駅許田エリア,名護市,2026-01-17 16:31:44
4594,4111,5泊,"5,000円以上 10,000円未満","地元の美味しいものを食べる,花見などの自然鑑賞,名所、旧跡の観光,テーマパーク:沖縄美ら海水族館,テーマパーク:その他,買い物、アウトレット,スポーツ観戦や芸能鑑賞(コンサート等),アウトドア:ビーチ・海水浴,アウトドア:マリンスポーツ,まちあるき・集落散策,ドライブ・ツーリング",0,0,1,1,1,1,0,1,1,0,0,1,1,1,0,0,1,0,0,1,0,0,0,,パートナー(恋人・夫婦など),,"新聞・雑誌・ガイドブック,インターネット・アプリ,その他",0,1,0,0,0,0,0,0,0,1,0,0,0,0,0,0,0,0,0,1,,レンタカー,0,1,0,0,0,0,0,0,,レンタカー,0,1,0,0,0,0,0,0,,大変満足,"安い
プライベートが保てる
時間に束縛されない
温度設定が自在
",2泊,"40,000円以上 50,000円未満","5,000円未満","5,000円以上 10,000円未満","5,000円以上 10,000円未満",2-3回目,5年以上前,必ず来たい,1-3年後,大変満足,体験に、満,10,"マリンスポーツ
ホエールウォッチ
オリオンビール",ない,,なかやんばる(名護市・本部町・今帰仁村),沖縄美ら海水族館,,中部,美浜アメリカンビレッジ,,"5,000円以上 10,000円未満",大変満足,"自然が良い
景観が良い
",もても良いところばかりなのでもっともっと活性化,10,"自然の景観
道路の混雑もなく快適",男性,1970,愛知県,1500-2000万円未満,万座毛エリア,恩納村,2026-01-17 16:36:43
4595,4112,5泊,"50,000円以上 100,000円未満","地元の美味しいものを食べる,テーマパーク:沖縄美ら海水族館,テーマパーク:その他,買い物、アウトレット,アウトドア:マリンスポーツ,まちあるき・集落散策,ドライブ・ツーリング",0,0,1,0,0,1,0,1,1,0,0,0,0,1,0,0,1,0,0,1,0,0,0,,パートナー(恋人・夫婦など),,"観光展・物産展,新聞・雑誌・ガイドブック,Google map,インターネット・アプリ",1,1,0,0,0,0,0,0,1,1,0,0,0,0,0,0,0,0,0,0,,レンタカー,0,1,0,0,0,0,0,0,,レンタカー,0,1,0,0,0,0,0,0,,大変満足,レンタカーが綺麗,2泊,"50,000円以上 100,000円未満","20,000円以上 30,000円未満","20,000円以上 30,000円未満","20,000円以上 30,000円未満",2-3回目,5年以上前,必ず来たい,1-3年後,大変満足,自然も人も良い,8,アクティビティ,ない,,なかやんばる(名護市・本部町・今帰仁村),沖縄美ら海水族館,,南部,国際通り,,"5,000円以上 10,000円未満",大変満足,景色が最高❣️,,8,"景色が良い
良心的な入場料金",女性,1969,愛知県,400-600万円未満,万座毛エリア,恩納村,2026-01-17 16:42:57
4596,4113,2泊,"100,000円以上","名所、旧跡の観光,テーマパーク:沖縄美ら海水族館",0,0,0,0,1,1,0,0,0,0,0,0,0,0,0,0,0,0,0,0,0,0,0,,団体旅行,,YouTube,0,0,0,0,0,0,0,0,0,0,1,0,0,0,0,0,0,0,0,0,,旅行会社ツアーバス,0,0,0,1,0,0,0,0,,旅行会社ツアーバス,0,0,0,1,0,0,0,0,,普通,,やんばるエリアには宿泊しない,"30,000円以上 40,000円未満","5,000円以上 10,000円未満","10,000円以上 20,000円未満","5,000円以上 10,000円未満",初めて,,来たい,1-3年後,普通,,4,,ない,,特になし,特に無し,,,,,"5,000円未満",普通,,,5,,男性,1953,三重県,答えられない,万座毛エリア,恩納村,2026-01-17 16:47:01
4598,4114,2泊,"5,000円未満","地元の美味しいものを食べる,名所、旧跡の観光,テーマパーク:沖縄美ら海水族館,まちあるき・集落散策",0,0,1,0,1,1,0,0,0,0,0,0,0,0,0,0,1,0,0,0,0,0,0,,団体旅行,,YouTube,0,0,0,0,0,0,0,0,0,0,1,0,0,0,0,0,0,0,0,0,,旅行会社ツアーバス,0,0,0,1,0,0,0,0,,旅行会社ツアーバス,0,0,0,1,0,0,0,0,,やや満足,あまり歩かないので少し疲れた,1泊,"10,000円以上 20,000円未満","5,000円未満","5,000円未満","5,000円未満",初めて,,やや来たい,1-3年後,やや満足,あまり歩かないので少し疲れた,5,万座毛が美しい,ない,,門口(じょうぐち)やんばる(金武町・宜野座村・恩納村),道の駅ぎのざ,,特になし,特に無し,,"5,000円未満",やや満足,,,6,,女性,1962,徳島県,100-200万円未満,万座毛エリア,恩納村,2026-01-17 17:42:47
4599,4115,1泊,"5,000円未満","宿でのんびり過ごす,名所、旧跡の観光",1,0,0,0,1,0,0,0,0,0,0,0,0,0,0,0,0,0,0,0,0,0,0,,パートナー(恋人・夫婦など),,"Google map,YouTube,Instagram",0,0,0,0,0,0,0,0,1,0,1,0,1,0,0,0,0,0,0,0,,自家用車,1,0,0,0,0,0,0,0,,自家用車,1,0,0,0,0,0,0,0,,,,1泊,"30,000円以上 40,000円未満","5,000円以上 10,000円未満","5,000円以上 10,000円未満","5,000円未満",11回目以上,半年-1年前,必ず来たい,半年-1年後,大変満足,山と海を直接感じることができるエリアだから。いろいろな宿もあり、アクセスも思ったほど混んでなくて便利,10,"自然との距離
本島中南部にはない、文化体験",ない,,うふやんばる(国頭村・大宜味村・東村),アスムイハイクス,,うふやんばる(国頭村・大宜味村・東村),その他,BUNAGAYA,"5,000円以上 10,000円未満",大変満足,"料理が美味しい
提供も早かった","特になし
良いサービスだった",10,美味しさ,男性,1976,沖縄県,600-800万円未満,道の駅ゆいゆい国頭エリア,国頭村,2026-01-17 17:50:37
4600,4116,日帰り,"5,000円未満","地元の美味しいものを食べる,アウトドア:登山・トレッキング,ドライブ・ツーリング",0,0,1,0,0,0,0,0,0,0,0,0,0,0,1,0,0,0,0,1,0,0,0,,自分ひとり,,Google map,0,0,0,0,0,0,0,0,1,0,0,0,0,0,0,0,0,0,0,0,,自家用車,1,0,0,0,0,0,0,0,,自家用車,1,0,0,0,0,0,0,0,,,,やんばるエリアには宿泊しない,使わない,"5,000円未満","5,000円以上 10,000円未満","5,000円未満",4-5回目,半年以内,来たい,半年以内,満足,景色が海山とも良かった,8,"大宜味から国頭の海岸沿いの国道

やんばる学びの森からの山並みが綺麗だった。休業状態であったがもっと活用した方はよいと思う。",ない,,うふやんばる(国頭村・大宜味村・東村),その他,やんばる学びの森,中部,その他,コザの飲食店,"5,000円未満",やや不満,"大将は刺身を切りながら咳払い風邪気味？？
店員も料理作りながらくしゃみ
顔をそむけるぐらいはしてほしかった。",せっかく美味しいシーフードを提供しているのに、衛生上もう少し気を使って欲しかった。,7,"刺身自体は美味しい。
バター焼きなども勧められる",男性,1975,沖縄県,800-1000万円未満,道の駅ゆいゆい国頭エリア,国頭村,2026-01-17 18:09:05
4601,4117,日帰り,"5,000円未満","地元の美味しいものを食べる,花見などの自然鑑賞",0,0,1,1,0,0,0,0,0,0,0,0,0,0,0,0,0,0,0,0,0,0,0,,その他家族,,"インターネット・アプリ,Instagram",0,0,0,0,0,0,0,0,0,1,0,0,1,0,0,0,0,0,0,0,,自家用車,1,0,0,0,0,0,0,0,,自家用車,1,0,0,0,0,0,0,0,,,,やんばるエリアには宿泊しない,使わない,"5,000円未満","5,000円未満","5,000円未満",11回目以上,半年以内,来たい,半年以内,満足,好天に恵まれ海と自然の景色が最高だったから。,8,自然を満喫できるから,ある,天候が悪い時に遊べる場所が少ない,なかやんばる(名護市・本部町・今帰仁村),古宇利島(オーシャンタワー/ハートロック),,特になし,特に無し,,"5,000円未満",満足,お土産屋のオリオングッズが充実していた。スタッフの人が明るくて対応が良かった,,9,ビールが美味しかった,女性,1973,沖縄県,300-400万円未満,名護市街エリア,名護市,2026-01-17 18:21:24
4602,4118,5泊,"5,000円未満","宿でのんびり過ごす,地元の美味しいものを食べる,買い物、アウトレット",1,0,1,0,0,0,0,0,1,0,0,0,0,0,0,0,0,0,0,0,0,0,0,,その他家族,,新聞・雑誌・ガイドブック,0,1,0,0,0,0,0,0,0,0,0,0,0,0,0,0,0,0,0,0,,レンタカー,0,1,0,0,0,0,0,0,,レンタカー,0,1,0,0,0,0,0,0,,大変満足,,やんばるエリアには宿泊しない,使わない,"5,000円未満",使わない,"5,000円未満",4-5回目,1-3年前,必ず来たい,1-3年後,大変満足,他には無い自然が残ってるから,10,沖縄らしさが最も残っている場所だから,ある,適当な宿泊施設が無いこと,うふやんばる(国頭村・大宜味村・東村),辺戸岬,,うふやんばる(国頭村・大宜味村・東村),その他,サンライズ東,使わない,普通,食べ物の値段は高いし興味のあるものが無いから,,5,トイレ休憩に最適だから,男性,1942,千葉県,300-400万円未満,ヤンバルクイナ生態展示学習施設クイナの森エリア,国頭村,2026-01-17 19:39:21