6610,5941,3泊,"5,000円以上 10,000円未満","宿でのんびり過ごす,名所、旧跡の観光,テーマパーク:沖縄美ら海水族館,買い物、アウトレット,ドライブ・ツーリング",1,0,0,0,1,1,0,0,1,0,0,0,0,0,0,0,0,0,0,1,0,0,0,,その他家族,,"Instagram,友人・知人",0,0,0,0,0,0,0,0,0,0,0,0,1,0,0,1,0,0,0,0,,レンタカー,0,1,0,0,0,0,0,0,,レンタカー,0,1,0,0,0,0,0,0,,満足,景色が綺麗な道を自分たちのペースで通ることができる。,3泊,"50,000円以上 100,000円未満","10,000円以上 20,000円未満","10,000円以上 20,000円未満","10,000円以上 20,000円未満",11回目以上,半年以内,必ず来たい,半年-1年後,大変満足,"観光地が多く、沖縄ならではのアクティブなどを楽しむことができる。
ヤンバルクイナが住んでる。",10,自然,ない,,門口(じょうぐち)やんばる(金武町・宜野座村・恩納村),その他,ホテル,なかやんばる(名護市・本部町・今帰仁村),沖縄美ら海水族館,,"10,000円以上 20,000円未満",大変満足,"お土産の充実度が高い。
売店も沖縄の食べ物が豊富で楽しめる。",,10,移動中の軽食を楽しめる、お土産が揃う。,女性,2000,東京都,600-800万円未満,道の駅許田エリア,名護市,2026-02-27 12:11:38
6611,5942,3泊,"20,000円以上 30,000円未満","宿でのんびり過ごす,リゾートホテルを楽しむ,地元の美味しいものを食べる,花見などの自然鑑賞,名所、旧跡の観光,まちあるき・集落散策,ドライブ・ツーリング",1,1,1,1,1,0,0,0,0,0,0,0,0,0,0,0,1,0,0,1,0,0,0,,パートナー(恋人・夫婦など),,"Google map,Facebook",0,0,0,0,0,0,0,0,1,0,0,0,0,1,0,0,0,0,0,0,,レンタカー,0,1,0,0,0,0,0,0,,レンタカー,0,1,0,0,0,0,0,0,,大変満足,自由度が増す。太陽と風と海を感じたくて、オープンカーを借りている。精神的な解放感がある。,2泊,"30,000円以上 40,000円未満","5,000円以上 10,000円未満","10,000円以上 20,000円未満","5,000円以上 10,000円未満",11回目以上,半年-1年前,必ず来たい,半年-1年後,大変満足,"恩納の道の駅はローカルな感じで必ず立ち寄り、野菜フルーツを買って帰る。
古宇利島は定番で、名護市内は便利めありながらも、適度に混み合っていないため、必ず立ち寄る。
国頭方面は自然感じるので、足が向く。",10,自然と生活感の共生具合が心地いいため。,ない,"特になし

強いて言えば、特定の施設に雨の日に客足が集中しやすい。",中部,その他,あしびなーアウトレット,なかやんばる(名護市・本部町・今帰仁村),古宇利島(オーシャンタワー/ハートロック),,"5,000円未満",大変満足,野菜、フルーツの販売の市場感がベスト。飲食店もローカルな感じで雰囲気が良い。,おまの雰囲気は大切に。,10,沖縄の雰囲気が詰まっている感じがするため。,男性,1969,奈良県,1200-1500万円未満,おんなの駅エリア,恩納村,2026-02-27 12:18:32
6612,5943,3泊,"10,000円以上 20,000円未満","リゾートホテルを楽しむ,地元の美味しいものを食べる,名所、旧跡の観光,まちあるき・集落散策,ドライブ・ツーリング",0,1,1,0,1,0,0,0,0,0,0,0,0,0,0,0,1,0,0,1,0,0,0,,パートナー(恋人・夫婦など),,"Google map,インターネット・アプリ,Instagram",0,0,0,0,0,0,0,0,1,1,0,0,1,0,0,0,0,0,0,0,,レンタカー,0,1,0,0,0,0,0,0,,"レンタカー,徒歩",0,1,0,0,0,1,0,0,,大変満足,いつも利用しているレンタカーだから,2泊,"30,000円以上 40,000円未満","5,000円未満","10,000円以上 20,000円未満","5,000円以上 10,000円未満",11回目以上,半年-1年前,必ず来たい,半年-1年後,満足,"ヤンバルクイナを見れたから
自然がたくさんあって、非日常感と、リゾート感を感じて癒される。
リフレッシュできる",10,"生きたヤンバルクイナを見て欲しい
海や砂浜で
自然と非日常感、リゾート感の癒しを勧めたい",ある,雨の日に楽しめる場所がもっとあるといいかな。,中部,その他,ホテル日航アリビラ,うふやんばる(国頭村・大宜味村・東村),やんばる野生生物保護センター,,"5,000円未満",満足,"雰囲気がいつも活気があって楽しい
しまらっきょうが買えた！",沖縄らしい食材と、食べ物かあるので楽しい,10,食べ物と。野菜フルーツ,女性,1974,奈良県,1000-1200万円未満,おんなの駅エリア,恩納村,2026-02-27 12:20:41
6613,5944,3泊,"10,000円以上 20,000円未満",テーマパーク:沖縄美ら海水族館,0,0,0,0,0,1,0,0,0,0,0,0,0,0,0,0,0,0,0,0,0,0,0,,中学生以上を含む家族(小学生以下は含まない),,新聞・雑誌・ガイドブック,0,1,0,0,0,0,0,0,0,0,0,0,0,0,0,0,0,0,0,0,,レンタカー,0,1,0,0,0,0,0,0,,レンタカー,0,1,0,0,0,0,0,0,,満足,高速道路が渋滞なく進めた,やんばるエリアには宿泊しない,使わない,"5,000円未満","5,000円未満","5,000円以上 10,000円未満",初めて,,来たい,3-5年後,満足,水族館が見応えあり,7,水族館。ただし、空港から遠いため、おすすめ度がやや低め。,ある,トラックが多すぎる。,なかやんばる(名護市・本部町・今帰仁村),沖縄美ら海水族館,　,特になし,特に無し,,"5,000円以上 10,000円未満",満足,絶景,なにか体験があると長居できる。,7,絶景,男性,1974,神奈川県,1200-1500万円未満,万座毛エリア,恩納村,2026-02-27 12:28:26
6614,5945,3泊,"5,000円以上 10,000円未満",ドライブ・ツーリング,0,0,0,0,0,0,0,0,0,0,0,0,0,0,0,0,0,0,0,1,0,0,0,,親,,インターネット・アプリ,0,0,0,0,0,0,0,0,0,1,0,0,0,0,0,0,0,0,0,0,,レンタカー,0,1,0,0,0,0,0,0,,レンタカー,0,1,0,0,0,0,0,0,,大変満足,,やんばるエリアには宿泊しない,使わない,使わない,"5,000円未満",使わない,初めて,,必ず来たい,1-3年後,大変満足,,10,,ない,,うふやんばる(国頭村・大宜味村・東村),辺戸岬,,,,,"5,000円以上 10,000円未満",大変満足,,,10,,男性,2005,広島県,400-600万円未満,辺戸岬観光案内所エリア,国頭村,2026-02-27 12:43:28
6615,5946,3泊,"5,000円以上 10,000円未満","テーマパーク:沖縄美ら海水族館,アウトドア:マリンスポーツ,ドライブ・ツーリング",0,0,0,0,0,1,0,0,0,0,0,0,0,1,0,0,0,0,0,1,0,0,0,,その他家族,,"新聞・雑誌・ガイドブック,インターネット・アプリ",0,1,0,0,0,0,0,0,0,1,0,0,0,0,0,0,0,0,0,0,,レンタカー,0,1,0,0,0,0,0,0,,レンタカー,0,1,0,0,0,0,0,0,,満足,雨だったので,3泊,使わない,使わない,"5,000円未満",使わない,初めて,,来たい,5年以上,満足,雨だったので,7,景色,ない,,中部,その他,国際通り,なかやんばる(名護市・本部町・今帰仁村),沖縄美ら海水族館,,"5,000円未満",満足,雨だったので,,7,,女性,1974,島根県,200-300万円未満,辺戸岬観光案内所エリア,国頭村,2026-02-27 12:45:04
6616,5947,3泊,"10,000円以上 20,000円未満","テーマパーク:沖縄美ら海水族館,アウトドア:マリンスポーツ",0,0,0,0,0,1,0,0,0,0,0,0,0,1,0,0,0,0,0,0,0,0,0,,その他家族,,"Google map,インターネット・アプリ",0,0,0,0,0,0,0,0,1,1,0,0,0,0,0,0,0,0,0,0,,レンタカー,0,1,0,0,0,0,0,0,,レンタカー,0,1,0,0,0,0,0,0,,やや不満,,1泊,"5,000円以上 10,000円未満","5,000円未満","5,000円以上 10,000円未満","5,000円未満",初めて,,やや来たい,1-3年後,やや不満,天気が悪かったので,5,,ない,,南部,首里城公園,行ってみたかったので,うふやんばる(国頭村・大宜味村・東村),辺戸岬,気になったので,"5,000円以上 10,000円未満",やや不満,"天気が悪かったので
",,5,,男性,1968,島根県,1000-1200万円未満,辺戸岬観光案内所エリア,国頭村,2026-02-27 12:46:09
6617,5948,1泊,"5,000円以上 10,000円未満","リゾートホテルを楽しむ,地元の美味しいものを食べる,花見などの自然鑑賞,名所、旧跡の観光",0,1,1,1,1,0,0,0,0,0,0,0,0,0,0,0,0,0,0,0,0,0,0,,パートナー(恋人・夫婦など),,"Google map,インターネット・アプリ,YouTube,Instagram,友人・知人",0,0,0,0,0,0,0,0,1,1,1,0,1,0,0,1,0,0,0,0,,自家用車,1,0,0,0,0,0,0,0,,自家用車,1,0,0,0,0,0,0,0,,,,1泊,"5,000円以上 10,000円未満","10,000円以上 20,000円未満","10,000円以上 20,000円未満","10,000円以上 20,000円未満",6-10回目,半年以内,必ず来たい,半年以内,大変満足,"自然が豊かで、癒される
那覇など都市にはない清らかな空気が山原には残っている",10,観光地も自然に配慮したものが多く、自然をそのまま残しながら活用して楽しめる,ある,道路標識が少ない,うふやんばる(国頭村・大宜味村・東村),やんばる野生生物保護センター,,うふやんばる(国頭村・大宜味村・東村),その他,山原工芸店,"5,000円未満",大変満足,"静かなところでゆっくりと展示を見学できた。
受付の方も質問に丁寧にお答えいただき、大変勉強になった",,10,手芸品のお土産がどれも綺麗で、クオリティが高い,男性,1990,沖縄県,200-300万円未満,芭蕉布会館エリア,大宜味村,2026-02-27 12:52:10
6618,5949,3泊,"20,000円以上 30,000円未満","地元の美味しいものを食べる,テーマパーク:沖縄美ら海水族館,スポーツ観戦や芸能鑑賞(コンサート等),アウトドア:登山・トレッキング",0,0,1,0,0,1,0,0,0,0,0,1,0,0,1,0,0,0,0,0,0,0,0,,中学生以上を含む家族(小学生以下は含まない),,"観光協会のHP,美ら海水族館等の観光関連事業者HP,Google map,インターネット・アプリ",0,0,0,0,1,1,0,0,1,1,0,0,0,0,0,0,0,0,0,0,,レンタカー,0,1,0,0,0,0,0,0,,レンタカー,0,1,0,0,0,0,0,0,,満足,交通機関は不便と情報がありましたが、どこも駐車場が整備されていましたので、レンタカーで快適に旅ができました！,1泊,"30,000円以上 40,000円未満","30,000円以上 40,000円未満","5,000円以上 10,000円未満","5,000円以上 10,000円未満",2-3回目,3-5年前,必ず来たい,半年-1年後,大変満足,皆さんの優しさやあたたかさにいつも心を癒されています！　また来ます！,10,"やんばる生態学習施設、大石林山、海全般、与那覇岳
ここにしかない異空間の癒しの自然とヤンバルクイナの可愛さ！",ある,ナビを使っていたので、迷わなかったのですが、もう少し看板がほしいです。,中部,残波岬,,うふやんばる(国頭村・大宜味村・東村),やんばる野生生物保護センター,,"20,000円以上 30,000円未満",満足,トイレを含めて施設が綺麗！店員さんが丁寧！　スイーツ美味しい！　阪神タイガース大好き！,もっと地元の良さをアピールしたスイーツを増やして欲しいです。,10,"ヤンバルの良さが伝わってきて、これから行く人のワクワク感を上げてくれる！
帰る人は、余韻を感じさせてくれる！",男性,1983,埼玉県,600-800万円未満,道の駅ぎのざエリア,宜野座村,2026-02-27 13:05:31
6619,5950,6泊,"20,000円以上 30,000円未満","宿でのんびり過ごす,リゾートホテルを楽しむ,地元の美味しいものを食べる,名所、旧跡の観光",1,1,1,0,1,0,0,0,0,0,0,0,0,0,0,0,0,0,0,0,0,0,0,,パートナー(恋人・夫婦など),,"新聞・雑誌・ガイドブック,Google map,YouTube",0,1,0,0,0,0,0,0,1,0,1,0,0,0,0,0,0,0,0,0,,レンタカー,0,1,0,0,0,0,0,0,,レンタカー,0,1,0,0,0,0,0,0,,満足,自由、手軽に移動が出来る,2泊,"30,000円以上 40,000円未満","30,000円以上 40,000円未満","10,000円以上 20,000円未満",使わない,2-3回目,半年-1年前,来たい,1-3年後,満足,本島にない雰囲気を味わえる,9,本島とは一味違う動植物観察出来る。,ない,,門口(じょうぐち)やんばる(金武町・宜野座村・恩納村),その他,金城のマングローブ林,門口(じょうぐち)やんばる(金武町・宜野座村・恩納村),その他,雨で行き先がない為今検討中,"5,000円未満",普通,料理、買い物も特別なものはなし,地元ならではの物を多く準備したらどうですか。,5,沖縄ならではの物を販売していた,男性,1962,熊本県,答えられない,道の駅ぎのざエリア,宜野座村,2026-02-27 13:12:59
6620,5951,6泊,"20,000円以上 30,000円未満","地元の美味しいものを食べる,まちあるき・集落散策,ドライブ・ツーリング",0,0,1,0,0,0,0,0,0,0,0,0,0,0,0,0,1,0,0,1,0,0,0,,パートナー(恋人・夫婦など),,"新聞・雑誌・ガイドブック,YouTube",0,1,0,0,0,0,0,0,0,0,1,0,0,0,0,0,0,0,0,0,,レンタカー,0,1,0,0,0,0,0,0,,レンタカー,0,1,0,0,0,0,0,0,,やや満足,満足ではあるが道を知らないことによる右折渋滞などに気が付かないことがあった,2泊,"20,000円以上 30,000円未満","5,000円以上 10,000円未満","5,000円以上 10,000円未満","5,000円以上 10,000円未満",2-3回目,5年以上前,来たい,3-5年後,普通,天気が雨の為思うように歩く事が出来なくて残念でした　カヌーも是非やりたかった,6,川の周りをのんびりとハイキングする,ある,雨の日の観光　楽しみ方,なかやんばる(名護市・本部町・今帰仁村),その他,ひめゆりの塔,うふやんばる(国頭村・大宜味村・東村),辺戸岬,,"5,000円未満",普通,何しろ天気が悪かったので残念でした,"ハイキングルートの充実
サイクリングコースの設定",6,アイスクリームバナナ🍌等の地域の食材を楽しむ,女性,1962,熊本県,答えられない,道の駅ぎのざエリア,宜野座村,2026-02-27 13:19:53
6621,5952,日帰り,"5,000円以上 10,000円未満","テーマパーク:沖縄美ら海水族館,地域の行事,ドライブ・ツーリング",0,0,0,0,0,1,0,0,0,0,1,0,0,0,0,0,0,0,0,1,0,0,0,,小学生を含む家族(未就学児は含まない),,"観光パンフレット・ポスター,美ら海水族館等の観光関連事業者HP",0,0,0,1,0,1,0,0,0,0,0,0,0,0,0,0,0,0,0,0,,自家用車,1,0,0,0,0,0,0,0,,自家用車,1,0,0,0,0,0,0,0,,,,1泊,"5,000円以上 10,000円未満","5,000円以上 10,000円未満","5,000円以上 10,000円未満","5,000円以上 10,000円未満",11回目以上,半年以内,必ず来たい,半年以内,大変満足,,8,,ない,,なかやんばる(名護市・本部町・今帰仁村),沖縄美ら海水族館,,なかやんばる(名護市・本部町・今帰仁村),沖縄美ら海水族館,,"5,000円未満",満足,,,8,,男性,1969,沖縄県,400-600万円未満,嵐山エリア,名護市,2026-02-27 13:27:25
6622,5953,3泊,"20,000円以上 30,000円未満","地元の美味しいものを食べる,スポーツ観戦や芸能鑑賞(コンサート等),まちあるき・集落散策,ドライブ・ツーリング",0,0,1,0,0,0,0,0,0,0,0,1,0,0,0,0,1,0,0,1,0,0,0,,パートナー(恋人・夫婦など),,"観光パンフレット・ポスター,Instagram",0,0,0,1,0,0,0,0,0,0,0,0,1,0,0,0,0,0,0,0,,レンタカー,0,1,0,0,0,0,0,0,,レンタカー,0,1,0,0,0,0,0,0,,大変満足,公共交通機関ではなかなか行けない場所に行けたため、お土産をたくさん買えたため,3泊,"20,000円以上 30,000円未満","20,000円以上 30,000円未満","20,000円以上 30,000円未満","30,000円以上 40,000円未満",2-3回目,1-3年前,来たい,半年-1年後,満足,美味しいものがたくさん、海も綺麗,8,那覇とは違う沖縄の文化や、良き沖縄を満喫できるため,ない,,中部,美浜アメリカンビレッジ,沖縄アリーナ,門口(じょうぐち)やんばる(金武町・宜野座村・恩納村),道の駅ぎのざ,,"5,000円未満",満足,ご飯の大盛りが欲しかった,マンホールカードを集めているので、こちらにもあれば嬉しかった,8,コンパクトに飲食店、お土産屋さんが楽しめるから,男性,1989,東京都,800-1000万円未満,おんなの駅エリア,恩納村,2026-02-27 13:29:28
6623,5954,3泊,"20,000円以上 30,000円未満","地元の美味しいものを食べる,買い物、アウトレット,スポーツ観戦や芸能鑑賞(コンサート等)",0,0,1,0,0,0,0,0,1,0,0,1,0,0,0,0,0,0,0,0,0,0,0,,パートナー(恋人・夫婦など),,"観光パンフレット・ポスター,インターネット・アプリ,Twitter,Instagram",0,0,0,1,0,0,0,0,0,1,0,1,1,0,0,0,0,0,0,0,,レンタカー,0,1,0,0,0,0,0,0,,レンタカー,0,1,0,0,0,0,0,0,,満足,レンタカーだと思いお土産や着替えなどももって移動できるので便利でした。急な雨にも対応できてよかったです。,3泊,"20,000円以上 30,000円未満","30,000円以上 40,000円未満","30,000円以上 40,000円未満","40,000円以上 50,000円未満",4-5回目,1-3年前,必ず来たい,半年-1年後,大変満足,天気がすぐれなくても道の駅での食事やお土産、お買い物をたくさん楽しめてよかったです。,8,"子どもがいても車があれば自分たちのペースで旅行ができそうで家族連れの友人にも薦めたいと思いました。
次は両親も連れて旅行案内したいと思います。",ある,困ってはいませんが、旅行先でご当地のガチャガチャを回すのが楽しみなので道の駅などで出会えたらより嬉しい気持ちになれそうです！,門口(じょうぐち)やんばる(金武町・宜野座村・恩納村),琉球村,,中部,北谷サンセットビーチ,,"5,000円以上 10,000円未満",満足,"タコの味噌炒め定食とタコの唐揚げ定食を食べましたが、今まで食べたタコ料理の中で一番柔らかくておいしかったのでまた来た時にリピートしたいと思いました。
ハチミツ入りアイスカフェラテも美味しくて、豆を買って帰りました！自宅でも沖縄気分を楽しむ予定です。",ご当地ガチャに期待します。,8,ご飯がたくさん選べるので友人や家族とシェアできて楽しめると思います。清潔感もあり、お茶や水もいただけて気持ちよく食事できました。,女性,1993,東京都,800-1000万円未満,おんなの駅エリア,恩納村,2026-02-27 13:31:50
6624,5955,4泊,"100,000円以上",出張など仕事関係,0,0,0,0,0,0,0,0,0,0,0,0,0,0,0,0,0,0,0,0,0,1,0,,職場の同僚,,宿泊施設,0,0,0,0,0,0,0,0,0,0,0,0,0,0,0,0,0,0,1,0,,フェリー,0,0,0,0,1,0,0,0,,レンタカー,0,1,0,0,0,0,0,0,,満足,実用的,2泊,"100,000円以上 200,000円未満","20,000円以上 30,000円未満","10,000円以上 20,000円未満","10,000円以上 20,000円未満",2-3回目,5年以上前,必ず来たい,1-3年後,大変満足,,10,ゆったりした景色を堪能,ない,,南部,国際通り,,特になし,特に無し,,使わない,大変満足,,"食事が美味しい
実際はなかがわ館です",10,雰囲気,男性,1970,静岡県,800-1000万円未満,伊是名村エリア,伊是名村,2026-02-27 13:33:01
6625,5956,4泊,"100,000円以上",出張など仕事関係,0,0,0,0,0,0,0,0,0,0,0,0,0,0,0,0,0,0,0,0,0,1,0,,職場の同僚,,その他,0,0,0,0,0,0,0,0,0,0,0,0,0,0,0,0,0,0,0,1,訪問先の方々,"レンタカー,その他",0,1,0,0,0,0,0,1,飛行機,"レンタカー,その他",0,1,0,0,0,0,0,1,フェリー、モノレール,大変満足,"伊是名へのフェリーは景色もよく、風も気持ちよくあっというまの船旅でした。贅沢な時間でした。
ありがとうございます。",3泊,"20,000円以上 30,000円未満","5,000円未満","10,000円以上 20,000円未満","20,000円以上 30,000円未満",初めて,,必ず来たい,半年以内,大変満足,伊是名島は宿泊先の方も地元の方もおおらかでフレンドリーで居心地がいいです。故郷に帰って来たくらいリラックスできました。また食事も美味しく大満足です。,10,美しい自然、のんびりした空気、美味しい食べ物 楽園だと感じました。,ない,,中部,その他,チヂン園,中部,その他,夢の吊り橋,"10,000円以上 20,000円未満",大変満足,"食事、サービス共に大満足です。景色もキレイで言うことがないです。
最高の宿泊先です。",大満足,10,笑顔がステキ,男性,1988,静岡県,600-800万円未満,伊是名村エリア,伊是名村,2026-02-27 13:36:33
6626,5957,3泊,"10,000円以上 20,000円未満","地元の美味しいものを食べる,名所、旧跡の観光",0,0,1,0,1,0,0,0,0,0,0,0,0,0,0,0,0,0,0,0,0,0,0,,パートナー(恋人・夫婦など),,友人・知人,0,0,0,0,0,0,0,0,0,0,0,0,0,0,0,1,0,0,0,0,,レンタカー,0,1,0,0,0,0,0,0,,"レンタカー,徒歩",0,1,0,0,0,1,0,0,,大変満足,好きなタイミングで移動できるから,1泊,"10,000円以上 20,000円未満","5,000円以上 10,000円未満","10,000円以上 20,000円未満","10,000円以上 20,000円未満",初めて,,必ず来たい,半年-1年後,大変満足,想像以上に自然が素晴らしいし、人が優しい,10,同上,ない,,なかやんばる(名護市・本部町・今帰仁村),古宇利島(オーシャンタワー/ハートロック),,南部,首里城公園,,"10,000円以上 20,000円未満",大変満足,,,10,,女性,1963,千葉県,1500-2000万円未満,海洋博公園・観光拠点エリア,本部町,2026-02-27 13:48:04
6627,5958,4泊,"5,000円以上 10,000円未満","宿でのんびり過ごす,友人・親戚を尋ねる",1,0,0,0,0,0,0,0,0,0,0,0,0,0,0,0,0,0,0,0,1,0,0,,自分ひとり,,友人・知人,0,0,0,0,0,0,0,0,0,0,0,0,0,0,0,1,0,0,0,0,,レンタカー,0,1,0,0,0,0,0,0,,レンタカー,0,1,0,0,0,0,0,0,,満足,,やんばるエリアには宿泊しない,"5,000円未満",使わない,"5,000円未満",使わない,初めて,,やや来たい,1-3年後,満足,,7,,ない,,なかやんばる(名護市・本部町・今帰仁村),古宇利島(オーシャンタワー/ハートロック),,うふやんばる(国頭村・大宜味村・東村),その他,シークワーサーパーク,使わない,満足,,,7,,女性,1999,奈良県,100-200万円未満,辺戸岬観光案内所エリア,国頭村,2026-02-27 14:12:52
6628,5959,2泊,"10,000円以上 20,000円未満","宿でのんびり過ごす,リゾートホテルを楽しむ,地元の美味しいものを食べる",1,1,1,0,0,0,0,0,0,0,0,0,0,0,0,0,0,0,0,0,0,0,0,,パートナー(恋人・夫婦など),,YouTube,0,0,0,0,0,0,0,0,0,0,1,0,0,0,0,0,0,0,0,0,,レンタカー,0,1,0,0,0,0,0,0,,レンタカー,0,1,0,0,0,0,0,0,,満足,,やんばるエリアには宿泊しない,"50,000円以上 100,000円未満","5,000円以上 10,000円未満","10,000円以上 20,000円未満","5,000円未満",2-3回目,半年-1年前,来たい,半年-1年後,普通,,5,,ない,,特になし,特に無し,,門口(じょうぐち)やんばる(金武町・宜野座村・恩納村),その他,,"5,000円未満",普通,,,5,,男性,1965,愛知県,答えられない,おんなの駅エリア,恩納村,2026-02-27 14:35:39
6629,5960,2泊,"5,000円未満","地元の美味しいものを食べる,テーマパーク:沖縄美ら海水族館",0,0,1,0,0,1,0,0,0,0,0,0,0,0,0,0,0,0,0,0,0,0,0,,中学生以上を含む家族(小学生以下は含まない),,"インターネット・アプリ,友人・知人",0,0,0,0,0,0,0,0,0,1,0,0,0,0,0,1,0,0,0,0,,レンタカー,0,1,0,0,0,0,0,0,,徒歩,0,0,0,0,0,1,0,0,,,,1泊,"20,000円以上 30,000円未満","5,000円以上 10,000円未満","10,000円以上 20,000円未満","5,000円未満",2-3回目,5年以上前,必ず来たい,半年-1年後,大変満足,,10,,ない,,中部,その他,道の駅,なかやんばる(名護市・本部町・今帰仁村),沖縄美ら海水族館,,"5,000円未満",満足,,,8,,女性,1972,広島県,800-1000万円未満,万座毛エリア,恩納村,2026-02-27 14:45:00
6630,5961,2泊,"5,000円未満","名所、旧跡の観光,テーマパーク:沖縄美ら海水族館",0,0,0,0,1,1,0,0,0,0,0,0,0,0,0,0,0,0,0,0,0,0,0,,自分ひとり,,"Google map,インターネット・アプリ,YouTube",0,0,0,0,0,0,0,0,1,1,1,0,0,0,0,0,0,0,0,0,,路線バス、高速バス、シャトルバス,0,0,0,0,0,1,0,0,,路線バス,0,0,0,0,1,0,0,0,,普通,運賃が乗車時清算で時間がかかる,1泊,"10,000円以上 20,000円未満","5,000円未満","5,000円未満","5,000円未満",初めて,,やや来たい,1-3年後,普通,レンタカーだったらもっと行動範囲が広がったかなと思うので,6,那覇市内にはない自然がある,ある,車がないと行ける範囲が限られた,なかやんばる(名護市・本部町・今帰仁村),今帰仁城跡,,特になし,特に無し,,"5,000円未満",やや満足,水族館に入館しなくても楽しめる場所がたくさんある,飲食をもう少し充実させて欲しい,6,広さは訪れないとわからない,女性,1966,広島県,200-300万円未満,海洋博公園・観光拠点エリア,本部町,2026-02-27 14:58:48
