5557,4936,5泊,"40,000円以上 50,000円未満","リゾートホテルを楽しむ,買い物、アウトレット,スポーツ観戦や芸能鑑賞(コンサート等),その他",0,1,0,0,0,0,0,0,1,0,0,1,0,0,0,0,0,0,0,0,0,0,1,,自分ひとり,,Google map,0,0,0,0,0,0,0,0,1,0,0,0,0,0,0,0,0,0,0,0,,レンタカー,0,1,0,0,0,0,0,0,,レンタカー,0,1,0,0,0,0,0,0,,大変満足,自分時間ですきにアレンジできるかな,4泊,"50,000円以上 100,000円未満","5,000円以上 10,000円未満","5,000円以上 10,000円未満","30,000円以上 40,000円未満",6-10回目,半年-1年前,必ず来たい,半年-1年後,大変満足,プロ野球キャンプにてほとんどのチームから離れては居るが、道が走りやすいのと変わるがわる景色が良い,10,海と空の山のコントラスト,ない,,特になし,特に無し,,特になし,特に無し,,"10,000円以上 20,000円未満",大変満足,阪神タイガースグッズがある,"限定グッズの種類を増やして欲しい
もしくは、有名な沖縄企業とのコラボグッズ",10,"阪神タイガースのギャラリーがあるのと
ハンバーガーが美味しい",女性,1974,愛知県,200-300万円未満,道の駅ぎのざエリア,宜野座村,2026-02-06 15:29:51
5558,4937,4泊,"30,000円以上 40,000円未満","地元の美味しいものを食べる,テーマパーク:沖縄美ら海水族館,テーマパーク:JUNGLIA,友人・親戚を尋ねる",0,0,1,0,0,1,1,0,0,0,0,0,0,0,0,0,0,0,0,0,1,0,0,,自分ひとり,,"Google map,友人・知人",0,0,0,0,0,0,0,0,1,0,0,0,0,0,0,1,0,0,0,0,,レンタカー,0,1,0,0,0,0,0,0,,レンタカー,0,1,0,0,0,0,0,0,,大変満足,レンタカーなので気ままに移動出来て大変満足してます。,2泊,"30,000円以上 40,000円未満","10,000円以上 20,000円未満","10,000円以上 20,000円未満","5,000円以上 10,000円未満",2-3回目,半年-1年前,来たい,1-3年後,満足,自然が多いし、楽しめることが多いと思う,10,自然遺産がダントツで見せたい。食べ物もハズレがなくなにを食べても美味しい,ない,,特になし,特に無し,,なかやんばる(名護市・本部町・今帰仁村),JUNGLIA,ジャングリアスパでのんびりして来ます,"5,000円未満",大変満足,もう沖縄好きの家族にも勧めました。ビールが本当に美味しくて^_^,"現状のプランでちょうど良いと思います。ガイドさんの説明もプレゼンも大変良かった。長すぎても良くないし、オリオンビールの工場について学べたし、静岡に帰ってもオリオンビールをスーパーで見つけたら絶対買うと思います。
飲みやすいし美味しくて。",10,,女性,1968,静岡県,400-600万円未満,名護市街エリア,名護市,2026-02-06 15:39:35
5559,4938,5泊,"30,000円以上 40,000円未満","宿でのんびり過ごす,リゾートホテルを楽しむ,地元の美味しいものを食べる,テーマパーク:沖縄美ら海水族館,アウトドア:ビーチ・海水浴,ドライブ・ツーリング,その他",1,1,1,0,0,1,0,0,0,0,0,0,1,0,0,0,0,0,0,1,0,0,1,,親,,"Twitter,Instagram",0,0,0,0,0,0,0,0,0,0,0,1,1,0,0,0,0,0,0,0,,レンタカー,0,1,0,0,0,0,0,0,,レンタカー,0,1,0,0,0,0,0,0,,満足,やんばるエリアは渋滞が少なくて、スムーズに行けるのが良い,5泊,"50,000円以上 100,000円未満","30,000円以上 40,000円未満","30,000円以上 40,000円未満","10,000円以上 20,000円未満",2-3回目,半年-1年前,必ず来たい,半年-1年後,満足,ヤンバルクイナがいるなもしれないところを走るのが楽しい。いつか野生のやんばるを見つけたい。,8,海がとても綺麗。人が少ないので、のんびり過ごせるところがとても良い。,ない,,門口(じょうぐち)やんばる(金武町・宜野座村・恩納村),道の駅ぎのざ,,南部,国際通り,,使わない,満足,"2月なので、営業していなかったです。
",,6,,女性,1998,京都府,300-400万円未満,二見以北十区エリア,名護市,2026-02-06 16:05:20
5560,4939,3泊,"10,000円以上 20,000円未満","リゾートホテルを楽しむ,地元の美味しいものを食べる",0,1,1,0,0,0,0,0,0,0,0,0,0,0,0,0,0,0,0,0,0,0,0,,親,,"新聞・雑誌・ガイドブック,YouTube",0,1,0,0,0,0,0,0,0,0,1,0,0,0,0,0,0,0,0,0,,レンタカー,0,1,0,0,0,0,0,0,,レンタカー,0,1,0,0,0,0,0,0,,満足,近くに海もあり、道路が快適だったからです！,1泊,"50,000円以上 100,000円未満","10,000円以上 20,000円未満","10,000円以上 20,000円未満","5,000円未満",初めて,,必ず来たい,1-3年後,大変満足,大浴場や、施設の綺麗さ、サウナ施設などがありとても満足だからです！,10,綺麗な施設で、景色も良いからです！,ない,,うふやんばる(国頭村・大宜味村・東村),辺戸岬,,なかやんばる(名護市・本部町・今帰仁村),沖縄美ら海水族館,,"10,000円以上 20,000円未満",大変満足,,,10,,女性,2005,東京都,1000-1200万円未満,道の駅ゆいゆい国頭エリア,国頭村,2026-02-06 16:18:37
5561,4940,3泊,"5,000円以上 10,000円未満",テーマパーク:沖縄美ら海水族館,0,0,0,0,0,1,0,0,0,0,0,0,0,0,0,0,0,0,0,0,0,0,0,,未就学児を含む家族,,"新聞・雑誌・ガイドブック,Instagram",0,1,0,0,0,0,0,0,0,0,0,0,1,0,0,0,0,0,0,0,,レンタカー,0,1,0,0,0,0,0,0,,レンタカー,0,1,0,0,0,0,0,0,,大変満足,,やんばるエリアには宿泊しない,"5,000円未満","5,000円未満","5,000円未満","5,000円未満",6-10回目,5年以上前,必ず来たい,1-3年後,大変満足,,9,,ない,,中部,その他,,中部,その他,,"5,000円以上 10,000円未満",大変満足,,,9,,女性,1985,埼玉県,400-600万円未満,海洋博公園・観光拠点エリア,本部町,2026-02-06 16:22:17
5562,4941,3泊,"10,000円以上 20,000円未満","リゾートホテルを楽しむ,地元の美味しいものを食べる,花見などの自然鑑賞,名所、旧跡の観光,テーマパーク:沖縄美ら海水族館,お祭りやイベントへの参加・見物,ドライブ・ツーリング",0,1,1,1,1,1,0,0,0,1,0,0,0,0,0,0,0,0,0,1,0,0,0,,パートナー(恋人・夫婦など),,"新聞・雑誌・ガイドブック,観光協会のHP,インターネット・アプリ,YouTube",0,1,0,0,1,0,0,0,0,1,1,0,0,0,0,0,0,0,0,0,,レンタカー,0,1,0,0,0,0,0,0,,レンタカー,0,1,0,0,0,0,0,0,,大変満足,気ままに好きなところに行って好きなだけ時間を使うことができるので。,3泊,"50,000円以上 100,000円未満","10,000円以上 20,000円未満","30,000円以上 40,000円未満","10,000円以上 20,000円未満",6-10回目,半年-1年前,必ず来たい,半年-1年後,大変満足,自然が豊かで、のんびりした雰囲気が最高です。,10,夏はダイビングやシュノーケリング等のマリンスポーツ、冬はホエールウォッチングや桜まつりなど、一年を通して豊かな自然を満喫できるので。,ない,今のままが良いです。（これ以上、観光地化されないで欲しい）,なかやんばる(名護市・本部町・今帰仁村),今帰仁城跡,,なかやんばる(名護市・本部町・今帰仁村),古宇利島(オーシャンタワー/ハートロック),,"5,000円以上 10,000円未満",大変満足,活きのいい美味しい車海老がリーズナブルな価格で楽しめるので。,今、目の前の養殖場はやっていない様でしたが、養殖場が実際に稼働しているところを見たかったです。,10,プリプリのクルマエビがとても美味しいので,男性,1958,神奈川県,400-600万円未満,屋我地エリア,名護市,2026-02-06 18:24:13
5563,4942,2泊,"20,000円以上 30,000円未満","リゾートホテルを楽しむ,地元の美味しいものを食べる,テーマパーク:JUNGLIA",0,1,1,0,0,0,1,0,0,0,0,0,0,0,0,0,0,0,0,0,0,0,0,,友人,,新聞・雑誌・ガイドブック,0,1,0,0,0,0,0,0,0,0,0,0,0,0,0,0,0,0,0,0,,レンタカー,0,1,0,0,0,0,0,0,,レンタカー,0,1,0,0,0,0,0,0,,満足,,2泊,"30,000円以上 40,000円未満","20,000円以上 30,000円未満","20,000円以上 30,000円未満","20,000円以上 30,000円未満",2-3回目,1-3年前,必ず来たい,半年-1年後,やや満足,,6,,ない,,うふやんばる(国頭村・大宜味村・東村),塩屋湾,,中部,むら咲むら,,"10,000円以上 20,000円未満",満足,,,6,,男性,1989,東京都,1200-1500万円未満,-,-,2026-02-06 18:44:27
5564,4943,2泊,"5,000円以上 10,000円未満","宿でのんびり過ごす,テーマパーク:JUNGLIA,その他",1,0,0,0,0,0,1,0,0,0,0,0,0,0,0,0,0,0,0,0,0,0,1,サウナ,友人,,"新聞・雑誌・ガイドブック,Instagram",0,1,0,0,0,0,0,0,0,0,0,0,1,0,0,0,0,0,0,0,,レンタカー,0,1,0,0,0,0,0,0,,レンタカー,0,1,0,0,0,0,0,0,,満足,,2泊,"30,000円以上 40,000円未満",使わない,"10,000円以上 20,000円未満","5,000円以上 10,000円未満",6-10回目,1-3年前,必ず来たい,1-3年後,満足,亜熱帯のここにしかない自然がある,10,やんばるの自然。亜熱帯雨林,ある,自然ツアーの申し込みがあまり明瞭じゃない,うふやんばる(国頭村・大宜味村・東村),その他,きじょか小学校,なかやんばる(名護市・本部町・今帰仁村),JUNGLIA,,"5,000円未満",満足,メニューがお手頃で味もおいしい,,7,,男性,1989,東京都,1000-1200万円未満,-,-,2026-02-06 18:44:57
5565,4944,3泊,"10,000円以上 20,000円未満","リゾートホテルを楽しむ,地元の美味しいものを食べる,花見などの自然鑑賞,名所、旧跡の観光,テーマパーク:沖縄美ら海水族館,お祭りやイベントへの参加・見物,アウトドア:ビーチ・海水浴,まちあるき・集落散策,ドライブ・ツーリング",0,1,1,1,1,1,0,0,0,1,0,0,1,0,0,0,1,0,0,1,0,0,0,,パートナー(恋人・夫婦など),,"新聞・雑誌・ガイドブック,観光協会のHP,美ら海水族館等の観光関連事業者HP,宿泊事業者のHP,インターネット・アプリ,Instagram,宿泊施設",0,1,0,0,1,1,1,0,0,1,0,0,1,0,0,0,0,0,1,0,,レンタカー,0,1,0,0,0,0,0,0,,レンタカー,0,1,0,0,0,0,0,0,,大変満足,レンタカーは好きな時間や場所、マイペースで観光や外出が出来て毎回、旅で大満足です。毎回レンタカーは必須です。,3泊,"40,000円以上 50,000円未満","10,000円以上 20,000円未満","30,000円以上 40,000円未満","10,000円以上 20,000円未満",6-10回目,半年-1年前,必ず来たい,半年-1年後,大変満足,自然が豊かで地元の人柄も温かく感じ良く、気持ちが癒される。食べ物も大変美味しい。海や空も大変綺麗で夏ならシュノーケルで大満足。世界遺産の今帰仁も素晴らしい。今回は北部の桜祭り、そしてホエールウォッチイングでザトウクジラを何回も見れて胸がいっぱいになり大感動しました。,10,沖縄の中でも大自然の素晴らしさと海や海の中、空の美しさ、那覇にはない沖縄の本来の姿です。今回はザトウクジラが素晴らしすぎました。前回はヤンバルクイナを見て感動しました。本当素敵で素晴らしい所でまたすぐ来たくなります。,ない,今のままでいて欲しいです。これ以上観光化され自然が失われないようにと心から願います。,なかやんばる(名護市・本部町・今帰仁村),今帰仁城跡,,なかやんばる(名護市・本部町・今帰仁村),古宇利島(オーシャンタワー/ハートロック),,"5,000円以上 10,000円未満",大変満足,こんなに美味しい車海老を食べた事はなかったです。新鮮で揚げたものは頭から全部食べられること、お刺身も大変美味しく大満足です。素晴らしかったです。,今後も変わらず、美味しい新鮮な車海老に期待しています。,10,この美味しさは食べてみてわかりますが、定食でお刺身、揚げ、茹で、焼きを全部おすすめします。もずくも美味しかった。,女性,1962,神奈川県,400-600万円未満,屋我地エリア,名護市,2026-02-06 19:15:08
5566,4945,7泊以上,"40,000円以上 50,000円未満","リゾートホテルを楽しむ,地元の美味しいものを食べる,花見などの自然鑑賞,名所、旧跡の観光",0,1,1,1,1,0,0,0,0,0,0,0,0,0,0,0,0,0,0,0,0,0,0,,親,,"Google map,YouTube,Instagram",0,0,0,0,0,0,0,0,1,0,1,0,1,0,0,0,0,0,0,0,,レンタカー,0,1,0,0,0,0,0,0,,レンタカー,0,1,0,0,0,0,0,0,,満足,"レンタカーで借りられる車に当たり外れがある。
今回はちょっとボロすぎ",3泊,"10,000円以上 20,000円未満","5,000円以上 10,000円未満","10,000円以上 20,000円未満","10,000円以上 20,000円未満",2-3回目,半年-1年前,必ず来たい,半年-1年後,満足,"星が綺麗で海が綺麗
自然がとにかく美しい",10,"何もないところが素敵
あるのは満点の星空と海と雲
のんびりしたい時に最高
都会では味わえない贅沢",ある,"辺戸岬から宜野座方面に向かう道で、本当に何もない
ガス欠や故障すると困るなぁって思いました
あと、トイレもなかったこと。",門口(じょうぐち)やんばる(金武町・宜野座村・恩納村),道の駅ぎのざ,,うふやんばる(国頭村・大宜味村・東村),辺戸岬,,"5,000円以上 10,000円未満",満足,"夜の海で星を眺めながら横になれて最高でした
",水圧で空飛ぶアクティビティ,7,"雰囲気がとても良い
大きな白い砂浜プライベートビーチは圧巻",女性,1966,熊本県,1200-1500万円未満,道の駅ゆいゆい国頭エリア,国頭村,2026-02-06 21:24:46
5567,4946,3泊,"5,000円未満",スポーツ観戦や芸能鑑賞(コンサート等),0,0,0,0,0,0,0,0,0,0,0,1,0,0,0,0,0,0,0,0,0,0,0,,友人,,新聞・雑誌・ガイドブック,0,1,0,0,0,0,0,0,0,0,0,0,0,0,0,0,0,0,0,0,,レンタカー,0,1,0,0,0,0,0,0,,レンタカー,0,1,0,0,0,0,0,0,,大変満足,自由に動ける,やんばるエリアには宿泊しない,"5,000円未満","5,000円未満","5,000円未満","5,000円以上 10,000円未満",初めて,,必ず来たい,1-3年後,満足,楽しかった,10,楽しいから,ない,ない,中部,残波岬,,なかやんばる(名護市・本部町・今帰仁村),沖縄美ら海水族館,,"5,000円未満",やや不満,タイガースのコラボグッズが可愛くない,飲食店の営業時間を長くしてほしい,8,じゃがめんを食べてほしい,男性,1974,兵庫県,300-400万円未満,道の駅ぎのざエリア,宜野座村,2026-02-06 23:22:59