Synergy!ID,HistoryID,宿泊数(県内),交通費,訪問目的(やんばるエリア)_ALL,訪問目的(やんばるエリア)_宿でのんびり過ごす,訪問目的(やんばるエリア)_リゾートホテルを楽しむ,訪問目的(やんばるエリア)_地元の美味しいものを食べる,訪問目的(やんばるエリア)_花見などの自然鑑賞,訪問目的(やんばるエリア)_名所、旧跡の観光,訪問目的(やんばるエリア)_テーマパーク:沖縄美ら海水族館,訪問目的(やんばるエリア)_テーマパーク:JUNGLIA,訪問目的(やんばるエリア)_テーマパーク:その他,訪問目的(やんばるエリア)_買い物、アウトレット,訪問目的(やんばるエリア)_お祭りやイベントへの参加・見物,訪問目的(やんばるエリア)_地域の行事,訪問目的(やんばるエリア)_スポーツ観戦や芸能鑑賞(コンサート等),訪問目的(やんばるエリア)_アウトドア:ビーチ・海水浴,訪問目的(やんばるエリア)_アウトドア:マリンスポーツ,訪問目的(やんばるエリア)_アウトドア:登山・トレッキング,訪問目的(やんばるエリア)_アウトドア:キャンプ,訪問目的(やんばるエリア)_まちあるき・集落散策,訪問目的(やんばるエリア)_各種体験(手作り、果物狩りなど),訪問目的(やんばるエリア)_その他スポーツ(ゴルフ、テニスなど),訪問目的(やんばるエリア)_ドライブ・ツーリング,訪問目的(やんばるエリア)_友人・親戚を尋ねる,訪問目的(やんばるエリア)_出張など仕事関係,訪問目的(やんばるエリア)_その他,訪問目的(やんばるエリア)_その他_text,同行者(やんばるエリア),同行者(やんばるエリア)_その他_text,情報収集(やんばるエリア)_ALL,情報収集(やんばるエリア)_観光展・物産展,情報収集(やんばるエリア)_新聞・雑誌・ガイドブック,情報収集(やんばるエリア)_TV・ラジオ番組やCM,情報収集(やんばるエリア)_観光パンフレット・ポスター,情報収集(やんばるエリア)_観光協会のHP,情報収集(やんばるエリア)_美ら海水族館等の観光関連事業者HP,情報収集(やんばるエリア)_宿泊事業者のHP,情報収集(やんばるエリア)_Chat GPT等の生成AI,情報収集(やんばるエリア)_Google map,情報収集(やんばるエリア)_インターネット・アプリ,情報収集(やんばるエリア)_YouTube,情報収集(やんばるエリア)_Twitter,情報収集(やんばるエリア)_Instagram,情報収集(やんばるエリア)_Facebook,情報収集(やんばるエリア)_ブログ,情報収集(やんばるエリア)_友人・知人,情報収集(やんばるエリア)_観光協会・空港・道の駅等の案内所,情報収集(やんばるエリア)_タクシードライバーや地元の人,情報収集(やんばるエリア)_宿泊施設,情報収集(やんばるエリア)_その他,情報収集(やんばるエリア)_その他_text,やんばるエリアまでの交通手段_ALL,やんばるエリアまでの交通手段_自家用車,やんばるエリアまでの交通手段_レンタカー,やんばるエリアまでの交通手段_ヘリコプター,やんばるエリアまでの交通手段_旅行会社ツアーバス,やんばるエリアまでの交通手段_フェリー,やんばるエリアまでの交通手段_路線バス、高速バス、シャトルバス,やんばるエリアまでの交通手段_タクシー,やんばるエリアまでの交通手段_その他,やんばるエリアまでの交通手段_その他_text,やんばるエリア内での交通手段_ALL,やんばるエリア内での交通手段_自家用車,やんばるエリア内での交通手段_レンタカー,やんばるエリア内での交通手段_タクシー,やんばるエリア内での交通手段_旅行会社ツアーバス,やんばるエリア内での交通手段_路線バス,やんばるエリア内での交通手段_徒歩,やんばるエリア内での交通手段_レンタサイクル,やんばるエリア内での交通手段_その他,やんばるエリア内での交通手段_その他_text,やんばるエリア内での交通手段の満足度,やんばるエリア内での交通手段の満足度の理由,宿泊数(やんばるエリア),宿泊費(やんばるエリア),観光費(やんばるエリア),飲食費(やんばるエリア),土産費(やんばるエリア),訪問回数(やんばるエリア),前回訪問時期(やんばるエリア),今後の来訪意向(やんばるエリア),今後の来訪時期(やんばるエリア),体験・サービス満足度(やんばるエリア),体験・サービス満足度の理由(やんばるエリア),推奨度(やんばるエリア),推奨項目(やんばるエリア),改善点(やんばるエリア),改善点の内容(やんばるエリア),回答前に訪問したエリア(調査地),回答前に訪問した主な施設(調査地),回答前に訪問した主な施設・その他(調査地),回答後に訪問予定のエリア(調査地),回答後に訪問予定の主な施設(調査地),回答後に訪問予定の主な施設・その他(調査地),現地消費額(調査地),体験・サービス満足度(調査地),体験・サービス満足度の理由(調査地),施設に求めるもの(調査地),施設推奨度(調査地),施設推奨項目(調査地),性別,生年,都道府県,世帯年収,訪問地のエリア名,訪問地の市町村,回答日時
6767,6090,5泊,"10,000円以上 20,000円未満",出張など仕事関係,0,0,0,0,0,0,0,0,0,0,0,0,0,0,0,0,0,0,0,0,0,1,0,,職場の同僚,,"観光協会のHP,Chat GPT等の生成AI,Google map",0,0,0,0,1,0,0,1,1,0,0,0,0,0,0,0,0,0,0,0,,路線バス、高速バス、シャトルバス,0,0,0,0,0,1,0,0,,レンタカー,0,1,0,0,0,0,0,0,,大変満足,"社内が清潔で良かったから
ただエンジンが経年劣化していた為、運転してて心配になった。",5泊,"30,000円以上 40,000円未満","5,000円以上 10,000円未満","5,000円未満","5,000円以上 10,000円未満",初めて,,必ず来たい,3-5年後,大変満足,人の温かさや自然の豊かを感じられて最高でした。,10,圧倒的な大自然です。,ある,"やんばるエリアに行くためのバスの本数を増やして欲しいです。
土日で利用していたのですが、バスの乗車しきれない人がいたので、土日だけでも本数を増やしてもらえるとありがたいです。",特になし,特に無し,,中部,その他,空港,"5,000円以上 10,000円未満",大変満足,"フェリーの施設内がめっちゃ清潔感があった為です。
普段関東の大型フェリーに乗るのですが、こちらの方が綺麗でした。",フェリーの乗船下船乗り場のお土産の種類を増やして欲しいです。,10,"ビーチ

人もそんなに多くなく、めっちゃクチャ綺麗な十二分に堪能できるから",男性,1996,神奈川県,600-800万円未満,伊是名エリア,伊是名村,2026-03-06 8:51:31
6768,6091,6泊,"20,000円以上 30,000円未満","花見などの自然鑑賞,名所、旧跡の観光,テーマパーク:沖縄美ら海水族館,買い物、アウトレット,アウトドア:登山・トレッキング",0,0,0,1,1,1,0,0,1,0,0,0,0,0,1,0,0,0,0,0,0,0,0,,友人,,"インターネット・アプリ,ブログ,観光協会・空港・道の駅等の案内所,タクシードライバーや地元の人,宿泊施設",0,0,0,0,0,0,0,0,0,1,0,0,0,0,1,0,1,1,1,0,,旅行会社ツアーバス,0,0,0,1,0,0,0,0,,旅行会社ツアーバス,0,0,0,1,0,0,0,0,,大変満足,レンタカーなど利用ができない為大変助かります。,やんばるエリアには宿泊しない,使わない,"5,000円以上 10,000円未満","5,000円以上 10,000円未満","5,000円未満",2-3回目,5年以上前,必ず来たい,半年-1年後,やや満足,ツアーなので、スケジュールの範囲でしか楽しめない為,7,"アスムイハクスなどの自然は素晴らしく、
また子供達にも良い体験ができると感じました。",ある,トイレの整備や、食事ができる場所が少ない感じがしましたが、自然を守る上ではありかと思いました,うふやんばる(国頭村・大宜味村・東村),辺戸岬,,門口(じょうぐち)やんばる(金武町・宜野座村・恩納村),恩納村海岸(青の洞窟),,"5,000円未満",やや満足,時間がなかったから,サータアンダギーのお店最高です,7,リラックスしてスイーツなど堪能できるから。,女性,1966,東京都,答えられない,万座毛エリア,恩納村,2026-03-06 10:25:40
6769,6092,7泊以上,"20,000円以上 30,000円未満",名所、旧跡の観光,0,0,0,0,1,0,0,0,0,0,0,0,0,0,0,0,0,0,0,0,0,0,0,,自分ひとり,,Google map,0,0,0,0,0,0,0,0,1,0,0,0,0,0,0,0,0,0,0,0,,レンタカー,0,1,0,0,0,0,0,0,,レンタカー,0,1,0,0,0,0,0,0,,満足,,やんばるエリアには宿泊しない,"10,000円以上 20,000円未満","5,000円以上 10,000円未満","5,000円以上 10,000円未満","5,000円以上 10,000円未満",2-3回目,5年以上前,来たい,1-3年後,大変満足,,9,,ない,,なかやんばる(名護市・本部町・今帰仁村),ナゴパイナップルパーク,,南部,国際通り,,"5,000円未満",満足,,,9,,男性,1987,愛知県,800-1000万円未満,万座毛エリア,恩納村,2026-03-06 15:03:20
6770,6093,7泊以上,"100,000円以上","宿でのんびり過ごす,ドライブ・ツーリング",1,0,0,0,0,0,0,0,0,0,0,0,0,0,0,0,0,0,0,1,0,0,0,,自分ひとり,,"観光協会のHP,インターネット・アプリ,観光協会・空港・道の駅等の案内所",0,0,0,0,1,0,0,0,0,1,0,0,0,0,0,0,1,0,0,0,,レンタカー,0,1,0,0,0,0,0,0,,レンタカー,0,1,0,0,0,0,0,0,,満足,信号が少ない,7泊以上,"100,000円以上 200,000円未満","5,000円以上 10,000円未満","30,000円以上 40,000円未満","5,000円未満",6-10回目,半年-1年前,必ず来たい,半年-1年後,不満,ジャングリアを期待していたが気球も上がらず、期待外れ,8,豊かな自然や海の綺麗さがバツグンだから,ある,各施設に洗浄付便座がなかったこと,その他離島,特に無し,石垣島,うふやんばる(国頭村・大宜味村・東村),辺戸岬,,"5,000円以上 10,000円未満",やや満足,料理はよかったが注文を聞きに来てくれなかった。,特に無し,6,味が良かった,男性,1961,兵庫県,600-800万円未満,屋我地エリア,名護市,2026-03-06 15:14:04
6771,6094,4泊,"5,000円以上 10,000円未満",テーマパーク:沖縄美ら海水族館,0,0,0,0,0,1,0,0,0,0,0,0,0,0,0,0,0,0,0,0,0,0,0,,パートナー(恋人・夫婦など),,"インターネット・アプリ,YouTube,Instagram",0,0,0,0,0,0,0,0,0,1,1,0,1,0,0,0,0,0,0,0,,路線バス、高速バス、シャトルバス,0,0,0,0,0,1,0,0,,路線バス,0,0,0,0,1,0,0,0,,満足,,1泊,"10,000円以上 20,000円未満","5,000円未満","5,000円未満","5,000円未満",初めて,,必ず来たい,半年-1年後,大変満足,,10,,ない,,特になし,特に無し,,その他離島,特に無し,,"5,000円未満",大変満足,,,10,,女性,1979,東京都,300-400万円未満,海洋博公園・観光拠点エリア,本部町,2026-03-06 16:23:04
6772,6095,4泊,"10,000円以上 20,000円未満","宿でのんびり過ごす,リゾートホテルを楽しむ,地元の美味しいものを食べる,テーマパーク:その他,アウトドア:ビーチ・海水浴,ドライブ・ツーリング",1,1,1,0,0,0,0,1,0,0,0,0,1,0,0,0,0,0,0,1,0,0,0,,未就学児を含む家族,,"新聞・雑誌・ガイドブック,観光パンフレット・ポスター,Chat GPT等の生成AI,Google map,インターネット・アプリ,YouTube,Instagram",0,1,0,1,0,0,0,1,1,1,1,0,1,0,0,0,0,0,0,0,,レンタカー,0,1,0,0,0,0,0,0,,レンタカー,0,1,0,0,0,0,0,0,,満足,途中で気になる店に寄ったり、休憩したりなど、自分たちのペースで移動できるから。,3泊,"20,000円以上 30,000円未満","5,000円以上 10,000円未満","10,000円以上 20,000円未満","5,000円未満",4-5回目,3-5年前,必ず来たい,3-5年後,大変満足,レンタカーでアクセスしやすく、美しい自然や沖縄の原風景を感じることができ、飲食店や観光施設も豊富で利便性も高いと感じるから。,8,やんばるエリアとひとくちにいっても、名護周辺や辺戸岬付近、恩納村など行く場所によって本当に様々な魅力があり、何度いっても飽きないから。,ない,,南部,おきなわワールド,,なかやんばる(名護市・本部町・今帰仁村),その他,オンザビーチ・ルー,"5,000円未満",満足,工場見学のあと、おいしい飲み物でリフレッシュできてよい思い出になったから。おみやげも買えてよかった。,特にない。,7,ビールが好きな人にはより楽しいと思う。私はアルコールを飲まないが楽しめた。小さい子ども連れだと途中で飽きるので難しいかも。,女性,1987,青森県,800-1000万円未満,名護市街エリア,名護市,2026-03-06 16:50:56
6773,6096,2泊,"10,000円以上 20,000円未満","リゾートホテルを楽しむ,地元の美味しいものを食べる,テーマパーク:沖縄美ら海水族館",0,1,1,0,0,1,0,0,0,0,0,0,0,0,0,0,0,0,0,0,0,0,0,,中学生以上を含む家族(小学生以下は含まない),,"観光展・物産展,美ら海水族館等の観光関連事業者HP,友人・知人",1,0,0,0,0,1,0,0,0,0,0,0,0,0,0,1,0,0,0,0,,路線バス、高速バス、シャトルバス,0,0,0,0,0,1,0,0,,"路線バス,徒歩",0,0,0,0,1,1,0,0,,普通,,2泊,"30,000円以上 40,000円未満","10,000円以上 20,000円未満","10,000円以上 20,000円未満","10,000円以上 20,000円未満",初めて,,来たい,3-5年後,満足,,8,,ない,,特になし,特に無し,,なかやんばる(名護市・本部町・今帰仁村),沖縄美ら海水族館,,"10,000円以上 20,000円未満",満足,,,8,,男性,1973,大阪府,600-800万円未満,海洋博公園・観光拠点エリア,本部町,2026-03-06 18:46:38