Synergy!ID,HistoryID,宿泊数(県内),交通費,訪問目的(やんばるエリア)_ALL,訪問目的(やんばるエリア)_宿でのんびり過ごす,訪問目的(やんばるエリア)_リゾートホテルを楽しむ,訪問目的(やんばるエリア)_地元の美味しいものを食べる,訪問目的(やんばるエリア)_花見などの自然鑑賞,訪問目的(やんばるエリア)_名所、旧跡の観光,訪問目的(やんばるエリア)_テーマパーク:沖縄美ら海水族館,訪問目的(やんばるエリア)_テーマパーク:JUNGLIA,訪問目的(やんばるエリア)_テーマパーク:その他,訪問目的(やんばるエリア)_買い物、アウトレット,訪問目的(やんばるエリア)_お祭りやイベントへの参加・見物,訪問目的(やんばるエリア)_地域の行事,訪問目的(やんばるエリア)_スポーツ観戦や芸能鑑賞(コンサート等),訪問目的(やんばるエリア)_アウトドア:ビーチ・海水浴,訪問目的(やんばるエリア)_アウトドア:マリンスポーツ,訪問目的(やんばるエリア)_アウトドア:登山・トレッキング,訪問目的(やんばるエリア)_アウトドア:キャンプ,訪問目的(やんばるエリア)_まちあるき・集落散策,訪問目的(やんばるエリア)_各種体験(手作り、果物狩りなど),訪問目的(やんばるエリア)_その他スポーツ(ゴルフ、テニスなど),訪問目的(やんばるエリア)_ドライブ・ツーリング,訪問目的(やんばるエリア)_友人・親戚を尋ねる,訪問目的(やんばるエリア)_出張など仕事関係,訪問目的(やんばるエリア)_その他,訪問目的(やんばるエリア)_その他_text,同行者(やんばるエリア),同行者(やんばるエリア)_その他_text,情報収集(やんばるエリア)_ALL,情報収集(やんばるエリア)_観光展・物産展,情報収集(やんばるエリア)_新聞・雑誌・ガイドブック,情報収集(やんばるエリア)_TV・ラジオ番組やCM,情報収集(やんばるエリア)_観光パンフレット・ポスター,情報収集(やんばるエリア)_観光協会のHP,情報収集(やんばるエリア)_美ら海水族館等の観光関連事業者HP,情報収集(やんばるエリア)_宿泊事業者のHP,情報収集(やんばるエリア)_Chat GPT等の生成AI,情報収集(やんばるエリア)_Google map,情報収集(やんばるエリア)_インターネット・アプリ,情報収集(やんばるエリア)_YouTube,情報収集(やんばるエリア)_Twitter,情報収集(やんばるエリア)_Instagram,情報収集(やんばるエリア)_Facebook,情報収集(やんばるエリア)_ブログ,情報収集(やんばるエリア)_友人・知人,情報収集(やんばるエリア)_観光協会・空港・道の駅等の案内所,情報収集(やんばるエリア)_タクシードライバーや地元の人,情報収集(やんばるエリア)_宿泊施設,情報収集(やんばるエリア)_その他,情報収集(やんばるエリア)_その他_text,やんばるエリアまでの交通手段_ALL,やんばるエリアまでの交通手段_自家用車,やんばるエリアまでの交通手段_レンタカー,やんばるエリアまでの交通手段_ヘリコプター,やんばるエリアまでの交通手段_旅行会社ツアーバス,やんばるエリアまでの交通手段_フェリー,やんばるエリアまでの交通手段_路線バス、高速バス、シャトルバス,やんばるエリアまでの交通手段_タクシー,やんばるエリアまでの交通手段_その他,やんばるエリアまでの交通手段_その他_text,やんばるエリア内での交通手段_ALL,やんばるエリア内での交通手段_自家用車,やんばるエリア内での交通手段_レンタカー,やんばるエリア内での交通手段_タクシー,やんばるエリア内での交通手段_旅行会社ツアーバス,やんばるエリア内での交通手段_路線バス,やんばるエリア内での交通手段_徒歩,やんばるエリア内での交通手段_レンタサイクル,やんばるエリア内での交通手段_その他,やんばるエリア内での交通手段_その他_text,やんばるエリア内での交通手段の満足度,やんばるエリア内での交通手段の満足度の理由,宿泊数(やんばるエリア),宿泊費(やんばるエリア),観光費(やんばるエリア),飲食費(やんばるエリア),土産費(やんばるエリア),訪問回数(やんばるエリア),前回訪問時期(やんばるエリア),今後の来訪意向(やんばるエリア),今後の来訪時期(やんばるエリア),体験・サービス満足度(やんばるエリア),体験・サービス満足度の理由(やんばるエリア),推奨度(やんばるエリア),推奨項目(やんばるエリア),改善点(やんばるエリア),改善点の内容(やんばるエリア),回答前に訪問したエリア(調査地),回答前に訪問した主な施設(調査地),回答前に訪問した主な施設・その他(調査地),回答後に訪問予定のエリア(調査地),回答後に訪問予定の主な施設(調査地),回答後に訪問予定の主な施設・その他(調査地),現地消費額(調査地),体験・サービス満足度(調査地),体験・サービス満足度の理由(調査地),施設に求めるもの(調査地),施設推奨度(調査地),施設推奨項目(調査地),性別,生年,都道府県,世帯年収,訪問地のエリア名,訪問地の市町村,回答日時
5534,4918,2泊,"10,000円以上 20,000円未満","リゾートホテルを楽しむ,地元の美味しいものを食べる,スポーツ観戦や芸能鑑賞(コンサート等),ドライブ・ツーリング",0,1,1,0,0,0,0,0,0,0,0,1,0,0,0,0,0,0,0,1,0,0,0,,中学生以上を含む家族(小学生以下は含まない),,"Google map,インターネット・アプリ",0,0,0,0,0,0,0,0,1,1,0,0,0,0,0,0,0,0,0,0,,レンタカー,0,1,0,0,0,0,0,0,,レンタカー,0,1,0,0,0,0,0,0,,満足,"電車がなく車移動が必須。
行きたいところは1時間以内に回れる。",2泊,"50,000円以上 100,000円未満","5,000円以上 10,000円未満","5,000円以上 10,000円未満","5,000円以上 10,000円未満",2-3回目,半年-1年前,来たい,1-3年後,満足,"自然豊かなところ。海が近くて見晴らしがいい。
",10,美ら海水族館,ある,去年ですが基地の開発のためか石や砂を運んだトラックや重機が道路を通り景観が悪かった。,中部,美浜アメリカンビレッジ,,南部,その他,斎場御嶽、知念岬公園、国際通り,"5,000円以上 10,000円未満",満足,"阪神タイガースの限定グッズを購入。
",安価なサーターアンダギーやフルーツまたはフルーツジュース,8,右側の食べ物屋さんの雰囲気が沖縄らしさがあって良かった。,女性,2001,大阪府,答えられない,道の駅ぎのざエリア,宜野座村,2026-02-06 7:20:47
5535,4919,1泊,"10,000円以上 20,000円未満","リゾートホテルを楽しむ,地元の美味しいものを食べる,アウトドア:キャンプ",0,1,1,0,0,0,0,0,0,0,0,0,0,0,0,1,0,0,0,0,0,0,0,,パートナー(恋人・夫婦など),,友人・知人,0,0,0,0,0,0,0,0,0,0,0,0,0,0,0,1,0,0,0,0,,自家用車,1,0,0,0,0,0,0,0,,自家用車,1,0,0,0,0,0,0,0,,,,1泊,"5,000円以上 10,000円未満",使わない,"5,000円未満",使わない,11回目以上,半年以内,必ず来たい,半年以内,大変満足,,10,,ない,,うふやんばる(国頭村・大宜味村・東村),福地川海浜公園,,特になし,特に無し,,"5,000円以上 10,000円未満",大変満足,,,10,,女性,1996,沖縄県,100万円未満,川田・宮城・高江エリア,東村,2026-02-06 7:26:12
5537,4920,2泊,"5,000円未満","リゾートホテルを楽しむ,地元の美味しいものを食べる,アウトドア:登山・トレッキング",0,1,1,0,0,0,0,0,0,0,0,0,0,0,1,0,0,0,0,0,0,0,0,,パートナー(恋人・夫婦など),,"宿泊事業者のHP,インターネット・アプリ,Instagram",0,0,0,0,0,0,1,0,0,1,0,0,1,0,0,0,0,0,0,0,,レンタカー,0,1,0,0,0,0,0,0,,レンタカー,0,1,0,0,0,0,0,0,,大変満足,那覇空港からはレンタカーが便利,2泊,"100,000円以上 200,000円未満","50,000円以上 100,000円未満","5,000円以上 10,000円未満","5,000円以上 10,000円未満",4-5回目,1-3年前,必ず来たい,1-3年後,大変満足,ヤンバルクイナ保護活動や自然保護活動に賛同しているため,10,自然豊かなこと土地を守って欲しいため色々な方に来ていただきたい,ある,"何も手を付けて欲しくない
環境破壊となるような施設は作ってほしくない
でも、たくさんの方に来ていただきたい",特になし,特に無し,,うふやんばる(国頭村・大宜味村・東村),やんばる野生生物保護センター,,"5,000円以上 10,000円未満",大変満足,"4度目です
変わらない風景にホッとします",今のままで満足です,10,"自然豊かなこと
海が綺麗なこと",女性,1961,埼玉県,800-1000万円未満,道の駅ゆいゆい国頭エリア,国頭村,2026-02-06 7:38:27
5538,4921,日帰り,"5,000円未満",テーマパーク:沖縄美ら海水族館,0,0,0,0,0,1,0,0,0,0,0,0,0,0,0,0,0,0,0,0,0,0,0,,親,,美ら海水族館等の観光関連事業者HP,0,0,0,0,0,1,0,0,0,0,0,0,0,0,0,0,0,0,0,0,,自家用車,1,0,0,0,0,0,0,0,,自家用車,1,0,0,0,0,0,0,0,,,,やんばるエリアには宿泊しない,"5,000円未満","5,000円以上 10,000円未満","5,000円未満","5,000円未満",6-10回目,半年以内,必ず来たい,半年-1年後,大変満足,,10,,ある,渋滞,特になし,特に無し,,特になし,特に無し,,"5,000円以上 10,000円未満",大変満足,,,10,,女性,2001,沖縄県,答えられない,海洋博公園・観光拠点エリア,本部町,2026-02-06 7:59:08
5539,4922,3泊,"30,000円以上 40,000円未満","テーマパーク:沖縄美ら海水族館,テーマパーク:JUNGLIA",0,0,0,0,0,1,1,0,0,0,0,0,0,0,0,0,0,0,0,0,0,0,0,,小学生を含む家族(未就学児は含まない),,"新聞・雑誌・ガイドブック,観光パンフレット・ポスター,美ら海水族館等の観光関連事業者HP",0,1,0,1,0,1,0,0,0,0,0,0,0,0,0,0,0,0,0,0,,レンタカー,0,1,0,0,0,0,0,0,,レンタカー,0,1,0,0,0,0,0,0,,普通,,2泊,"20,000円以上 30,000円未満","20,000円以上 30,000円未満","10,000円以上 20,000円未満","40,000円以上 50,000円未満",2-3回目,3-5年前,必ず来たい,3-5年後,大変満足,,10,,ない,,なかやんばる(名護市・本部町・今帰仁村),JUNGLIA,,南部,首里城公園,,"10,000円以上 20,000円未満",大変満足,,,10,,女性,1987,兵庫県,300-400万円未満,海洋博公園・観光拠点エリア,本部町,2026-02-06 9:48:41
5540,4923,3泊,"5,000円以上 10,000円未満",リゾートホテルを楽しむ,0,1,0,0,0,0,0,0,0,0,0,0,0,0,0,0,0,0,0,0,0,0,0,,親,,Instagram,0,0,0,0,0,0,0,0,0,0,0,0,1,0,0,0,0,0,0,0,,レンタカー,0,1,0,0,0,0,0,0,,レンタカー,0,1,0,0,0,0,0,0,,満足,公共交通機関のアクセスが良くないため,3泊,"20,000円以上 30,000円未満","10,000円以上 20,000円未満","10,000円以上 20,000円未満","5,000円以上 10,000円未満",4-5回目,半年-1年前,やや来たい,半年-1年後,満足,ホテルが良かった,5,うみ,ない,,中部,美浜アメリカンビレッジ,,特になし,特に無し,,使わない,やや満足,,,4,,女性,1997,東京都,200-300万円未満,真栄田岬エリア,恩納村,2026-02-06 10:41:22
5543,4924,4泊,"30,000円以上 40,000円未満","地元の美味しいものを食べる,名所、旧跡の観光,お祭りやイベントへの参加・見物,アウトドア:ビーチ・海水浴,アウトドア:登山・トレッキング",0,0,1,0,1,0,0,0,0,1,0,0,1,0,1,0,0,0,0,0,0,0,0,,友人,,"Chat GPT等の生成AI,Google map",0,0,0,0,0,0,0,1,1,0,0,0,0,0,0,0,0,0,0,0,,レンタカー,0,1,0,0,0,0,0,0,,レンタカー,0,1,0,0,0,0,0,0,,満足,Safe road conditions ,4泊,"50,000円以上 100,000円未満","10,000円以上 20,000円未満","5,000円以上 10,000円未満","5,000円以上 10,000円未満",初めて,,来たい,1-3年後,満足,Nice environment ,8,Forest and beaches ,ない,,中部,,,中部,美浜アメリカンビレッジ,,"5,000円未満",やや満足,,,8,,女性,1983,沖縄県,400-600万円未満,有銘・慶佐次・平良エリア,東村,2026-02-06 11:52:37
5546,4925,2泊,"10,000円以上 20,000円未満","地元の美味しいものを食べる,テーマパーク:沖縄美ら海水族館,テーマパーク:その他",0,0,1,0,0,1,0,1,0,0,0,0,0,0,0,0,0,0,0,0,0,0,0,,未就学児を含む家族,,インターネット・アプリ,0,0,0,0,0,0,0,0,0,1,0,0,0,0,0,0,0,0,0,0,,レンタカー,0,1,0,0,0,0,0,0,,レンタカー,0,1,0,0,0,0,0,0,,満足,,やんばるエリアには宿泊しない,使わない,"5,000円以上 10,000円未満","10,000円以上 20,000円未満","5,000円以上 10,000円未満",2-3回目,1-3年前,来たい,1-3年後,満足,,8,,ない,,南部,国際通り,,なかやんばる(名護市・本部町・今帰仁村),ナゴパイナップルパーク,,"5,000円以上 10,000円未満",満足,,,9,,女性,1986,東京都,800-1000万円未満,海洋博公園・観光拠点エリア,本部町,2026-02-06 13:03:59
5547,4926,2泊,"10,000円以上 20,000円未満","地元の美味しいものを食べる,テーマパーク:沖縄美ら海水族館",0,0,1,0,0,1,0,0,0,0,0,0,0,0,0,0,0,0,0,0,0,0,0,,未就学児を含む家族,,"TV・ラジオ番組やCM,美ら海水族館等の観光関連事業者HP,Instagram,友人・知人",0,0,1,0,0,1,0,0,0,0,0,0,1,0,0,1,0,0,0,0,,レンタカー,0,1,0,0,0,0,0,0,,徒歩,0,0,0,0,0,1,0,0,,,,2泊,"20,000円以上 30,000円未満","5,000円未満","10,000円以上 20,000円未満","10,000円以上 20,000円未満",初めて,,必ず来たい,1-3年後,大変満足,スタッフさん丁寧,10,感動したから,ない,,なかやんばる(名護市・本部町・今帰仁村),沖縄美ら海水族館,,南部,国際通り,,"5,000円未満",大変満足,,,10,,女性,1988,神奈川県,300-400万円未満,海洋博公園・観光拠点エリア,本部町,2026-02-06 13:09:27
5548,4927,5泊,"10,000円以上 20,000円未満","リゾートホテルを楽しむ,名所、旧跡の観光,テーマパーク:沖縄美ら海水族館,買い物、アウトレット,アウトドア:登山・トレッキング,友人・親戚を尋ねる",0,1,0,0,1,1,0,0,1,0,0,0,0,0,1,0,0,0,0,0,1,0,0,,パートナー(恋人・夫婦など),,"新聞・雑誌・ガイドブック,観光協会のHP,美ら海水族館等の観光関連事業者HP,Chat GPT等の生成AI,Google map,YouTube,友人・知人",0,1,0,0,1,1,0,1,1,0,1,0,0,0,0,1,0,0,0,0,,"レンタカー,旅行会社ツアーバス",0,1,0,1,0,0,0,0,,"レンタカー,旅行会社ツアーバス",0,1,0,1,0,0,0,0,,大変満足,各所にトイレがあって助かりました！,2泊,"50,000円以上 100,000円未満","20,000円以上 30,000円未満","30,000円以上 40,000円未満","10,000円以上 20,000円未満",初めて,,必ず来たい,半年以内,大変満足,"プロジェクトXで美ら海水族館を観て、本物を見たくて来ました。
本物を見れて非常に嬉しかったです。
次は両親を連れてきたい！",10,美ら海水族館,ない,,なかやんばる(名護市・本部町・今帰仁村),今帰仁城跡,,門口(じょうぐち)やんばる(金武町・宜野座村・恩納村),万座毛,,"5,000円以上 10,000円未満",大変満足,"広くて、色々な展示があり楽しかったです！
時間が足りないくらいでした。","飲食は、手軽なものがあると嬉しいなと思いました。
ホットドッグやおにぎりなど。
ジューシーのおにぎりや、ポーたまなどがあれば沖縄っぽさもあり、手軽に食べれるので観る時間に多く使えて嬉しいです。",10,,女性,1992,東京都,1000-1200万円未満,海洋博公園・観光拠点エリア,本部町,2026-02-06 13:57:58
5549,4928,日帰り,使わない,"テーマパーク:沖縄美ら海水族館,お祭りやイベントへの参加・見物",0,0,0,0,0,1,0,0,0,1,0,0,0,0,0,0,0,0,0,0,0,0,0,,学校関係(修学旅行・社会見学等),,"美ら海水族館等の観光関連事業者HP,その他",0,0,0,0,0,1,0,0,0,0,0,0,0,0,0,0,0,0,0,1,,旅行会社ツアーバス,0,0,0,1,0,0,0,0,,旅行会社ツアーバス,0,0,0,1,0,0,0,0,,大変満足,,やんばるエリアには宿泊しない,使わない,"5,000円未満","5,000円未満","5,000円未満",6-10回目,半年以内,必ず来たい,半年-1年後,満足,ジャングリアに行ってみたいから,8,美ら海水族館,ない,,なかやんばる(名護市・本部町・今帰仁村),その他,八重岳,南部,その他,特になし,"5,000円未満",大変満足,綺麗だった。おきちゃん劇場が良かった,キッチンカーを充実させて欲しい,9,オキちゃん劇場,女性,1983,沖縄県,400-600万円未満,海洋博公園・観光拠点エリア,本部町,2026-02-06 14:23:38
5550,4929,3泊,"20,000円以上 30,000円未満","リゾートホテルを楽しむ,地元の美味しいものを食べる,アウトドア:マリンスポーツ",0,1,1,0,0,0,0,0,0,0,0,0,0,1,0,0,0,0,0,0,0,0,0,,小学生を含む家族(未就学児は含まない),,新聞・雑誌・ガイドブック,0,1,0,0,0,0,0,0,0,0,0,0,0,0,0,0,0,0,0,0,,レンタカー,0,1,0,0,0,0,0,0,,レンタカー,0,1,0,0,0,0,0,0,,大変満足,森のなかのジップライン、淹れたてのコーヒー最高でした,3泊,"40,000円以上 50,000円未満","20,000円以上 30,000円未満","20,000円以上 30,000円未満","10,000円以上 20,000円未満",6-10回目,半年-1年前,必ず来たい,半年-1年後,大変満足,恩納村でのシュノーケリングも大好きです,10,,ない,,門口(じょうぐち)やんばる(金武町・宜野座村・恩納村),恩納村海岸(青の洞窟),,うふやんばる(国頭村・大宜味村・東村),やんばる野生生物保護センター,,"10,000円以上 20,000円未満",大変満足,,,10,,女性,1972,東京都,答えられない,有銘・慶佐次・平良エリア,東村,2026-02-06 14:29:51
5551,4930,3泊,"10,000円以上 20,000円未満","名所、旧跡の観光,テーマパーク:沖縄美ら海水族館,買い物、アウトレット",0,0,0,0,1,1,0,0,1,0,0,0,0,0,0,0,0,0,0,0,0,0,0,,親,,"新聞・雑誌・ガイドブック,観光パンフレット・ポスター,インターネット・アプリ",0,1,0,1,0,0,0,0,0,1,0,0,0,0,0,0,0,0,0,0,,レンタカー,0,1,0,0,0,0,0,0,,レンタカー,0,1,0,0,0,0,0,0,,満足,ナビが分かりやすい,やんばるエリアには宿泊しない,"20,000円以上 30,000円未満","10,000円以上 20,000円未満","5,000円未満","5,000円未満",初めて,,来たい,1-3年後,満足,食事が美味しかった,8,味覚、視覚、体験で楽しめた,ない,,なかやんばる(名護市・本部町・今帰仁村),沖縄美ら海水族館,,なかやんばる(名護市・本部町・今帰仁村),ナゴパイナップルパーク,,"5,000円以上 10,000円未満",普通,,,8,楽しめそう,女性,1966,埼玉県,400-600万円未満,嵐山エリア,名護市,2026-02-06 14:32:11
5552,4931,3泊,"50,000円以上 100,000円未満","リゾートホテルを楽しむ,ドライブ・ツーリング",0,1,0,0,0,0,0,0,0,0,0,0,0,0,0,0,0,0,0,1,0,0,0,,小学生を含む家族(未就学児は含まない),,"新聞・雑誌・ガイドブック,Google map,インターネット・アプリ",0,1,0,0,0,0,0,0,1,1,0,0,0,0,0,0,0,0,0,0,,レンタカー,0,1,0,0,0,0,0,0,,レンタカー,0,1,0,0,0,0,0,0,,満足,自由に行動できるから,やんばるエリアには宿泊しない,"10,000円以上 20,000円未満","10,000円以上 20,000円未満","5,000円未満","5,000円未満",初めて,,必ず来たい,半年-1年後,大変満足,楽しかったから,10,ジップラインは面白いです,ない,可能であれば道路の整備,中部,その他,リザンホテル,うふやんばる(国頭村・大宜味村・東村),やんばる野生生物保護センター,,"5,000円未満",大変満足,かき氷が美味しい,,10,コーヒーのクオリティが高い,男性,1969,東京都,2000万円以上,有銘・慶佐次・平良エリア,東村,2026-02-06 14:34:08
5553,4932,日帰り,"5,000円未満","地元の美味しいものを食べる,花見などの自然鑑賞,ドライブ・ツーリング",0,0,1,1,0,0,0,0,0,0,0,0,0,0,0,0,0,0,0,1,0,0,0,,パートナー(恋人・夫婦など),,その他,0,0,0,0,0,0,0,0,0,0,0,0,0,0,0,0,0,0,0,1,,自家用車,1,0,0,0,0,0,0,0,,自家用車,1,0,0,0,0,0,0,0,,,,やんばるエリアには宿泊しない,"5,000円未満","5,000円未満","5,000円未満","5,000円未満",11回目以上,半年-1年前,必ず来たい,半年以内,大変満足,県内在住だが、南部に比べて無料で遊べるエリア、飲食にかかる費用が安価でなので家族で遊ぶのに凄く助かる。,10,,ない,,なかやんばる(名護市・本部町・今帰仁村),その他,該当するスポット無し,うふやんばる(国頭村・大宜味村・東村),その他,大宜味村の道の駅,"5,000円未満",大変満足,,,10,"フードコートの充実
値段が安価で良かった",女性,1989,沖縄県,400-600万円未満,道の駅ゆいゆい国頭エリア,国頭村,2026-02-06 15:02:54
5554,4933,3泊,"10,000円以上 20,000円未満","宿でのんびり過ごす,リゾートホテルを楽しむ,地元の美味しいものを食べる,花見などの自然鑑賞,名所、旧跡の観光,アウトドア:マリンスポーツ",1,1,1,1,1,0,0,0,0,0,0,0,0,1,0,0,0,0,0,0,0,0,0,,パートナー(恋人・夫婦など),,"インターネット・アプリ,Instagram",0,0,0,0,0,0,0,0,0,1,0,0,1,0,0,0,0,0,0,0,,自家用車,1,0,0,0,0,0,0,0,,自家用車,1,0,0,0,0,0,0,0,,,,やんばるエリアには宿泊しない,使わない,"10,000円以上 20,000円未満","5,000円未満","5,000円未満",4-5回目,半年以内,必ず来たい,半年以内,大変満足,自然がたくさんで素晴らしい,10,"沖縄の自然を感じられるところ。
植生が素晴らしい",ない,,うふやんばる(国頭村・大宜味村・東村),辺戸岬,,なかやんばる(名護市・本部町・今帰仁村),今帰仁城跡,,"5,000円未満",大変満足,特産物をみるのが楽しい,特にない。,10,,女性,1980,沖縄県,200-300万円未満,芭蕉布会館エリア,大宜味村,2026-02-06 15:21:30
5555,4934,日帰り,"5,000円未満","花見などの自然鑑賞,買い物、アウトレット,まちあるき・集落散策,ドライブ・ツーリング",0,0,0,1,0,0,0,0,1,0,0,0,0,0,0,0,1,0,0,1,0,0,0,,パートナー(恋人・夫婦など),,"TV・ラジオ番組やCM,観光パンフレット・ポスター,インターネット・アプリ",0,0,1,1,0,0,0,0,0,1,0,0,0,0,0,0,0,0,0,0,,自家用車,1,0,0,0,0,0,0,0,,自家用車,1,0,0,0,0,0,0,0,,,,やんばるエリアには宿泊しない,使わない,"5,000円未満","5,000円未満","5,000円未満",6-10回目,半年以内,必ず来たい,半年以内,満足,,10,,ない,,うふやんばる(国頭村・大宜味村・東村),その他,ゆいゆい国頭,特になし,特に無し,,"5,000円未満",満足,,,8,,男性,1993,沖縄県,100-200万円未満,芭蕉布会館エリア,大宜味村,2026-02-06 15:21:49
5556,4935,3泊,"50,000円以上 100,000円未満","リゾートホテルを楽しむ,地元の美味しいものを食べる,名所、旧跡の観光,テーマパーク:沖縄美ら海水族館,その他",0,1,1,0,1,1,0,0,0,0,0,0,0,0,0,0,0,0,0,0,0,0,1,海を眺める,パートナー(恋人・夫婦など),,"観光パンフレット・ポスター,観光協会のHP,インターネット・アプリ",0,0,0,1,1,0,0,0,0,1,0,0,0,0,0,0,0,0,0,0,,レンタカー,0,1,0,0,0,0,0,0,,レンタカー,0,1,0,0,0,0,0,0,,大変満足,行きたい場所には車必須,3泊,"50,000円以上 100,000円未満","50,000円以上 100,000円未満","30,000円以上 40,000円未満","20,000円以上 30,000円未満",初めて,,やや来たい,3-5年後,満足,見たい場所がたくさんあり良かった,8,海,ある,観光情報やほか飲食買い物情報がとりにくい,なかやんばる(名護市・本部町・今帰仁村),古宇利島(オーシャンタワー/ハートロック),,特になし,特に無し,,"5,000円以上 10,000円未満",大変満足,研究が面白い,沖縄ならでは,10,,女性,1978,兵庫県,400-600万円未満,海洋博公園・観光拠点エリア,本部町,2026-02-06 15:23:36
